 October 2017,5,Paradise Perfect!,"Our first stay during our trip through Morocco was at L'Ma Lodge. We drove there from Marrakech airport, a trip that took approximately 5 hours. It was a beautiful trip through the mountains. When we arrived at the Lodge the owner immediately welcomed us. She has a very warm personality. The rooms are amazing, every detail has been taken care of. Great bathroom, furniture, accessories. The swimming pool is also great (a little cold for us!) At night the kitchen staff cooked us a delicious vegetarian meal: it was so good we took some left overs with us so we could eat it for lunch in our car the next day. It was a pity we only stayed at the Lodge for one night, we could have stayed for a week and enjoy their fresh dates, pomegranates and almonds a lot more! See you next time!"
 October 2017,5,"Excellent guest house, highly recommended!","We stayed here just 1-night as a pit stop on the way from Marrakesh to Merzouga. And we regretted not staying another night here almost immediately! Vanessa is a great host and greeted us on arrival, served us a brilliant welcome drink and showed us to the room. She gave us a short tour of the garden, pool and all the relaxing places the guest house offers. The garden was mind blowing and pretty much all the salads, juices and jams that were served at meals were home grown (even the olive oil was pressed in house)! Rooms were neat and clean, spacious and tastefully decorated. Dinner was a 3-course meal which was delicious, as was the breakfast of home made Moroccan pancakes and home made jams! We didn’t use the pool but were told it’s heated at night to a lovely 28-degrees.…"
 October 2017,5,Honeymoon relaxation with such a warm host,"While staying in Morocco for about a bit over a week, we saw so many wonderful things - L’ma Lounge was truly one of our favorite parts. Vanessa and her staff are very welcoming, the gardens and grounds are just incredible. We played bocce, had beers and ate snacks at dusk, in the morning hung out in the hammocks before the pool - just a dream! We stayed in some other ‘fancy’ places that on the surface were similar, but nothing compares to the authenticity of both the people and grounds of here. I’d highly recommend (plus we’ll definitely be back!). Thanks again Vanessa!"
 October 2017,5,Beautifully Designed Boutique Hotel,We enjoyed our 2 day stay in this charming boutique hotel. It is beautifully designed and appointed and the grounds are magnificent. The staff cannot do enough for you especially the concierge Soufiane. The owner was always there to welcome us with a smile every time we returned from a day out.
 October 2017,5,L'Ma Lodge is a true oasis,"We were on a 14 day trip through Morocco and our ""discovery"" of L'Ma Lodge in the middle of the trip couldn't have come at a better time. We spent 2 restful nights on a truly magnificent property with beautiful grounds and accommodating staff. Vanessa Rotsart could not have been a better proprietor looking out for our every need. We were originally scheduled for a 2 story room, but I had become a little under the weather earlier in the trip, so Vanessa made sure I was to be moved to a more convenient room. It seemed that no request was too much. I would highly recommend this wonderful property to anyone traveling to this part of Morocco (which should be everyone) Howard D."
 October 2017,5,Paradise in Maroc L'Ma lodge,"It is the absolute best place to stay in Maroc! A true oasis in Skoura. A very clean open kitchen with nothing to hide (great food), and a garden that will blow your mind! The rooms are beautifull and very clean! Staff is helpfull, flexibell and very kind. Special thanks to our host Vanessa we had a great stay! And thank you for the music 🎹🌴"
 September 2017,5,Restful and excellent service,"Spent 2 nights at this lovely property. Rooms were in a separate block from the main lounge/dining area. Nice pool area and gardens to walk through. Many lounge areas around the property..and hammocks! Outstanding staff and service here. Breakfast and dinner included in rate. Breakfast was a usual spread of cheese, hard cooked eggs, various breads ( crepes, fry bread, cake, buns) yogurt, juice, cereal and an amazing assortment of jams and condiments all made in house. I especially enjoyed the Strawberry & lemon preserves as this is a combo I make myself and have never run across anywhere else. Rooms were a reasonable size with a small lounge area. Shower was good with hot water and good pressure. In-room safe for leaving valuables. This would be a lovely family retreat for…"
 October 2017,5,An amazing place to stay in the Oasis!,"This was a wonderful place to stay......beautiful rooms, beautiful gardens and great pool. It is definitely difficult to find! However once there one has no desire to leave! Breakfast was great. The evening we were there it was tajine.......we would have preferred a choice of something else as by then we were tajined out! They do serve wine. Definitely recommend and would love to return!"
 September 2017,5,A beautiful oasis in the middle of nowhere,"We stayed in Skoura after camping out in the Sahara. As you approach the L’ma Lodge, you travel on some back roads through areas that you are thinking - “you must be kidding”. And then you turn into the lane and find the beautiful property. Before we were out of our car, the owner Vanessa was there to greet us. The rooms were beautiful as were the grounds and pool. They have beautiful gardens, citrus trees and date trees and vegetable gardens. Fresh food for our meals. I even spent time in one of the hammocks, having a little relax time before dinner. Food for for dinner was wonderful - we ate outside. Once again Vanessa was always around, making sure everything was okay. we had a nice bottle of Moroccan wine, which was reasonably priced. Breakfast was a…"
 September 2017,5,I wish we would have stay longer....,"What a beautiful place! Tastefully decorated all around. The accomodation was very clean and confortable. The garden impeccable. The owner and staff where very nice and the service was overall excellent. The food was particularly delicious we had a chicken tagine which we found to be the best of all the ones we had during our travels in Morocco, the dessert a fig crumble was so delicious. A generous breakfast was served buffet style. The palmeraie tour option was interesting and informative. Overall it a wonderful experience."
 September 2017,5,Paradise in the Oasis,"My husband and I only had two nights here and I wasn't feeling very well (travelers' tummy), but this place is spectacular. If I ever find myself in Morocco again I plan to stay at least a week and I will never leave the property. The owner is one of the loveliest and most gracious ladies I've ever met, and she has created a little island of paradise in the midst of the larger oasis. Inviting seating /lounging arrangements abound and cater to any desire you might have; be it falling asleep with a book on your chest, an intimate nook for lovers, cozy situations for small groups or casually comfortable places for larger groups. We took refreshing dips in the pool each afternoon and enjoyed the happy sound of laughing children nearby. Our room was spacious, well appointed and we…"
 September 2017,5,Hidden Gem,"We are 3 friends from Melbourne & Hobart, Australia. We stayed at L'Ma Lodge for 1 night between camping in the desert & Marrakech, on a nine day tour of Morocco. The Lodge could not be faulted. It was absolutely amazing! Our host, Vanessa, was friendly & helpful. She went out of her way to make us feel comfortable & it was as if we were guests in her home. The room, a queen & 2 singles, was beautifully decorated & exceptionally clean. Dinner was delicious & we were happy to see cornflakes on the menu for breakfast! There were of course many lovely Moroccan treats as well. We would thoroughly recommend this property."
 September 2017,5,世外桃源般的酒店 Paradise-like Hotel,"这个酒店非常不错。从花园庭院悠悠小径到别具一格的房间，都体现了这位漂亮比利时女主人的品位。酒店的环境安静优雅，房间干净而舒适，酒店的工作人员和老板很热情，早餐也不错。值得推荐。 This hotel is excellent. From the garden courtyard to the unique style of the guestroom, all reflect the taste of the beautiful hostess, the owner of the hotel. The hotel is quiet and has elegant environment, the room is clean and comfortable, the hotel staff and the boss are very nice, breakfast is also good. Worth recommending."
 September 2017,5,Excellent honeymoon stop off on our way to the desert,"After a long drive from Marrakech it was a real treat to step behind the walls and in to this wonderful oasis! The gardens are beautiful, the main house an interior design dream and the room just wonderful. The outdoor shower (as well as indoor!) was amazing! We loved the welcome drink, the dip in the pool and exploring the garden. We just wished we had spent longer to enjoy more! Dinner was great, catering for our veggie needs, as was breakfast. The staff team were excellent and the owner made sure she introduced herself and that we were happy. A great place!"
 September 2017,5,"A lovely place, excellent value for money!","My colleague recommended this place to me as her favorite of her trip to Morocco and it was a great recommendation! It is a beautiful property with a large, lovely garden owned by a Belgian couple. The owner, Vanessa, greeted us and spoke to us multiple times through our stay, making us feel special. She told us how they literally built the houses and grew the garden from the ground up so there is a lot of love here. There were only a few other couples there and we loved the tranquility of an afternoon at the pool and a DELICIOUS dinner (They have alcohol too). We got a suite on the top floor and the room was so clean and decorated to a high standard, we loved it. We had been looking at Dar Ahlam as an option in the area and I am convinced we got something just as nice at a…"
 September 2017,5,Amazing place,"Vanessa and her husband are the owners and our hosts. Amazing people, they have made there own oasis here. The room was lovely, staff are like family and go to great lengths to make you feel like family. Food is amazing and fresh, a lot fresh from the gardens. We were asked to have input into menu on our second night. Can not recommend this place enough. A must for any in the area."
 September 2017,5,Almost lost for words...Fantastic!,"I'm not sure where to start as there is much to praise about this beautiful place. My wife and I stayed here on two separate nights to break up a lengthy self drive journey into the desert, having discovered L'Ma Lodge by chance in a newspaper article and booking it based on the glowing reviews we found on the internet. It's probably the best decision we made on our first visit to Morocco. Initial communication from the owners, with driving directions, was within a week of booking. The owners, Vanessa and Xavier, have taken a rough piece of land in an oasis in Skoura that contained nothing but a few palm and olive trees and they have turned it into an absolute treasure. The attention to detail is evident everywhere. They have created a beautiful garden with relaxing lounging…"
 June 2017,5,Amazing little escape on way to desert,"Our travel agent Blue Men of Morocco suggested l'ma when we didn't love the lodging options in quarzazante to split the trip out to the desert. I am so glad she did. From the moment we arrived, we loved L'ma. Vanessa, the owner, was so kind and gracious, as were all the people who worked there. Felt more like friends than staff, but super attentive friends. 😉When we arrived the first night around 5pm, we saw the property and were so bummed we had to leave at 9am to go to the desert that we contacted Blue Men and talked with Vanessa to arrange a return to the property the night after the desert. That night she put us in a room in the riad with an outdoor shower. So lovely! And when we returned from the desert around 3pm, we sat by the pool all by ourselves for hours. Felt like…"
 June 2017,5,Fantastic place!,"In the middle of the palmerie is this fantastic lodge, the perfect place to relax after a day out exploring. Saufiane and his team were extremely friendly and gave us tips on what to do and where to go. The garden were luxurious and the pool area was great; the room was spacious and clean; the food was superb. I will definitely go back!"
 June 2016,5,Day Dreaming,"When I think back on my trip to morocco it is L'Ma lodge that I daydream about. Arriving to the oasis after coming across the desert this lodge is nothing less than a dream. The rooms were beautiful and well appointed, wifi was only available in the communal lodge area and was slow but there is plenty to do other than be on the Internet. We spent the day by the poorelaxing, and another exploring the local Kashbah with a local guide. Watched the sunset over the palm grooves on the lodge roof. The food in the restaurant for dinner and breakfast was some of the best I've ever had. Never have I seen so many types of honey. If Morocco is in my future I can assure that L'Ma lodge will be as well."
 May 2017,5,Perfect holiday location,Great experience! The owners built a true paradise in the Skoura plantation. The team of people working in the hotel make it an amazing experience to stay in the hotel. A true recommendation for everyone!
 May 2017,5,Beautiful oasis in an oasis,"We had only one evening at this gorgeous place. It was not enough. The owners have created a remarkable environment with fantastic food and delightful rooms. We surprised ourselves by sleeping with the windows (fully screened) open and the fan on but no air con. We don't like hot weather so that is not something we typically do but there was a subtle message about saving energy that got to us and it was lovely to hear the nightlife and the birds in the morning. (You actually have to ask for the remote for the air con unit which was just enough of a disincentive for us and it worked.). The staff were all, to a person, friendly and helpful and very comfortable with their roles and proud of their Lodge. We were shown through the garden where they grow a lot of the vegetables…"
 May 2017,5,Surprising find,"This small charming hotel was a welcome relief after a long drive across the center of Morocco. The rooms were generous and charming. The service was outstanding and the chef obviously cares about his cooking! The food was among the best we had in the eastern half of the country. Vanessa, one of the owners, paid particular attention to the details. Lovely gardens as well."
 October 2016,5,Relaxing spot in Morocco,Wife and I stayed in a wonderful room here at L'ma Lodge. The pool area and gardens were highlights of the beautiful grounds that are instantly relaxing. Food was excellent and the service was even better.
 April 2017,5,Full Service Relaxation,"Our group of 5 women had just spent 2 days in the desert, where we'd been in a sandstorm. We were gritty and tired after a long drive from our desert encampment. From the gracious greeting by the owner, to the pure pleasure of wandering through the cool gardens on our way to our spacious, airy rooms, we knew we were in a special place. The dinner, most or all locally grown, was perhaps the best we'd had anywhere in Morocco. Designed, planted and built by the current owners, this oasis lodge is truly a gem. We wished we could have spent more than one night there, recharging our batteries, for the next leg of our travels."
 May 2017,5,A True Oasis,"A very unprepossessing drive in but then the gate was opened and instant calm and beauty lay before us! Beautifully built and decorated with wonderful gardens and relaxing nooks with rugs and cushions abounded. Wonderful friendly welcoming staff and owner as well as a delightful family of cats and kittens! We had one of our best dinners here, fresh salad, tasty dressing, flavoursome moist tagine and delicious dessert with a very nice reasonably priced wine.... could be the French influence! The room was like a 2 bedroom apartment without a kitchen, king bed, great shower all the bath accessories, and wonderful bed linen! Nice breakfast with the biggest collection of homemade jams. Highly recommend."
 April 2017,5,A Gem in the Skoura,"L’ma Lodge is a true gem in the Skoura and we were so fortunate to have discovered it. We weren’t too sure what to expect as the pictures on the hotel website are not too descriptive. Upon arrival we were pleasantly surprised to find what feel like a personal oasis; a beautiful and welcoming haven. We were immediately greeted by Vanessa, the owner of the hotel and other staff members who quickly made us feel at home. The property is filled olive and fig trees, roses, palms, and other edible plants that are used on a daily basis at the restaurant. The owners have done a great job at creating many tasteful nooks throughout the property with hammocks; lounge chairs, rugs, cushions, and lanterns - giving the place a very stylish and cozy feel. If you go, don’t miss the…"
 April 2017,5,fabulous!!!!!!!!!!!!,"what's not to love about this property. The beautiful living /dinning area , the luscious gearden, the perfectly appointed rooms, the friendly helpful staff and owner?!?!?! this is located in the middle of the oasis crazy little roads to get to it, then you arrive and is a mirage. GORGEOUS! They grow all kinds of fruits olives dates spices which they use in their kitchen. I saw the date palms and i asked if thry give fruit, well @ diner they bought me a bowl of dates beacuse the owner remembered i had mentioned it. I SO RECCOMED THIS PLACE. I stayed @ La Mamounia in Marrakech and this was just on par with them really! i mean i a smaller scale but oh i cant stop thinking about it> at night the home cooked meals are superb(* included) .. even homemade ice cream. 5 stars all…"
 September 2016,5,perfect place to stay,l'Ma lodge was fantastic . we only stayed one night but wanted more . it is tucked off the main road but its worth the short drive . It is a perfect oasis with great staff and marvellous garden and a relaxing and welcoming pool Rooms are very generous and the restaurant for both breakfast and dinner was great . Its feels more like a home than a hotel and is very very welcoming
 March 2017,5,What a wonderfully relaxing stay,"Both me and my wife spent a night at the Lodge. From our arrival to the departure, the Lodge remained quite a remarkable and relaxing place. The owner - Vanessa - took pains to welcome us and showed us around the features of the Lodge and finally brought us to our room. Her attention to detail is evident in the design and layout of the garden and its various resting nooks. The room is well provisioned and very comfortable. From the welcome tea to the dinner and breakfast, all was well thought out and unique wonderful. The dessert after the dinner - lemon milk - is something we will remember for a long time. Vanessa was kind enough to share the recipe with my wife. To see Vanessa wave us off when we left was quite a warm experience. Though we came as visitors, we felt we left…"
 March 2017,5,An oasis within an oasis,"We overnighted at L'Ma Lodge en route from the desert, but wish we had at least an extra night to enjoy here. The lodge is beautifully designed with lovely peaceful gardens. We had dinner and breakfast, and both meals were excellent, with great service and very friendly staff. The owner takes the time to introduce herself to guests which is a really nice touch. It's a relaxed atmosphere, and guests are encouraged to step into the kitchen to check the evening's menu and meet the chef. If we get back to Morocco I'd plan a couple of days here to escape the Marrakech insanity!"
 March 2017,5,Lovely retreat in a desert oasis,We spent 2 nights here early March 2017. This place is stunning! The owners have built a gorgeous retreat with exceptional gardens & outside rooms decorated with Berber rugs and pillows. The pool is beautiful. The dining area is lovely with a 360 degree fireplace. Food was excellent. This is an ideal place to relax after visiting the Valley of the Roses nearby.
 February 2017,5,AN OASIS THAT YOU WILL WANT TO STAY FOREVER,"We stayed one night at L'Ma Lodge while doing a private tour from Marrakesh to the sand dunes. The lodge its a stylish beautiful retreat where you could easily spend various days pampering yourself in a tented spa, swimming in the pool and enjoying the beautiful gardens. The rooms are tastefully decorated to the smallest detail. We were warmly welcomed by the Belgian owner who makes you feel at home (thank you very much!) The lodge is a perfect place for families as well as a lovely retreat for couples. In short it is a paradise!!"
 February 2017,5,Subtle Artistic Gracious Retreat,"Very beautifully designed main Lodge , spa tent, and Riad with about seven rooms and suites. Vanessa and her welcoming team take beautiful care of you from the moment you arrive. They welcome families with children. The approach a is simple rural dirt road and then ...surprise...you arrive at an oasis of peace and beauty. Fantastic rooms, dinner, wine, breakfast and a great night sleep, but best of all the garden is interesting and a peaceful to sit ...there is a beautiful pool. Vanessa has a wonderful creative eye for decor and gardening. She and her husband have created a very special place. I hated leaving and long to return."
 February 2017,5,"Excellent retreat, oasis-like stop on the route to Zagora or Dades Gorges","We wanted to explore the eastern, more desertic aspects of Morocco, so from Marrakech we travelled across the Atlas mountains, visit Ait Ben Haddou and Telouet Kashba and the arrive to L'Ma lodge, a totally charming place to stay and take a break from the long drives through the different surrounding valleys. The food was delicious, the personnel very attentive specially the manager, Soufiane; the living and dinner rooms very cozy and comfortable, piano and chimney included, plus gardens with bereber-relaxing-rugs and cushions settings below the trees, truly welcoming!!!"
 January 2017,5,An oasis of travel tranquility!,I visited this hotel with friends in January after our Moroccan desert adventure and this hotel was a perfect place to prepare and relax before the madness of Marakesh. The lodge was exceptionally styled offering the perfect mix of classic Moroccan style and European sofistication. The lighting was calm and soothing and the many nooks and crannies within the garden would be an ideal retreat to relax for a few days. The dinner was perhaps my favourite throughout my whole two week stay in Morocco an exceptional home cooked Euro style Moroccan fusion Tagine with a delicious salad home grown within the gardens. Breakfast included a number of home made jams and preserves and fresh hot coffee. The waiter at breakfast was surly and abrupt however this was a minor bump on an…
 January 2017,5,Didn't want to leave!,"L'ma Lodge is truly a hidden gem. You would have no idea that you were going to arrive at such a place when you are driving down the narrow lanes to get there. Once the gate opens you realize you are in a touch of paradise. Vanessa, the owner, had exceptional taste in decor and she and her partner have created a beautiful retreat in the middle of the Palm grove. The design of the interiors and the gardens is fantastic. I loved walking around just looking at all the design touches. The welcome was lovely with a pot of tea and some yummy sweets. The rooms were stylish and very clean. The food was excellent and the kitchen was very accommodating of our allergies. It was so relaxing to sit in one of the many areas outside and read while listening to all the birds. The…"
 January 2017,5,Garden Oasis,"This beautiful hotel has the most delightful large outdoor private garden. There are many areas to sit and relax on chairs, cushions, hammocks in beautifully landscaped arrangements. The outdoor pool looked lovely. The buffet breakfast included 15 types of homemade jams and preserves that were the best we had on our entire trip. They also had crepes (Moroccan & French), breads, cereals, fresh fruit, yogurt and eggs. Rooms were quite nice and beds very comfortable.Service was warm and friendly."
 January 2017,5,Enchanting getaway,"L'Ma Lodge is a very special small retreat lovingly created by the talented, gracious and welcoming owner, Vanessa LaGarde. Handmade signs direct you down a small unpaved road through an oasis of orchards to the beautiful lodge. The gardens, suites and terraces alone are extremely attractive, but in addition there are beautiful intimate spaces inside and out for relaxing and reviving from trips in the Atlas Mountains. On top of that, the incredibly fresh organic food is mostly grown on the property and beautifully and inventively prepared. The staff could not be nicer. Very highly recommended."
 January 2017,5,STUNNING,"This place is amazing. Out of Architectural Digest. No detail was spared. A group of 5 of us from NYC stayed here and, while only here for one night, it was a gorgeous oasis. The food was spectacular and the staff fantastic. STAY HERE!"
 January 2017,5,Beautiful lodge!,Stayed at L'Ma Lodge on our way to the Sahara. Vanessa and staff was friendly and made us feel at home. The lodge is located on beautiful grounds. The rooftop has great views! The dinner was delicious. Thanks for your great hospitality!
