 November 2016,5,admire the garden,"the creators of this property get many kudos first they had to imagine a guest lodge and accompanying facilities and locate it in what was then an ordinary palm grove. then they arranged gorgeous plantings, creative settings, and lots of fun activities. a surprise awaits around every bend in the path. of course, good food, good service, and a friendly atmosphere combine to make this place magical"
 December 2016,5,A Pleasant Surprise,"My staying here was part of my tour package and I was pleasantly surprised. The staff and Vanessa were so friendly and made me feel at home. The food was so wonderful and so were the Riad's grounds. I woke up early and went to the roof top to watch the sun rise. I hate that I only had a one day stay, but I am definitely coming back. This place does not disappoint!"
 November 2016,5,Secluded paradise lodge near Skoura,Great accommodation and a fine hotel with spacious bedrooms in a great green setting. The restaurant and the grounds around the lodge are really welcoming. Secluded and quiet this hotel is really nice and has a real sense of space and tranquility.
 November 2016,5,"L'Ma Lodge, a really lovely experience",Vanessa and her staff were very friendly and helpful. The riad is quite enjoyable with lovely gardens and a fine looking swimming pool. A great place to stop if you are in the area and looking for a relaxing experience.
 November 2016,5,Wish we were there longer,"Everything about L'Ma is perfect. We loved the personal welcome from Vanessa and then the coffee and tea which we so needed after our long day of travel. The dinner (we had requested a vegetarian meal) was one of the best we had on our 12 day trip. I am still remembering the organic locally sourced salad and the Berber omelette, The main house has the dining area and currently the wifi, We were informed that the lodge with the rooms will have wifi shortly. The rooms are very well equipped and the setting with the gardens and terrace with Atlas Mountain views are just perfect. We will have to return for a longer stay."
 November 2016,5,An amazing oasis!,"The minute you enter the gardens and grounds of L'Ma you feel relaxed. The rooms are beautiful and comfortable, the main house is fabulous, the breakfast had an amazing level of choice of fantastic food, the service was great but best of all is the gardens, the sound of the birds, the fountains and the grounds. Our driver told us the last guests he had decided to cancel their tour and just stay at L'Ma. I understand why- it would be very tempting."
 November 2016,5,Very charming and relaxed,"We had a very warm welcome with our baby of 1,5 years old. They have a beautiful garden with several relaxing hang outs. The central living room is Very cozy with a nice fireplace in the middle. The rooms are tastefully decorated with one of the best beds we had in Morocco. It is very clean. The food is very good. Moreover the staff is very professional, super friendly and also very lovely towards children. We felt like at home the 3 nights we stayed here. Thank you very much Vanessa, Xavier, Sofian, Brahim and everybody else for this memorable visit."
 October 2016,5,A paradise for parents and children,"What a place! We loved every moment in L'Ma Lodge, fantastic welcome by Vanessa & Xavier, discovery of a wonderful garden and perfectly warmed pool, delicious meals, lovely rooms, fantastic roof terras, super friendly and efficient staff, all this in an amazing environment, what a treat! Our young children had an amazing time exploring the garden and the palmeraie. We wish we had foreseen more time at L'Ma lodge, we will be back!"
 October 2016,5,Very relaxing and attractive place,"We only were able to spend one night but found this to be a wonderful and unexpected spot in the middle of an oasis, beautifully decorated, with delicious food and a warm atmosphere. The staff was extremely accommodating and gracious."
 November 2016,5,Paradise on earth,"This is a real oasis of peace,beauty and comfort! The lodge is a newish building decorated with a fresh and modern maroccan taste. You can feel the attention to details and passion that Vanessa and her husband (the owners) put in this project! Apart from the very comfortable room, with European level of comforts (hairdryer, toiletries, towels, etc) they offer a magnificent garden, with swimming pool, petanca and space to chill out. Breakfast was included and showed some 15 different types of jams and confits, all homemade with locally grown products. Plus homemade pancakes, plumcakes, bread. And juices, yogurts, cornflakes! Dinner was excellent too. Again everything locally sourced and fresh."
 October 2016,5,Exceptional beauty and comfort!,"We stayed two nights, would have stayed longer but Lodge was fully booked. Vanessa is a superior hotelier and hostess. She and her husband have created a beautiful walled retreat that combines the natural beauty of this locale with traditional Moroccan style and a vibrant modern aesthetic. The food and service are both exceptional; all the staff were friendly, helpful and really professional. Vanessa checked in on us regularly but discreetly, and arranged drivers and things to do during our stay. The pool is gorgeous, and the garden, rooms, common spaces are all exquisitely designed and maintained. Better lighting than in most places, which is a plus for aging eyes! Small details that represent the kind of attention and care that Vanessa puts into the Lodge: a selection…"
 September 2016,5,"Wonderful, a true oasis","A desert gem, the owners have done a phenomenal job creating an almost completely self-sustaining oasis. While a guest, you can enjoy countless areas to rest and relax under the shade of trees or on assorted blankets and pillows. The main house is comfortable and airy, the grounds immaculate (the fruit laden trees beg you to pick something, but you'll be reminded not to since they use what they grow--including all the olives from which they make oil). In the morning there were >15 kinds of home made preserves, jams, and jellies and, while we wished there were warm eggs, the volume of choices meant everyone found something delicious. Meals were great, service kind, and my husband and son loved the pool. Wish the curtains were a little darker at night and the sheets a tad softer,…"
 October 2016,5,Paradise in the Moroccan desert,"We stayed for one short night and wished it had been a month --- an enchanting oasis of calm, beauty, hospitality done in great style. Vanessa's garden is a soothing refuge and the meals were delicious. The property seems worlds away from the unforgiving desert environment. This is a very special place offering a memorable and unique experience in Morocco."
 October 2016,5,One Night is Not Enough,"We only had one night at L'Ma Lodge, and it was not long enough! Fantastic service, from the moment we arrived through to the moment we left. The room, the grounds and the lodge itself are impeccably clean and well cared for. Vanessa and the entire staff made us feel welcome and at home. A true oasis in the middle of the desert."
 October 2016,5,Hard to imagine being better cared for!,This is a lovely oasis of comfort and ease. From our greeting at arrival to our hugs at departure we had a wonderful stay. Vanessa and her team have created an oasis in the middle of Morocco. My only regret is that we didn't have longer to stay.
 October 2016,5,“Wonderful location to relax and recharge”,"We highly recommend the L'Ma Lodge as a outstanding destination for one night or a week. The lodge had efficient and first class systems (fixtures, ceiling fans, A/C,etc), beautiful gardens/pool, roof top areas and Moroccan. Most importantly the owners, Vanessa and Xavier, welcome their visitors as friends rather than hotel guest. Jim and Sue King"
 September 2016,5,home sweat home in a little piece of heaven,"A little piece of heaven. Your feels like at home and part of a great family at this Lodge. everything is done to make your stay magical. Great staff, great host, wonderful place and great food ! The best place I have ever been so far ...believe me you won't regret it !"
 September 2016,5,A fantastic place to chill.,"A fantastic haven of tranquility great interior design and amazing gardens. The staff only add to the experience of the relaxed comfort that Vanessa and Xavier have created here at L'Ma. A recipe for a successful business has definitely been created here, with care and attention to detail."
 April 2016,5,What an oasis of piece and friendliness in the desert of Morroco,"We stayed here 6 nights because we wanted to have a sort of city trip and to enjoy the environment of Skoura and also because we read the good comments of L'ma lodge. We wanted to travel with our grown up children and their 2 boyfriends because 1 of them was running the Marathon des Sables (MDS) at the time. As we are also traveling with a wheelchair... the combination of people and questions we had made us mailing and mailing with Vanessa…. in the weeks before. Oh...lots of mails and questions an she was so friendly all the time and helped us with everything. In the end we had to cancel the 2 rooms for the children (unfortounately) but still, this was not a problem! So we went only with 2 persons for 6 days and it was like coming to a family! We had a beautiful time! The lovely…"
 October 2016,5,A real oasis,"This was a dry, barren soccer pitch 8 years ago before the owners took it on and grew a spectacular garden with quiet peaceful nooks and social gathering spots. A tasteful layout, sumptuous vegetation, warm welcome and delicious candlelit food on the terrace."
 September 2016,5,Very nice and beautiful Hotel with large garden.,"Very nice and beautiful Hotel with large garden. Delicious breakfast and dinner. Staff is nice. Hotel is also serving beer and wine. Large and beautiful rooms in oriental style. Hard to find, so view an map before visiting."
 September 2016,5,Best stay in Maroc!!,L'Ma lodge is a fantastic place to stay! The rooms are absolutely fabulous and super clean! The garden is even more beautiful! So much eye for detail! It was by far our best stay in Maroc! Vanessa the owner is a lovely person! Her staff is Super friendly And helped us with eveything! Dinner is great And also the wine was very good! Hope to come Back Some day!!!
 September 2016,5,Paradise,"It's hard to know where to start on the good things to say about L'Ma Lodge: magical garden, beautiful rooms, fantastic food, super-friendly people. The garden is bigger than it looks on the website. It is full of date palms, fruit and nut trees of all sorts (pomegranates, almonds, olives and many more), gorgeous grasses, roses, vines, vegetables and herbs. The garden is laid out beautifully to create private corners and hidden places; where you'll find a hammock, or a shelter, or cushions and carpets to relax on. Lanterns give it a magical aspect in the evenings. There is a fantastic boules court, shaded by overhanging trees, and a lovely swimming pool. Exploring and spending time in the garden was an absolute delight. Such a delight that it was a struggle to persuade anyone to…"
 May 2016,5,A Secret Garden in Skoura,"We did not know what to expect at L'Ma and were absolutely blown away. After hours of driving in the dusty desert and transferring to an SUV to navigate the dirt roads in Skoura, we arrived at L'Ma lodge. The grounds are an absolute paradise filled with all sorts of plant life and birds. We truly felt like we had found an oasis. The staff was wonderful and welcoming, the food was delicious (they had over 20 homemade jams at breakfast!) and the lodgings were elegant and comfortable. We only had less than 24 hours there (we spent the night between the desert and Marrakch) and both my husband and I wished we could have stayed for at least another day just to enjoy the lodge. It was so peaceful and the perfect stop for weary travelers or anyone looking for a little nature and rest…"
 September 2016,5,Excelent place,"We are a 11 people group of family and friens and we had a great stay. The hotel is beautiful, with excellent taste. The garden is a marvel place to rest, read and get together, we were superbly received. Dinner was very good, five stars! Congratulations! and thank you to the whole team!"
 September 2016,5,A Gem in Morocco,"We are travelling from Marrakech to the Sahara and were recommended a place in Ouarzazate, the Moroccan movie capital, but fortunately we had done some homework and decided to travel the extra 40kms to L""Ma. It is the most gorgeous and friendly B&B we've ever stayed in. Vanessa the hostess was just wonderful and really helpful and had created this oasis of calm and beauty. Hard to believe when you drive through some of the surroundings but it was just so relaxing and enjoyable. The pool, the rooms, the lovely chairs and tables outside were all a welcome relief at the end of the day and the cooking and meals outside were superb. Can't speak highly enough of both the setting and the people."
 August 2016,5,The Secret Oasis,"After 7 hours driving from Merzouga, a bad night sleep in the tends in beautiful Sahara, we could never thought we would have a reward like this. The place is absolutely amazing, quiet and full of cozy details spread around the property. The food is amazing and last but not least, we found the best staff of all. Everyone is helpful, kind and nice, specially the greatest Soufiane. He is the best host. We forgot something in the Hotel and the owner and Soufiane are trying really hard to send it to us. We will come back. ""Queen and Ernest"""
 August 2016,5,Paradise in Marocco,We stayed at L'ma Lodge for two weeks in August and everything we experienced was just perfect. The place is so very beautiful with many extraordinary beautiful little extras that make you feel the love the owners and staff feel for it. All the staff members were exceptionally loving and caring but at the same time left us enough space to make our own experiences. We felt like home at once as we entered L'ma Lodge and can only recommend. Skoura is a very interesting place to visit and L'ma Lodge makes your stay better than you could ever imagine. We feel very thankful for Vanessa and Xavier sharing their paradise with us.
 August 2016,5,Best stay in Morocco (or ever)!,"This is a genuine paradise in the middle of the Oasis. I felt like home. A place to let your soul and heart wander and be in peace. The athmosphere created there is with such love to detail and at the same time easy and light. The staff is wonderful, so attentive and empathic and will do everything to make you happy - and you feel that this is purely authentic and not because they have to."
 June 2016,4,Particularly nice for the decor and grounds,"We stayed two nights at L'Ma. The grounds are beautiful and well maintained, the decorations in the house and guest room are delightful and well chosen. Soufian, who works there, is helpful and kind, and the pool is warm and inviting. The seating on the pool deck is not particularly comfortable. The food we were served for breakfast and dinner was wholesome and above average. While we loved the design of our room, the sound proofing left a bit to be desired--we spent little time in our room but while there one late afternoon, there was quite a bit of noise--ukulele playing from another guest room and what sounded like night stands being dragged across the hard floor for almost an hour in the room directly above us. We'd requested an upper room but weren't given one. Wifi is not,…"
 June 2016,5,Paradise we found,After spending a fun but exhausting night camping in the desert we were lucky enough to spend the next night being pampered at L'ma Lodge. Wow this place is amazing! The most beautiful setting and staff. Although only spending one night there we left feeling rested and relaxed. Vanessa has done a wonderful job with this resort. It's a special place.
 May 2016,5,an oasis in the desert that refreshes your body and spirit,"All your senses are satisfied when you stay here. Vanessa, the owner is the queen of hospitality. Personally welcoming you and overseeing every detail of your stay from the huge assortment of delectable spreads and accompaniments for your morning crepes to the luxurious creams and lotions for your bath. Stay in the room with the outdoor shower . She and her staff are lovely, wanting to make sure you are absolutely comfortable and content. Did I mention that the rooftop is covered with Berber rugs and pillows for relaxed viewing of sunset over the Atlas mountains? When you get bored of that peaceful spot you can head over to the pool which is surrounded by lush gardens including a small wheat field that provides grain for the bread that is made daily and is served with argon…"
 June 2016,5,Wonderful Place to stay,What a surprise. Off the beaten path is a beautiful resort. You need to see this place for yourselves. Amazing and stunning. The pool is wonderful and the food is top notch. It's worth checking out if in the area or passing through. 5 star lodging.
 June 2016,5,Amazing Lush Retreat,"Incredible property. We spent one night after our stay in the desert, before heading to the Atlas Mountains. The owner greeted us as soon as we arrived, and she made us feel very at home throughout our stay. We got lucky and were the only guests the night we arrived so we had the beautiful facilities (great pool, amazing gardens, endless hammocks) to ourselves. The food was also some of the best we had throughout our stay in Morocco - of particular note were the lamb tagine for dinner and array of delicious homemade jams for breakfast. Highly recommend staying here, we hope to be back!"
 March 2016,5,Wish we had booked more time here!,This is a beautiful spot in the middle of an Oasis...literally. We only had one night but wish we had booked a couple. The owners were wonderful and the place beautifully decorated. Both dinner & breakfast we great.
 March 2016,5,Paradise in Morocco's best Palmerie,"There's nothing like home (luxurious one) in the midst of your travels in Morocco. Everything was perfect at the Lodge! The ultimate hosts Vanessa & Xavier, designed/made/refined all the details to afford a true oasis of beauty: most comfortable, lovely room (ours upstairs), the private nooks of quiet (hammock under the palms), the exquisite dining room with gorgeous Moroccan food (breakfasts are sumptuous) & service, and the tranquil setting around the pool. We could easily stayed for a week (great value for the money) using L'Ma Lodge as a base to explore South Morocco, from the desert to the mountains to the sea, all within a day's drive."
 June 2016,5,Totally delightful!,"Staying at this beautiful site for only one night was a tease! We were sorry not to have more time with Vanessa, the gracious host, in the serene setting of her meticulously constructed lodge. Her welcome was warm, the pool was wonderful, the rooms were spacious and well appointed and both dinner and breakfast were delicious. It would be delightful to return for a more lengthy visit someday!"
 May 2016,5,You'll want to stay here longer!,"Do you know those places where the pictures are always better than the real deal? L'ma Lodge is the complete opposite! Pictures do not begin to capture this hidden gem. We travelled through Morocco for 3 weeks and L'ma Lodge was definitely the best accommodation we encountered! The lodge and it's lovely hosts offered an oasis of peace and greenery that we had been longing for whilst travelling through heat and sand. Every detail is taken care of and you can feel the love and passion that has been put into this place. Walk through the palmeries, take a relaxing massage, get your own local guide and explore or just be.. We ended up extending our stay because we did not want to leave. A big thank you to Vanessa and her wonderful team (Yes, especially you Soufiane :-)) for welcoming…"
 June 2016,5,What an awesome oasis in the desert!,"We stayed at L'Ma Lodge for one night as part of a guided tour from Marrakech to the desert. What a surprise! The drive into Skoura was a bit dodgy, but once we arrived, the property was awesome. Vanessa, the proprietor, greeted us with warmth and personal attention. She explained how it took 5 years to build the property from scratch and how she planted all the trees, flowers, fruits, and vegetables around. The garden was truly beautiful and relaxing. The pool was great, and there are tons of lounge areas, hammocks, and pillows lying around. The aesthetic was great and we felt instantly relaxed and at ease the second we checked in. Unfortunately, we were able to only stay one night, but it was a great experience and really I can't imagine a better place to stay in the area."
 June 2016,5,An Oasis Worthy of Lingering,"I cannot say enough good things about L’Ma Lodge. This property is a tropical oasis of tranquility and comfort. The pictures do not do it justice and I wish we had more time to stay here. The owner, Vanessa, has created a beautiful, lush oasis in the middle of the Moroccan desert. The pool is inviting and surrounded by loungers, hammocks, and complimentary straw hats. The main building and the guest room building were built by hand by Vanessa’s husband and local residents, and are new, pristine, and simply stunning. Our room was gorgeous, with smooth clay walls, lovely tilework, warm wood accents, and views of the surrounding palm groves. We had a small balcony and both an indoor and outdoor shower! You could tell that every fine detail was carefully thought out, from the…"
 April 2016,5,Stunning!,"I only stayed one night and wish I could have stayed more! Beautiful garden oasis with swimming pool and lots of separate chill out spaces like a Berber tent, hammocks and seating areas dotted about the garden. The service is great yet you still feel relaxed and at home and the rooms are very tastefully decorated and spacious. I had the pleasure of an outdoor shower with a view over the oasis in my room. Owner is really friendly and interesting and the food is very good. Highly recommend!"
 June 2016,5,A Gem in Skoura!,"We stayed one night at L'Ma on our way from the desert to Fez. The grounds are stunning with trees, flowers, vegetable gardens, pool, and petanque court with comfortable seating in shade throughout the grounds. The owner was wonderful and breakfast and dinner were excellent. We were sorry we could stay only one night as a second night of relaxation would have been wonderful after being in the desert for several days."
 June 2016,5,Oasis plus petit agritourismo,Owner Vanessa has a wonderful eye and exquisite decor. The lodge had many outside nooks for relaxing as well as heated pool. Plus she has many fruit trees and surrounding land where she grows much of the that is served.
 May 2016,5,breathtaking! Literally an Oasis in the desert!,"I cannot say enough about how beautiful this place is. It really is like an oasis resort as it has a pool, bocce ball and tonnes of hammocks and little spots to sneak away too. The gardens were completely designed by the owner Vanessa and is a sight for sore eyes! loved all the rose bushes, olive and date trees in the area. Had one of the best beef tagine of my trip here and the aubergine salad was to die for. The rooms are gorgeous and loved how they included arts and crafts from that area into their overall design. There isn't much to see around the lodge but the owner had offered to drive me to the market place and/or town. My goal was to read and relax and it fit the bill completely. I would definitely go back again."
 May 2016,5,Beautiful! Beautiful! Beautiful!,"L'Ma was a wonderful place to spend the evening and get a good night's sleep before we move on to Arfoud, but we would have loved to stay longer. Located not far from Ouarzazate, L'Ma Lodge is a lush and tranquil haven. Everything was wonderful, the owners and staff were friendly and accommodating, the food and wine fabulous, the gardens beautiful and the rooms tasteful and comfortable. Whether you are staying one night or several - I highly recommend L'Ma Lodge."
 May 2016,5,Spectacular,"This small hotel located 1 kilometer down a dirt path is gorgeous. Vanessa and her family built the facility and provide superior service. It's a place to relax and enjoy the fine food and surroundings. Wonder around the property and see what's growing that may be part of your next meal. Most of the food is sourced on the property or from neighbors. Wifi was available only in the main building, not the rooms."
 May 2016,5,Heavenly! You won't want to leave.,"L'Ma is a wonderful retreat -- completely hidden and unexpected. It's a haven - with lovely outdoor areas, beautiful rooms and an extraordinary staff that can't do enough to be helpful. It's all a tribute to the owners - who created it from their imaginations. It's entirely Moroccan in style and spirit, but with contemporary touches that enhance the experience. Vanessa is a wonderful host(ess), whose spirit is evident in every corner. And as a bonus, the food is truly superb. After spending three weeks in Morocco, we can easily say this was the most satisfying place we stayed. You'll be giving yourself a treat if you stay here."
 April 2016,5,Relaxed stay with great food,"This Lodge had a relaxed atmosphere with attractive garden setting, pool and alfresco dining. Set in an oasis, and very private, it had wonderful food, both traditional Moroccan and some innovative dishes. We were able to have a cooking class with Chef. A valuable experience. A most enjoyable stay."
