 January 2023,5,An oasis inside the oasis!,"Perfect stop for 1 night (or 2 or more!) travelling from Merzouga desert to Marrakech. Top service on accomodation, simpathy and restaurant with good swimming pool for hot days or a cosy fireplace for cold nights!"
 May 2022,5,Our vacation from the vacation,"There were six of us who stayed here and we all LOVED it. It was the perfect oasis after a long day of van travel from Marrakech. The grounds are a rich oasis of palm trees, flowers, a vegetable garden, grass and other greenery which instantly helps you unwind and relax. There are numerous great sitting and lounging areas to enjoy, as well as a few animals who you can feed and visit. We enjoyed lounging and swimming. The two dinners and lunch where delicious and they were able to accommodate my daughter with Celiac Disease. They also very generously made me a delicious birthday cake since I celebrated my birthday during our stay. The rooms were clean and nicely appointed. Book early if you want to stay here as it's small. Vanessa for patient with all our questions. She arranged…"
 December 2022,5,Amazing experience in the Skoura Palmerie.,"This is a fabulous place, a real oasis in every sense of the word. Vanessa is a wonderful host, making sure everyone is welcomed and has the visit they want. The three rooms we used were beautifully decorated, comfortable and warm (it was December) and the food was exemplary. The breakfast was wonderful, with a huge number of homemade preserves and the evening meals we had were really tasty, with the addition of delicious Moroccan wine. The staff were all wonderful without exception. We followed Vanessa's advice to drive up the Dades Gorge, which was stunning and had a short walk in the oasis too. We couldn't fault the whole experience and we're definitely coming back when we can use the gorgeous pool."
 November 2022,5,Wonderful and beautiful,What a simply beautiful place to stay - every detail has been thought about and the result is a beautifully comfortable environment - inside as well as the grounds. We only had one night but would love to come back. We had a wonderful dinner and breakfast. Just great!
 November 2022,4,Retreat atmosphere you must stay longer than 1 short night to take advantage of property,Beware very hard to find especially after sunset. However the property itself is lovely. You really need to spend 2-3 nights to take advantage of what is offered. We arrived late due to difficulty finding property signage is only lit up by your headlights. Had a lovely dinner and then straight to bed. Some issues with electrical outlets- my travel CPAP kept shutting down and you can not have phone and watch plugged in at same time. Lovely gardens to explore when you have more than 12 hours!
 November 2022,5,12 women had an EXCEPTIONAL stay!!,"As the owner of an all female travel event company, where we sleep is always the most important consideration. Vanessa has created one of the most magical and beautifully decorated spaces. We actually had to cancel one of our excursions because no one wanted to leave the resort. Additionally, the service could not be more top notch. They thoughtfully remember who is vegan, gluten free, and all other needs of their guests. Skoura is a precious place ... be sure to engage in the local experiences (i.e. tourist free) that L'ma will arrange for you. I would book this hotel again in a heart beat!!!"
 October 2022,5,A Paradise Guest House,"We knew the minute we arrived that we had chosen the most wonderful accommodation, located in a garden oasis! Upon arrival we received the warmest welcome and our entire 2 days were filled with awe and joy to be in such a very special setting. Vanessa and Xavier are the most delightful “hands on” hosts. Everything from the beautiful immaculate suites, the gorgeous exotic gardens, the heated swimming pool and delicious breakfasts and dinners were absolutely exceptional. It was extremely difficult to leave this special oasis, especially our new friends, Souvane, Abdelrani and Hakim. We highly recommend staying at least 3 nights! Thanks again for a wonderful experience❤️❤️"
 September 2022,5,An oasis in an Oasis….,"Truly a welcoming, friendly, relaxing, and comforting stop after a long day travelling. Arriving late I wasn’t hurried and had time chill in the beautiful pool before dinner in the garden on a balmy evening. In the duplex the spacious downstairs bathroom and dressing room were well appointed and the upstairs bedroom was therefore uncluttered, which, with the good quality bedding, made for a peaceful and comfortable night. Sadly I didn’t have time to linger the following day. This is definitely the place for some downtime while travelling in Morocco!"
 September 2022,5,L’ma Lodge is your home away from home,"We are on 15 days trip in Morocco, stayed for 2 nights in Skoura at L’ma Lodge which turned out to be a total surprise. We have loved every moment of it and are sad to be leaving tomorrow. The place is a real oasis, the staff is most accommodating and welcoming, the food is the best we have had in Morocco so far. The owners have created a real oasis, true paradise. If you plan to be in the area, you have to stay here! We are in owe and forever grateful for the memories."
 July 2022,5,Paradise Found,"Where can you even begin? An absolute garden Oasis. A beautiful seven room boutique hotel in a Palm Grove in the middle of nowhere. We can't even begin to tell you how amazing Vanessa and the entire staff at L'Ma were. The food was over the top, the pool was perfect, and anywhere we decided we wanted to sit, lay, or swinging a hammock was at our disposal. Walking through the beautiful gardens was the perfectly relaxing stay we needed in our journey between Marrakech and the desert. It was like sleeping in an art museum in our own personal Garden of Eden."
 July 2022,5,"Night in L’Ma Lodge, SKOURA, Morocco","Vanessa & Xavier have created an unbelievable place to relax in the middle of nowhere in SKOURA! I, along with my family, spent a night there & felt that it was too short a stay! The hospitality shown by them & their staff was impeccable! The property is absolutely stunning & the decor, including the landscape is something to admire! Apart from creating & maintaining this place, they also rescue non-human lives and take care of their well-being! We would definitely go back there, hopefully in the near future & spend some more time! FIVE STARS ARE AN UNDERSTATEMENT! I wish I could rate them higher! Thank you Vanessa & Xavier for welcoming us & all that you do! Keep up the good work. I will make a conscious effort to come back, with additional family & friends, and spend more…"
 May 2022,5,A wonderful Oasis in Skoura,"We arrived early for a 1 night stay, and were so pleased we did... In the middle of the Palmeraie, the L'Mar lodge has a French Colonial feel, the influence of the owners. Vanessa is friendly and attentive, and the staff were great fun and always helpful. The substantial walled gardens are beautifully laid out with lots of hidden rest areas, lounging on cushions, with a lovely pool. The food was excellent and our room spacious and the A/C worked a treat on a hot day! We'd highly recommend and wush we could have stayed a 2nd night."
 April 2022,5,A touch of Paradise,"From when I spoke to the owner Vanessa on the phone, I knew we’d be taken care of. L’ma Lodge has the understated elegance I was looking for to relax and unwind. They greet you like family the moment you arrive. Their design feels organic providing private spaces for all guests. Lunch on arrival was delicious with fresh ingredients. The massage I had was truly relaxing and healing. Such a magical moment. The rooms are beautiful, unique, clean and quiet. The pool area was beautiful with all the facilities you could want. Even unique wide brimmed hats to shade your head. I would recommend staying here 100%. If I return to Morocco, I will definitely stay here again. Thank you Vanessa, Xavier and all the L’ma Lodge family. x"
 April 2022,5,We LOVE L’Ma Lodge!,"We had the best experience at this Lodge. The staff, rooms, food, ambiance were all first rate. As it was my birthday the day we were there, they went above and beyond in helping us celebrate with a beautiful cake and a gift of lovely earrings. We wished we had stayed several nights !. We highly recommend."
 March 2022,5,Enchanting!,Great place tucked in the heart of a palm grove. Tastefully done. The staff was very kind and courteous. We stayed with them just for a night on our way to Merzouga but had a fabulous time in this slice of paradise. It is one of those places that allows you to unplug and truly unwind. Highly recommended.
 February 2022,5,"Beautiful lodge, kind staff","My husband and I stayed at L'Ma Lodge for four nights last month. Our hosts there arranged a wonderful drive from Marrakesh, which turned into a fantastic sightseeing trip all on its own. At the lodge itself, Sufjian took such good care of us! He arranged two tours for us, and when it was time to leave, he personally put us on a bus and then called us to make sure we arrived safely. The property is lovely, the food was very good, and the rest of the staff, including Abdi, were all great and made us feel like family."
 October 2021,5,Absolutely enchanting place in a fairytale oasis environment,"The lodge is set amidst a beautiful palm grove and manicured garden. The rooms are comfortable and pleasant, and the hosts are very friendly and helpful. Dinner was excellent - by far the best couscous we had during our 20 day stay in Morocco."
 November 2021,5,"Must visited place in Skoura, Morocco","I have been to many resorts around the world & I can definitely say that this place is more than just a resort. It’s a huge hug & a kind of family for the visitors, located in Skoura. Skoura is an incredible palm trees village in Morocco. You have to visit it either during your stay in Ouarzazate or on your way towards the desert. L’ma Lodge thank you so much for your great hospitality! The resort is excellent in everything! Every corner of the resort is a little gem! So many different spots to enjoy, amazing decoration, cleanliness, service, food! All was a unique experience which is value for money for sure! If you travel to Morocco, I strongly recommend spending a bit of your time visiting Skoura & L’ma Lodge. Regards, Elena"
 November 2021,5,Beautiful riad with attentive staff and great food,"Sadly, I only spent one night at L'ma Lodge! It is a beautiful property with very attentive staff. My only small complaint is the lack of wifi in the rooms, which forces you to go to the shared spaces to send an email, etc. Aside from this, it could not have been a better stay."
 November 2021,5,Beautiful Oasis in Skoura!!,"We just had a wonderful stay at L’Ma Lodge in Skoura. We had booked this trip for March 2020, but COVID intervened and we ended up going 18 months later. We had read the reviews, but did not know if the lodge would still be as attractive as before the pandemic. When we drove down a long, dirt road, we started to wonder if we had made the right choice. We got to the front door, and the lodge is marked only by a small sign. Initially nobody answered the door…but eventually we were greeted by the friendliest gentleman who welcomed us and immediately introduced us to Vanessa who built the lodge with her husband. The grounds are magnificent! Words cannot describe how they transformed this patch of land into a true oasis. There are fruit trees or every variety, gardens with…"
 November 2021,5,Amazing stay at L'Ma Lodge,"We stayed two nights in M’la Lodge in Nov-21. We highly recommend the place to anyone willing to discover the peaceful feeling of staying in the middle palmeraie in a green and delicate environment. The rooms are super comfortable and tastefully furnished, the food is great, the people are super nice. This place would suit a couple wanting to spend some romantic days, a group of friends but also a family (as there are some very nice playgrounds for kids. Soufiane and Vanessa would be more than happy to advise you on what to do in the region, notably the biking tour of the palmeraie with Hassan (best way to discover it from the inside)! Mathilde & Alexi"
 October 2021,5,Most beautiful place I’ve ever seen!!!,"The people here are the most wonderful people I have ever encountered!!! They will go above and beyond to meet your needs. It is literally like staying in a different world! The garden is beautiful, and the house is so meticulously decorated! If you haven’t planned a visit to Skoura, make an exception just to come to this place!!!"
 September 2021,5,A true gem,"L'ma is really a special place not to miss if you are doing the desert. We initially planned for a short 2nights stay and extended to 4nights. We could have easily done more. From the welcome, the grounds, room, food to the cats everything was so perfect. Special thanks to Soufiane who was so kind and is very knowledgeable of the region. He gave some great tips which is great if you want to explore things off the beaten path. Overall a very special place with an amazing team!"
 August 2021,5,Fabulous! We enjoyed every minute of our stay,"You can feel the love Vanessa, Xavier and the whole team have put in every corner of the lodge and the gardens. Very clean and elegant decoration, and very loyal to the the theme of that region of Morocco. Super nice and attentive staff without being overwhelming, you feel welcomed and part the family as soon as you cross the door. I also liked the strong connection the staff have with the owners, what a wonderful team. I highly recommend L'Ma Lodge."
 August 2021,5,"Amazing, come as a guest, leave with an extended family.","This place was AMAZING! Not only is it gorgeous with many wonderful places to sit and enjoy the gardens and pool, but the staff was excellent and really made the place feel like home and an extended family. Everyone who works there is so kind and knowledgeable about the region. The massages we got were wonderful and very professional. I would come back here in a second - feels like family !"
 July 2021,5,The best place we’ve ever stayed,"Beautiful, gracious, delicious. Attentive staff, fresh Moroccan food, lovely rooms, refreshing gardens and pool. Incredibly relaxing in a stunning setting, Vanessa and the entire team were welcoming and helpful. Hope to return one day!"
 May 2021,5,Great place in the nature,Located in remote area with great landscape and interesting way to reach the lodge but with efficient signage. Staff is very friendly and welcoming. The facility is very well done and offering a very relaxing environment. Beautiful place for couples or families.
 April 2021,5,a wonderful place!,"Vanessa and her family created an incredible place of peace and beauty! The small hotel (7 rooms in total) inmidst 4000+ plants planted by themselves is a very special spot. The food was great, the service charming and very attentive. We are very much looking forward to hopefully coming back soon!"
 April 2021,5,Two night stay in M’La lodge,"M’La lodge was an exceptionally special place, where we felt part of a family for the two days we spent there. The passion and detail infused from the Vanessa and Xavier in setting up the property was evident everywhere. We dined in their beautiful property with the other guests and could retreat to the hundreds of carefully crafted spots around the property to enjoy some peace and quiet among the hundreds of plants, animals and serenity. Doubtlessly one of the most special places in Morocco and one I will for sure return to, and recommend among friends"
 April 2021,5,Amazing Relaxing Lodge in Morocco!,Visited L’Ma in April via a tour traveling from Merzouga and were so surprised how excellent the lodge/hotel is. It is located deep within the city outline (small roads to arrive) and upon arrival we felt we just arrived in paradise. The lodge owner greeted us and we felt like king and queen and just so special immediately. The lodge is small (I believe only 7 rooms) but this helps hold the unique charm and relaxation environment with many locations within the resort to just “chill” and enjoy the grounds and nature. Great views of the Atlas snow capped mountains on upper relaxation area of rooftop. The rooms are extremely elegant and new with so much attention to every detail (never seen this perfect extreme detail in any other lodge room!)The food is just excellent and along…
 March 2020,5,Vaca!,Amazing hotel! It was a wonderful experience after a long drive! Close to sights.Gorgeous rooms and relaxing environment. The owner made us feel welcome in their home! Would definitely would love to come back!
 February 2020,5,Beautiful and relaxing oasis,"I visited L'Ma for with a group of friends on a tour and was blown away by how beautiful and tranquil it is! It was the perfect spot to relax by the pool, the rooms were gorgeous and comfortable and the food was incredible. So many wonderful little chill out lounges and cozy nooks with lovely local textiles. I would love to come back again but stay for a whole week :)"
 January 2020,5,Fantastic House Hidden Away in The Palmeraie at Skoura,We cycled across the Atlas Mountains and found L'Ma Lodge a perfect destination for two weary cyclists. Shortly after arriving we were given cold beers enjoyed a fabulous evening meal in the beautifully restored house. The staff were very helpful and accomodating.
 June 2019,5,Oasis for travelers with family,"Beautiful property, tranquil, amazing gardens and artful rooms. Family style dining for guests in nicely appointed area. Food has home cooked feel, but chef style taste. We were greeted by the owner and given the history of her property. A quick stroll through native gardens took us to our room where we had a Moroccan style staircase leading up to our suite. We talked to several guests, mostly Europeans, and several book this property more than once. Huge play area (and trampoline!) for children."
 December 2019,5,New Years Eve,"We, a 3 generation family group, spent NYE at L'Ma. What a stunning place it is. The rooms are chic and so comfortable. The roof top terrace and gardens are delightful. We had so many courses for dinner, I lost count. We sat near a lovely log fire and were entertained by 3 talented musicians. The new year was brought in outside in the garden with fire dancers. Like other reviewers have said - we wished we could spend longer there."
 November 2019,5,Sublime,"This hotel was the absolute highlight of our trip to Morocco. It is French countryside meets kasbah chic. The walled gardens are immaculately maintained. Our room was comfortable, luxurious and stylish. We ate all meals here and the food was fresh and well prepared. We had the good fortune to meet owners Vanessa and Xavier, who were absolutely charming. Through them we arranged a bike tour of the Skoura oasis which was great value and amazing. My only regret is only having stayed for one night. In retrospect, I wish we had stayed here during our entire holiday and just done day trips. We will be back!"
 November 2019,5,Totally Charming!,"Our stay at L'Ma Lodge in Skoura was absolutely delightful. Sandwiched within 3 weeks of busy travel throughout Morocco, it provided a welcome place of quiet relaxation for weary travelers. The staff was attentive and the food was tasty. Breakfast was beyond delicious! The gardens were simply delightful, filled with lovely shaded areas to relax around the pool and under trees laden with olives and pomegranates, with resident cats, a virtual aviary of birdsong. Our only wish was that we had been there when the weather would have allowed us to enjoy the grounds a bit more fully. More reason to grab a few friends and go back again!"
 December 2019,5,"Excellent place, excellent team, excellent food.","We booked L’Ma Lodge a day before it closed for the season - so we very luckily had the entire place to ourselves! We were welcomed by the friendly and ever so helpful Soufiane. The rooms were fantastic, the entire place was stunning and felt so dreamy with its areas of relaxation. I wish we met Vanessa & Xavier but they were away on family hols! The team at l’ma lodge took care of us so so well- the chef prepared the BEST MEAL and was so genuine in wanting to provide a meal we loved (which we most definitely did). Breakfast was equally great, with more jams than I’ve ever seen and traditional Moroccan pancakes! My only regret is staying one night - I now understand why the other reviews say the same thing. I wish I stayed longer to experience it more than I did! It was…"
 October 2019,5,Sensational place ...far exceeds!,"This place was a welcome surprise that far exceeded expectations. I only wish we had more time there. Beautiful decor, stunning grounds, incredible vibe and feel, lovely owners, I cannot say enough good things. Incredible foods......don't hesitate. You will not be disappointed!"
 November 2019,5,An oasis of a place in the middle of an oasis,"This place is just great. The owner is top notch. The service is very very good. The food is great, We were so amazed at everything. The room, the atmosphere. We were so pleased with everything, There is even a heated pool. Very quiet indeed."
 October 2019,5,Paradise,"Upscale lodge with a lush (unbelievable!) garden and excellent accomodation. It's expensive (especially food is pricy), but it's well worth it which is why we still give this a 5 star rating. Everything is of the highest quality, service is truly outstanding. We took the 1/2 day tuktuk tour with guide Abdel, which we can highly recommend."
 October 2019,5,Really good place,We arrived very tired and hot from a long drive and day in the desert near Merzouga. We were graciously greeted and treated to very comfortable accommodations and excellent food. Vanessa and her team have done a great job creating a wonderful place to stay. 5 stars all around.
 October 2019,5,Unforgettable,"An unforgettable place well hidden in the oasis of Skoura. Extremely friendly staff and host. The swimming pool, garden with a lot of little cosy created sitting places are just perfect. The room is decorated with beautiful materials and with a lot of care. We even had a private shower outside. The breakfast and optional dinner are very tasty, especially because almost everything is homegrown in their gardens!"
 September 2019,5,Absolutely Magical,"My husband and I just returned from a two week tour through Morocco. The agency that we used booked our accommodations. We stayed in several different places over the course of the two weeks - but L'Ma Lodge was a completely different experience. It wasn't in a large city so, we weren't sure what the rooms or meals would be like. Let me tell you that staying here was magical. The energy of the place was so serene and the owner, Vanessa, was as graceful as the lodge she has created. Strolling past the pomegranate trees and palms on the way to our room, showering in a private outdoor shower and enjoying a delicious dinner and breakfast were fantastic."
 September 2019,5,A beautiful Oasis,"What a delight to stay at L’Ma lodge after a couple of days travelling to and from the Sahara. We were welcomed by the staff & on arrival the owner gave us a personal tour of her home, the grounds full of vegetables, fruit trees, rescue animal zoo & swimming pool. Our room was in the Riad with views of trees from our room on the top floor so calm & quiet. The evening meal was Moroccan with local musicians playing & dancing. Thankyou to all the staff, L’Ma lodge is a home away from home. Wish we could have stayed more than one night. Lisa & John - Australia"
 August 2019,5,An oasis of relaxation,"If you’ve booked only one night, you’ll regret not booking another. L’Ma Lodge is a charming and elegant bo-ho paradise property nestled in the middle of an oasis in the small town of Skoura. The staff are excellent. The rooms are clean. The views of the sunset are stunning. The property layout is well organized and includes areas for relaxing poolside, naps in hammocks, and comfortable seating areas for reading a book or having lunch. The staff are extremely friendly and attentive and knowledgeable. The food is excellent. This hotel is perfect for couples and small families. From outside Marrakech to Fes, and the towns in between, it’s unlikely you’ll find a better hotel. Horseback rides through the palm grove are available at a nearby stable."
 August 2019,5,"A home away from home, tucked in a palm grove","After the short jaunt on the dirt road to the hotel, we were unsure of what to expect. But the incredibly warm welcome from the staff had us swept off our feet immediately. Soo grateful we altered our travel plans from one night to two. This hotel is a home away from home. By our second evening we stayed up late into the night have an interesting and informative chat with the Manager about Morocco and it’s culture. All staff were kind and attentive. After seeing my love of cats they brought us to where a new batch of kittens had been born in the morning. Not to mention the hotel itself. The owners have done a wonderful job and created all kinds of romantic and communal alcoves all over the property. They have very talented cooks, and the food was the best we had in…"
