 May 2016,5,"Gorgeous property, fabulous city center location","My husband and I stayed at Le Diwan in a suite (room 515) and our expectations were exceeded. The room was spacious and had a living area, a dining area and two bathrooms! The appointments were very nice, too. The staff at Le Diwan are top-notch. They provide excellent and sincere customer service. The restaurant is not to be missed-we had a lovely lunch and enjoyed a Moroccan ""grey"" wine - incredible and one of our best meals. The concierge and his team are also great - whatever you need, they are there for you. We opted for the the wifi / breakfast package and were glad we did. The wifi was fast and the b-fast was nice (but not nearly as nice as the hotel restaurant)I was overwhelmed by the level of service, the hotel and the location. I will stay here again!"
 March 2016,4,Nice hotel but problems with maintenance,"The hotel gives an impression of quality and design, so you really feel that this is a not-so-big, prime place to stay. This feeling is accentuated by the very nice staff, always ready to help and smiling. However, once you are in, you start noticing the inconsistencies between the quality you would expect and the small but many problems you find in the room, such as a rusty shower or a leaking tap. Because these small but irritating things are so evidently in contrast with all the rest, I can say that a low maintenance budget and/or the little attention paid to this is the most serious problem in this hotel. Another serious problem, at least in the room I was in, was the noise you hear coming from other rooms. I am not a light sleeper, but the noise coming from another room…"
 April 2016,4,Nice Hotel in good location,This small hotel is a nice hotel in a fairly good location not far from a tramway station. Rooms are cozy although not very big. The staff is very friendly and helpful and we found the breakfast buffet very good.the rooms are well stuffed and the bed comfortable.
 April 2016,5,"Central, clean and helpful","I recently stayed at Le Diwan whilst touring Morocco. I found the hotel to be clean, centrally located (a 15 minute walk to the Medina) and the staff to be particularly helpful. Ibtissam greeted us on arrival, her English was excellent and she was very professional."
 April 2016,5,Sejour,I was really pleased to have an experience of a lifetime.... Everything rocks....I enjoyed staying in here...Simply one hell of a hotel...One night is like staying at paradise...The food is quite amazing.... Thanks to those brilliant chefs...& those managers who provide you...with everything you may ask for... Cheer Up...
 March 2016,4,"Pay More to Get More, Up Market Rooms Excellent","My wife and I lodged here last 2 nights of our week in Maroc. Rented a suite for modestly more than a room. That's where their quality resides. Ordinary rooms may be like Best Western motels. But, up market rooms are exceptional, so splurge and enjoy. Central location is worth it. Be sure to eat at Cosmopolitan and Al Marsa (on the river). Staff are friendly, helpful and mostly unsophisticated so they're somewhat slow in an effort to get things right and keep you happy. Be patient. Surprisingly good mojitos and margaritas at bar and a cool musician doing live music (reminds one of the piano player in the movie, Casablanca)."
 March 2016,3,"Decent hotel, great location but breakfast buffet has problems.",This hotel is used by Gate 1 Travel for their tours and we stayed here at the start of our Morocco tour. The hotel is decent in a great location of the city near a light rail line. Easy walk to museums and their medina (markets). The room are OK but their breakfast buffet has something to be desired. They serve horrible scrambled eggs in a chaffing dish that taste horrible likely made from a dry egg mix. The other items are fine especially the individual jars of cut up fruit next to the yogurt.
 March 2016,1,"Good location, but had bad experience","After reading reviews on trip advisor, I expected a comfortable stay here as part of Gate 1 travel. Although the room looked superficially nice, we found the floors to be dirty; the bed had wrinkled sheet and comforter. I removed all the sheets, so the housekeeping could put new sheets. The faucet was leaking which took more than a day to fix. The towels were not replenished the second day. I had to go down the receptionist and demand immediate service. Although the location is good to royal palace, minaret, museums, tram, and restaurants, I would not stay here because of our bad experience. Could not believe this was a 4 star hotel!"
 March 2016,4,Almost Great!,This was the first stop on a Gate 1 tour for two nights. Hotel was very good. Modern and clean rooms. Everything is very good except for the breakfast. The selection was limited and they ran out of food. Our guests were standing around waiting for food to be re-filled.
 March 2016,4,Comfortable hotel,"We stayed here two nights during the first leg of a six city tour of Morocco. This is a comfortable hotel with reliable wifi, a lounge with bar and live music, and a very nice restaurant, La Brasserie, available for lunch and dinner. The room itself is spacious, the linens are clean, the bed is comfortable, the bathroom has modern fixtures and amenities. Centrally located in the middle of the city, the street noise can be heard inside room 203 (However, living in Washington, DC, it didn't bother us at all). If you have issues with street noise, a room on a higher floor may help. The service provided by the hotel staff is also satisfactory. We had a problem with our TV remote control; after calling the front desk, someone from maintenance was dispatched in a timely manner…"
 March 2016,4,End of our tour in Morocco,"Good location with tram close by and the souk about a 20 minutes walk. Lots of restaurant choices nearby. The hotel has a luxury feel to it, but it does serve large tour groups. Breakfast can be chaotic with staff seemingly over whelmed. Choice is limited as well, definitely toward the bottom half of the breakfasts we had at the hotels on this trip."
 March 2016,4,Start of our tour of Morocco,"This was our first stop on a two week tour and the staff have been great, the room all that we needed along with a wonderful breakfast. Can't wait to see more of the country and city. If you have a chance to stay in Rabat give them a try you won't be disappointed."
 January 2016,5,Sizable room that was both clean and comfortable,"Excellent hotel with larger business style room with ample space to move around. Room also had a queen size comfortable bed, strong shower with plenty of hot water, and a small balcony. Hotel is very convenient (one block away) to a market square that had a delightful food bazaar. Hotel has a bar that serves alcohol... but does not serve draft beer."
 February 2016,3,Perfectly adequate hotel for the price,Clean functional hotel. Pleasant staff who will try their best to help you although not always the most efficient service. Well situated with a bar and a restaurant. All rooms have bathrooms and not just showers although some are quite small.
 January 2016,4,Very Nice Hotel,"Hotel was walking distance to the medina and Mohammed V Avenue. Good for tourists to walk to these places. Hotel was very nice and the staff was extremely helpful. One draw back was that the AC in the room was not working. We only stayed there for two nights. I simply opened the window and cooled the room that way. Also, the bedit and the toilet was too close. Only about 6 inches facing each other. The room was very comfortable but it can use a makeover. We paid about $170 CAD a night which I found a little pricey for the quality of the room."
 January 2016,5,Service excellent and comfortable rooms,"Walking distance to resturants and very close to public transportation. It was a little chilly on our first night, and the staff brought us a room heater that was perfect. Rooms were clean and beds very comfortable. The buffet breckfast was just ok. Not a lots of choices, but ok."
 February 2016,4,Perfect City Centre Hotel,"6 story modern well appointed and well located hotel. Excellent rooms and bathrooms, the ubiquitous 'international' restaurant and a small comfortable bar, serving light meals from a small menu and featuring live music. Buffet breakfast disappointing hence a ""very good"" rather than an ""excellent"" overall rating"
 February 2016,3,"Excellent location, good-ish hotel in need of some works","The hotel enjoys of a very strategic position, close to everything there is to see or to do in Rabat. Efficient personnel at the reception make the registration easy and swift. Unfortunately my room was on the sure and the noise isolation was not super. Also, the moquette was pretty old and stinky, which is always e big no for me. Room's furniture were old and in need of a refurbishment, the bathroom was correct and clean. Another big no are the smokers: in the hotel is allowed to smoke in some common areas, this should be forbidden. The elevators' buttons were not working properly and one has to repeatedly press them to make the elevator move, but sometimes it doesn't work any way. Good breakfast with local specialities. A lot the restaurant (the Brasserie) is ok, with a very…"
 February 2016,5,"Le Diwan, An excellent hotel: Food and service","Located in the heart of Rabat Center, this nice and cosy hotel is excellent for a business trip as well as a touristic once. Service is awesome and the staff are very welcoming. Rooms are perfect, la brasserie is a gorgeous stylish restaurant, food is excellent, the menu is made by one of the nicest French Chefs. This hotel is close to everything in Rabat, I loved my stay there and wish them all the best. Special thanks goes to AS."
 February 2016,5,"Central location, nice hotel","Le Diwan is centrally located, walking distance to most of Rabat's tourist and business attractions. It's clean, neat, and the service is great. I was very impressed by the restaurant - the food is just amazing and the price is good. After reading reviews about their breakfast somehow lacking, I expected the worst, but was very pleasantly surprised. The first room I stayed in did have a strange smell, but as soon as I mentioned it to the reception, they sent someone to check it out and then I changed rooms with no issues. My room was nice, clean, and the internet worked well. I will stay there again if I go back to Rabat."
 January 2016,5,Friendly staff and really great bed linens !,"We had a great 1 night stay at this hotel. They gave us a great deal + room upgrade. The bed linen is AWESOME ! OMG, I loved it , so soft ! The room is very confortable, small terrace which is rare, bathroom was very cleaned and bathtub and shower very good, very hot water! We booked at last minute coming from Marrakech. Breakfast was also very complete (fruits, breads, scramble eggs, yogurt, I remember they had many hot food options, 2 types of soups, anyways it was very diverse)... We will definitely come back here."
 January 2016,4,Centrally located welcoming hotel in Rabat,"This hotel is great for a visit to Rabat whether for business or pleasure. Its central location is close to great shopping, restaurants and tourist attractions. The staff was very welcoming and made us feel valued. The service staff are very professional, courteous, and friendly. Most staff I interacted with spoke English (official languages are Arabic, French and Amazigh). The restaurant on the ground floor serves great food, staff are very friendly, professional and fluent in English. I would recommend the lamb and a local Moroccan red wine, Terres Rouges. The room was clean and well kept."
 January 2016,5,Very good hotel to stay with an excellent restaurant,"Very good , very clean hotel with a very good service , very close to downtown and with a very good restaurant ""La Brasserie"". It is very good value for money . Only breakfast could be better. but for the rest an excellent hotel to stay."
 March 2015,2,It is a short stay hotel,Due to the crowded location of the hotel and very limited facilities it is fine to stay there while on business quick trip as there is nothing special on site no swimming pool no activities staff number is very limited and in general it is a bit noisy hotel as it is in the busiest area in rabat. In rabat you still can find better for the same price.
 December 2015,1,Horrible,"It smells so bad, from the lobby to the elevator to your pillow. It stinks! Also, the carpets are stained and the hotel in general is not clean. It is very old and un-renovated. I did not enjoy my stay here at all. I am never ever coming back. I would not recommend this hotel. It has a four star rating but in reality I would give it one star. The breakfast food is not so good either. And they will yell at you if you are in a hurry and try to take your breakfast sandwich to go."
 November 2015,5,best in town,"this hotel is ideally located in the VERY center of town , close to everything .. the staff is always going the extra mile to make the guests happy , you can feel that they care .. rooms have erything one might need . book it !"
 October 2015,4,Nice hotel close to sightseeings,"Chose this hotel as I'm fond of MGallery network. I'd rather say this one is quite simple taking into account that MGallery hotels are usually located in historic buildings. the hotel is close to Chellah and Medina, 2 quartiers from Rabat Ville station and Mohammed V museum. Rooms are nice, bed are soft, bathroom is clean, nice scent in air ventilation system. Appreciated room upgrade, impression of personnel is mixed: someone is very attentive in line with rules, still I wasn't asked if I need a taxi when collected my belongings at 4pm at departure. Most of guests prefer to avoid breakfast as it is quite expensive (for Morocco) as well the choice is adequate but quite limited: 4 star hotel should offer more fresh fruits and cheese/cold cuts shouldn't be covered with food wrap…"
 November 2015,3,Good,"Good room, bad breakfast, high price, good location, good service, water only one day complimentary, their is coffee machine but no water, weak wifi, no view with rooms, helpful stuff, smell of hotel not nice when you come in, but they try their best to help you but you have to be on their head"
 October 2015,5,"Excellent rooms, quiet, good beds and free toiletries. Highly recommended!","The quiet rooms were wonderful, with good beds and excellent free toiletries. After a long day of travel, it was great to have everything provided. The location is good, as it is near the main historic sights of Rabat. I have no complaints at all and nothing but praise for this hotel!"
 November 2015,5,"Centrally located, great for exploring the city","We stayed here as part of a Moroccan tour, and although we didn't select the hotel, the accomodations are very nice. The staff is friendly and attentive. The breakfast was included with the room, and included French and Moroccan specialties. Rooms were non-smoking which was great!"
 November 2015,4,Brief but comfortable stay,"Stayed here for 1 night. Things to be mindful of; 1. Free wifi 2. There are only euro sockets. Bring your own converter for your US appliances 3. No iron in room. Quick stay here. Room was clean, tidy. Beds soft. We had twins. Room nice size. The staff friendly. The hotel restaurant had good food. Bottled water complimentary and in every room. Has spa services but I didn't try them. In great location. I would recommend."
 November 2015,5,Enjoying this gem,"Perfectly situated, modern hotel with all the amenities in the centre of Rabat close to the Museums of Contemporary Art, Archeology, and a 20 minute walk to the Medina. Staff courteous and helpful, most English speaking. Large, comfortable rooms."
 October 2015,5,Great place to stay,"Really nice modern facility. Centrally located, rooms with all the amenities you could want, very pleasant and helpful staff, great breakfast. Strong, fast wifi connection. Near shopping and restaurants. A great place to stay after a long, transAtlantic trip."
 October 2015,4,Comfortable 4 star stay,"Le Diwan Rabat Stayed here two nights as part of a Gate1 guided tour and loved this hotel. Modern and very comfortable room with all amenities, a definite 4 star hotel. Even an espresso machine. Breakfast was varied with many savory and sweet choices and the only confusing thing was guessing which pot held coffee and which held water or milk. Our room was facing the street so there was some street noise even on the top floor. The surroundings are safe and close to the flower market are a few lively cafes where you can eat Western and Moroccan type food. Tip: traffic will not stop even when crossing the street via a crosswalk."
 October 2015,4,Good hotel in center of the city,"We stayed here with a group tour. Hotel was clean and well located. Staff was professional and friendly. Bar was a little smoky but pleasant, with an excellent singer one evening. The restaurant was excellent for dinner with many French specialties and good wine. Good wifi."
 November 2015,5,Hotel,"""Nice hotel""this is my second time here in the capital of morrocco.well located hotel.room was large and clean with free wifi.staff are so freindly specially at breakfast.i will come back. Tres belle chambre spacieuse propore. Equipe au top a latention de chaque client"
 October 2015,1,Terrible place to stay,"#1 Its almost like CIA agency, they do not tell you the rules upfront and someone is always walking on you back eveywhere. #2 Internet (wifi) is terrible, it is not working at all and even you are so lucky that it works the speed is like Dial-up #3 You ask for room change or any issue to solve, you will never be updated on that and of course your issue will not be solved. #4 In the Spa center no-one speaks English and every worker is lazy to do their staff properly ! Only good service providers are door servants that are really nice and willing to help you, with anything they can do !"
 October 2015,2,Disappointed,"From reading prior reviews, expected a nicer hotel & was disappointed. Floor looked like it hadn't been vacuumed, bathroom less than clean and room rather small. Best feature was their French restaurant which served excellent, reasonably priced food. Restaurant gets 4*, hotel 1-2*, but conveniently located."
 October 2015,5,At the heart of it all,This very clean hotel is centrally located to sites around the city. We felt very safe walking around the area and found a lovely restaurant just a few blocks away. The King was visiting the day we were there so the streets were lined with locals and tourists.
 October 2015,5,Most friendly and courteous staff,All staff are so friendly but courteous and very professional; this is very rare. Service is fast and with warmth and quality. I can only be very positive about cleanliness. Free wifi that works very well; no need to pay more to get better quality wifi connection. The hotel is also conveniently located Well done!
 October 2015,4,"A well run, clean hotel",We stayed here with a group tour. Room was very clean and well maintained. Wifi was excellent! Well located hotel.... Would stay here again. My only caveat is the a/c which is on the warm side. Staff was very pleasant and helpful. Breakfast was adequate and room was clean and cheerful every morning.
 October 2015,4,Not bad at all.,This is a very nice hotel .location will be 10. Rooms 10. Room cleanliness 10+++. House keeping is the best I ever seen. The only reason for a 4 stars and not 5 is the room service. They have to work on a little improvement. Room service manger is a wonderful lady and I believe she is working on building a better team. Overall. It is a pretty experience in an amazing country.
 October 2015,4,Friendly quiet clean and modern,"Staying here now, checking out tomorrow, so far so good! Close by are banks, tram stops, money changing stands, a brief walk to a fabulous contemporary art museum, saw that earlier ($20 dirhams pp, open till 6 pm) housekeeping are thorough respectful and kind"
 October 2015,5,excellent place to stay,staff welcoming and efficient ; room and bed very comfortable ; very nice decoration everywhere ; excellent bar and restaurant ; very near the tramway and city center ; I was on the 6th floor : nice view on the city Françoise B.
 October 2015,5,Wonderful place to stay,"I am currently here for just one night, but wish I could stay longer. The staff was welcoming and efficient. The room is comfortable and sparkling clean (especially the bathroom). There are numerous bathroom amenities. The wi-fi connection is good. I haven't tried the restaurant yet so can't comment on that, but everything else is super."
 October 2015,4,A good overall hotel.,Everything was fine. A good utilitarian hotel. Comfortable. Internet worked well. Bathtub was comfortable. Beds were good. The carpet was getting a little worn and could use a cleaning. ...........................................................................................................
 October 2015,3,Not great but not bad,"We stayed here on a group trip. The service was okay, we asked for extra towels but never received any. The chef was nice to make special dinners for us, which were fairly good. Our room had a bit of a musty smell and our bathroom light stopped working on the 2nd day (but we didn't report either of these since we were only here 2 nights)."
 September 2015,5,"Service great, room great, location great!","We stayed here two nights during an OAT tour of Morocco. It was a great experience. The room was very nicely appointed, the wifi was free, and the staff were super friendly and helpful (gave good directions to banks and the tram). I would definitely stay here again...and again."
 September 2015,3,Good place to Stay,"Stayed there for 2 nights while on a business trip to Rabat. After 14 hours getting there, the room that was not what I had requested. Add to that, the phone in the room was broken... had to carry all my stuff back down to complain, and was given a relatively a better room. I had stayed at another MGallery Hotel recently, so frankly speaking my expectation was very high. Otherwise, Le Diwan is an ok hotel. Breakfast was ok, nothing to write home about... Location is central, its also 10 minutes walk from the old souk. All in all, it was an average experience for me."
 September 2015,4,Pretty Good,"The hotel was pretty nice overall. It was clean and in a decent area. There is a nice square with a lot of restaurant choices about a block away. Good location the grab a cab easily. The elevators need help. The doors are very serious about closing and the elevators are extremely small. There is an attached restaurant but when we tried to eat there, no one was there to seat us...we waited awhile and tried to call to the staff who was laughing and talking in the kitchen. We ended up getting room service instead. The food was pretty good.there is a cafe type room in the 2nd floor and is where breakfast was served. HELPFUL TIP: You have to put your key card in the slot right inside the door in order to get any lights."
 September 2015,4,nice place,"We enjoyed staying here. Clean, reasonable bar, mostly decent continental breakfast. Within easy walking distance of many restaurants, museums, and local shops. Right next to bank with atm and tram. A little scary trying to cross the street, lots of traffic."
 September 2015,5,A place to do business and pleasure,"I m a frequent traveler and this place is just a good combination between a good place to sleep and make business appointment, and a good place to have a break at the bar, the food at the Brasserie restaurant is tasty and fresh, and special thanks to the team, great service through all the stay."
 September 2015,3,A good place that would benefit a re-boot,"A great night's sleep in comfortable, clean rooms with good walking in any direction to the old city or to the old downtown. Friendly staff who meet the standard. When it opened about 15 years ago, it was a good addition to the mix and was a strong four star property. As happens, it is now has more competition and the city center has moved. The property footprint was always a little problematic and the reception/lobby/bar is squeezed in and the squeezing is reflected also in two elevators that serve housekeeping needs, as well. Minor amenities (like replacing the coffee sachets daily) are overlooked though the nightly Moroccan cookie on the pillow was always delivered. The hallways are a little on the dark side for my taste. Others have remarked on the parking…"
 September 2015,5,"Excellent service, great location, I would stay again","Gate 1 uses this hotel, it's a little dated but we are really enjoying our stay.  We were warmly greeted & our check- in process was quick. This is day 2 of our 3 day stay. The bed was like sleeping on a cloud, comfy, peaceful & restful. Breakfast was exquisite, & fresh with a large variety of dishes; figs, dates, raisins, crossaints, bread, soup, porridge, crepes, sauasage, meats, cheeses, etc. The staff is attentive to our needs & there is something for every palate.  Haha, I will tell you about the two harmless higglers who are nearby the hotel, patronize them & negotiate, haggle on the prices. I bought two beautiful Moroccan caftans (gifts), one orange, one blue. My friend bought a silver necklace & bracelet set.  Also nearby, a court with various restaurants, just lovely to…"
 August 2015,3,Significantly over priced hotel with no value,The hotel is running on flight crew and business travellers. Although location is good but hotel itself is not very good. Breakfast is ok nothing special. Except for one gentlemen there is a communication problem with almost all the staff.
