 December 2013,4,"Modern, clean, free wifi","It was our first night in Morocco. We were jet lagged so glad when they let us check in early so we could freshen up before heading out to hit the medina. They offer free wifi. The lobby is quite small and most of their staffs do to speak English. Location is about a 20 min walk to the old city where most restaurants are located. We didn't have an issue connecting to the internet and it was pretty stable and fast. We found only one English speaking channel. Breakfast is standard and very slow service. Page had to ask multiple times for coffee, juices etc. I don't think they are used to dealing with tour groups. Instead of placing juices in small bottle containers, they should invest in a larger dispenser. I had to wait a while also before they replenish plates and…"
 December 2013,5,Amazing stay in a perfect hotel,"Really I spent a wonderful 2 weeks in Rabat with excellent services, complete team are always smiling and showing excellent hospitality, breakfast was amazing with varieties and they never forget what you requested previous day, they prepare it before you request or even before thinking:) really restaurant team were an excellent staff, finally I couldn't forget one of the reception team member who always smiling with cute face. even they know that my favorite team will play today in Morocco and encouraging us."
 November 2013,5,Great First Night,"This hotel was our first night in Morocco. What an excellent beginning to a great tour. The rooms were very nice. The location is excellent. The breakfast buffet was easily the best of the trip. It was a short walk to a sunken park with four restaurants. Beautiful location, very good food for both lunch and dinner."
 December 2013,3,Brasserie restaurant is disappointing..again,"I am a regular visitor to the restaurant. But tonight was disappointing. The place wasn't busy, the staff know me, made me welcome but just did not live up to standards. Boiled rice with brochette of beef itself sounded dull so i ordered potatos. But as has happened beford the extra dish of potayos did not arrive. After asking they turnup after i have finished. And No Apology!!! Sounds small but it ruined my evening, and it is not the first time. the value for money tonight was Poor. I am reluctant to return."
 November 2013,3,could be better,"Good: comfortable beds, Internet connection (even though at times slow), clean bathrooms, chamber maids are nice and helpful in need of improvement: rooms smell badly of humidity, elevators need maintenance, food in the brasserie is greasy, staff is unmotivated. Breakfast is particularly disorganized. Even if you are the only guest in the breakfast room and there are 5 servers milling around, they still do not manage to serve you coffee. Every morning you have to go in search of coffee spoons, napkins, etc. It's almost funny. Another funny thing is that all of this has been mentioned many times on Tripadvisor, and each and every time management responds by apologizing and promising that things will get better. But obviously this is just a phrase and there is no willingness…"
 November 2013,4,Comfortable Beds,"The room was nice & clean with a small balcony. Not the greatest view of the city, but it was nice to be able to step out for some fresh air. The restaurant was fairly good, but very limited as far as vegetarian options. However, the desert was excellent, The beds at Le Diwan were the most comfortable I've encountered at any hotel. There was a thick & cushy mattress topper on both beds, which made it very easy to fall asleep rather quickly, despite the noisy guests in the room next door."
 October 2013,4,Checked!,"The location is good for business porpoises, the only detail is the parking and the chance to park in the close area. In the close area during the night there is not too much animation, but the city is not very open to night activities."
 November 2013,4,Stop over,Excellent service and helpful staff. Room was clean and fresh. i liked the food in the resteraunt. The location is close to the centre of Rabat and made for plesant walking to sightsee. The downstairs bar had a lovely atmospere and frriendly bar staff.
 November 2013,4,Nice hotel,"We stayed for one night. The room was clean and nicely furnished. The bed was comfortable. The washroom was also nice with one of the better showers we had during our two weeks in Morocco. Location was good; about a 5 minute walk to the Mausoleum, and about a 10 minute walk to the medina. Service is average. Staff are professional and efficient but not overly friendly. Wifi is okay. The signal is a bit weak. The rooms are not very soundproof. We could easily hear noise from other rooms as well as the trains a couple of blocks away. I would stay here again."
 October 2013,4,good hotel,"This hotel was booked as part of a trip I booked with gate 1 travel and they did a great job sending us to comfortable places to stay. Le Diwan Rabat had clean and comfortable rooms, a nice restaurant, and a comfortable bar-- they brought us complimentary snacks with our drinks at the bar which were very good. The location was great; it was an easy walk to several attractions and it was in a safe area."
 November 2013,4,NOT FOR NON-SMOKERS,"I spent 3 nights here on business. The room and bathroom are good for the price. The ar. con works. Friendly staff. Only drawback is that smoking is allowed everywhere, including the restaurant. But I suppose that's the norm for Morocco."
 October 2013,4,Nice hotel,"I experienced this hotel this week for 2 nights and i think i will come back if i have choice . - reception, personal are nice and profesionnal. - Room (suite) was very good, clean and well furnished. Maybe a little bit old fashion :) - The hotel is well located in center and also even if the place is very busy, the room are not noisy (2 windows to avoid noise disturbance). - breakfast is good and personal is very nice and helpful. - Room service is fast and good. I even came back 2 days after to experience the Brasserie for an early dinner and i was happy to eat something good in place that really looks like a good Parisian Brasserie. nice and helpful waitress also. Maybe the only bad point is that there is no swimming pool. Now i think it deserves its 4 stars and i will…"
 October 2013,4,Great hotel,"I spent one week at Le Diwan hotel for business trip, it was nice! The room was clean, the breakfast was awsome and the team was friendly. The location of the hotel was a great since i had an easy access to the whole city."
 October 2013,4,Good 1st night in Morocco,Good hotel. Room was clean and bed and pillows were comfortable. A working shower with good water pressure was a plus! Friendly staff(front desk and porters). Also close to shops and restaurants. Only downside was wifi was very slow.
 September 2013,4,Moraccan Point of Entry - Good First Impression,"Arrived at the hotel as part of gate 1 tour after two red-eye flights. The hotel was clean, the room was modern and the beds were comfortable. The breakfast was excellent -- fresh fruits, pastries, meats and healthy choices. The staff was very friendly. The hotel was also within easy walking distance of shopping, site seeing and places to eat. Wish we had more nights here."
 September 2013,4,Comfortable hotel with a few downsides,"I spent three nights at the Diwan on a business trip to Rabat. It is a pleasant place, not too luxurious, with all the basic comforts. Good bed, silent room, lavish bathroom (I consider a good shower one of the real indicators of the quality of a hotel), satisfactory breakfast buffet, the hotel also sports little precious commodities such as an espresso machine in every room. The staff is also very kind and helpful, both at the front desk and at room service. However the good impression is tainted by a few little downsides: the Internet in the bedrooms is only cabled Ethernet, no WiFi, which is rather uncomfortable in these times of WiFi-only mobile devices. And it is also dead slow, moreover some configuration in the network devices prevented me from using my company's VPN. …"
 September 2013,4,Very nice front desk staff,This hotel is located in somewhat of a run down residential area. We did manage to find a restaurant in a plaza area a block away. The hotel itself is very comfortable. The bed and down pillows were great. The front desk was very helpful and patient with all of my questions. The breakfast very good with a variety of foods.
 September 2013,3,"Wifi is as slow as dial up, not good for business.","If you are looking to get work done thru wifi, it's terrible and slow. For two days, I had a hard time even loading Google maps. Sending a email thru Yahoo mail was very slow. Be aware! Very nice hotel, decent service and no fringe benefits. Comfortable beds, clean linens and property is well maintained. I will never understand why they just do not give the breakfast etc. Some people get it, some don't. If they completely upgraded their Internet service it would be a perfect business hotel."
 August 2013,5,"Best bed, pillows, bathroom, products","Very comfortable room, great location, service minded staff. I stayed there for 5 weeks, and it felt like home. The staff did their outmost to make me feel welcome. Outside the hotel you're in walking distance of Medina de Rabat, The Royal Palace, the train station, Hassan Tower and the very center of Rabat with its shops, archades and cosy cafés. The area around the hotel offers plenty of restaurants. You can also choose to eat the the Brasserie, Le Diwan's own inhouse restaurant. Enjoy a cold drink or a cup of espresso in the hotel bar. It's a cosy place to relax."
 August 2013,4,good for business,I stayed a couple days for business and with the exception of the bathroom which has not seen a major redecoration for years (but in perfect working condition) all were great at this hotel. Nice surprise: the espresso machine.
 August 2013,5,"Best bed, pillows, room, breakfast.","Its v conformable rooms and bath, i could sleep in such great pillows, clean bathroom with nice style. Room service is often ready. Breakfast with sweets, chocolates, crepes, fresh juices, fruit salads, chocolates...."
 August 2013,4,Less than five mins walk from the only (found!) Irish bar in Rabat!,Clean hotel centrally located. Rooms comfortable. Staff very helpful. Breakfast not the best though! Easy parking right outside the hotel. Just walk down the hill outside the hotel and you will find the only Irish pub in Rabat!
 August 2013,3,Bättre än jag tyckte from början,"So after changing my room to a second one then was upgraded to a suite after the first night; finally ""the supposed to have from day one room"" was found. I would like to thank those who helped to make this happen. I still strongly believe that any 4 star hotel should make sure this happens on the day before anyone checks in. There is no one to blame here really but personally i expected from a 4 star hotel to have a working Air condition in the room, don't you? The hotel was fully paid with a ""gold amex"" through my work agency in stockholm. Plus + Central location + Bed (mine was king size) + Room size + Spa Minus - Breakfast - No air condition in lobby or corridors - Expensive (taking into consideration the last two points)"
 June 2013,5,Would stay again,"I stayed here with part of a tour group at the end of June. We only stayed one night but this was one the best hotels we stayed at in Morocco. It was clean, had friendly employees, comfy beds and strong wifi. The restaurant was smoky (as is everything in Rabat) but the food was excellent. I would definitely recommend this hotel if you're staying in Rabat."
 July 2013,5,Don't miss a trip to the spa!,"Really lovely hotel. Great hammam and massage. The restaurant is lovely - try the sole. Smoky bar like everywhere. Great staff . Clean as could be, easy to get by with English. Will visit again. Helpful front desk"
 June 2013,4,Central Novotel Hotel,"Very nice, rooms were very spacious, staff was pleasant. Bar on the main floor was great. Staff all spoke English. Great location in the middle of the business district. Interior rooms had a view of the garden and were very quiet."
 July 2013,4,My preferred business hotel,"Having experienced Sofitel around the world but also other hotels in Rabat, Sofitel Diwan has my preferenced for business purpose. Good and clean rooms, correct breakfast (though a bit expencive compared to the room discounted price), good restaurant and international bar. Above everything, the sleep quality is good which is extremely rare in center town due to combination of environmental noise and poor standard for constrution materiel. If you want to sleep well, go to Diwan."
 July 2013,4,"Dull on the outside, sophisticated on the inside","Don't let the hotel's drab facade fool you -- this hotel is sophisticated and slick on the inside. Curving marble staircases, lots of glass, everything laid out in a balance of utility and aesthetics. The room is spacious and the bathroom is particularly attractive. The restaurant is pretty good, too. The view from the balcony is nothing special -- and Le Diwan seems to know it, because the balcony is really just an overgrown window sill, with hardly room for more than standing -- but I blame that on Rabat, not the hotel! Definitely a good choice if you're travelling to Rabat."
 June 2013,5,Perfect choice,I have been to Morocco before but this was my first trip to Rabat. I decided on this hotel because of its central location and positive tripadvisor reviews. They didn't steer me wrong! I was pleasantly surprised by the front desk staff who were more than comfortable in English as my French was pretty rough and my Arabic.....well there is none! We were given a very spacious room and although I had seen a couple of reviews complaining about the noise the double paned windows kept us from hearing any of the traffic outside. The bed was a dream and we were provided a plethora of pillows. Bathroom amenities were excellent and cleanliness top notch. Basically the room hit all of my must haves. The hotel itself was of course very central allowing us to walk pretty much anywhere…
 June 2013,4,Pleasantly surprising,"After sorting through the many options as I planned my first trip to Rabat (and to Morocco for that matter), I settled on the Diwan mostly for price and a general appreciation for other Trip Advisor reviews. I appreciated the attentive staff at the Front Desk, the very clean and modern rooms with amenities, the lobby bar/cafe and the location. The staff were comfortable in multiple languages and politely humored me with my rusty French. Although I transferred later on to the Tour Hassan nearby for a conference, I much preferred the staff and rooms from the Hotel Diwan (and the price)."
 June 2013,4,"Clean, central, and comfy","Le Diwan is fashionable, comfortable, and well-located. The rooms are very clean, the pillows are billowy and the beds are soft. The water pressure is strong, making for a luxurious shower. There's a great collection of contemporary art work throughout the hotel making it feel very modern.  We used the spa for a $15 manicure and $5 eyebrow wax and we were very satisfied with the quality of the service. There are many restaurants within just a few blocks, including a tasty creperie around the corner and several cafes with traditional Moroccan food in a plaza. We were able to walk wherever we wanted, including to the central souk. Breakfast at the hotel was plentiful with lots  of fresh fruit and Moroccan pastries. Overall, it was a great welcome to Morocco."
 June 2013,3,Classic Hotel,"The hotel is located at a corner with to much traffic. The location is not attractive. Therefore after arriving I asked for a quiet room in the rear part of the hotel. The answer was that all these rooms were smokers and since I' not one I had to take a room in front of the street. The rooms have a double glass window, but still you can hear the traffic. There is no swimming pool or fitness center. The hotel has a good but a little expensive restaurant."
 May 2013,4,"Great breakfast, staff and location","After spending 20 days in Le Diwan in May 2013, I can say: Breakfast: A great selection of fruits, Moroccan breads and pastries, jams and egg dishes. It was my favorite meal of the day. The room service breakfast is impressive too. Staff: The reception staff speak multiple languages easily and are friendly and accommodating. During my stay, without asking me first, the hotel removed the simple hot water kettle (bouilloire) and replaced it with a sophisticated espresso machine. Problem--the machine doesn't produce enough hot water to make tea. When I asked for the bouilloire back, they brought it quickly without any complaint. They also handled laundry service very efficiently. It's expensive, but excellent quality work. Location: Easy walks to train station, medina,…"
 May 2013,4,Very comfortable,"Comfortable, clean and very well located... The staff was extremely friendly and helping, always smiling and ready to help... The rooms were clean and nice; beds very comfortable... Breakfast was okay. The location is excellent and close to the main streets of Rabat. I enjoyed my stay there..."
 May 2013,5,Good place in Rabat,"Good location, easy to locate , clean . Rabat is beautiful , green. We were a group of 16 , the rooms were tidy , clean and proper. Staff very welcoming and assistant , and courteous. You can get proper exchange rate at the hotel, and no need to bother going searching for a bank. We could walk to the ""suwayka souk, "" shopping was a nice experience, leather items were attracting and affordable"""
 May 2013,5,Great Experience at Le Diwan Rabat,I have stayed at this hotel multiple times! The overall ambiance at this hotel demonstrates higher degree of Luxury and made me feel like home. Great location - just a short walk to the train station and most tourist spots in Rabat. Staff have been very friendly and maintain great customer relations. My room decoration made me feel very comfortable and every single furniture has been ergonomically designed. They have great in-house restaurants and offer delicious Moroccan and International dishes. I will definitely stay here again when I visit Rabat as it brings more value for the money I spend.
 May 2013,4,"Very nice hotel, about a 20 min,walk to the Medina","I was traveling with a group of 28 people to Morocco. It was a great place to stay for one night. Rabat is not that exciting, but a good place to sleep after a long flight. The rooms were well appointed. Nice sheets and towels. The food at the restaurant was good. A bit pricey but okay for most. The staff was courteous and very helpful."
 March 2013,5,Highly recommended,"Great hotel, centrally located at walking distance from the city center which makes it an ideal alternative for both business travelers and tourists. Ma family and I had a nice stay there thanks to a friendly staff, comfortable rooms and not to mention La Brasserie, the hotel's restaurant. Overall, Le Diwan is a reliable alternative and good value for the money."
 March 2013,4,Excellent hotel in Rabat just do not take room 104 in front of a noisy clinking air conditioner...,"Excellent hotel, well located and nice rooms with comfy beds and linen. Room 104 had a nice garden terrace but the only drawback was the clinking air conditioner on the terrace just in front of the window..."
 March 2013,3,Pros and cons,"Located within walking distance of Rabat’s version of Champs Elysees, the hotel was presented as a 4-star property. It’s not. It’s a solid 3 – small [as in room size - quite a challenge for two adults to move around, and find a place for two average suitcases], quaint, but lacks the welcoming and helpful staff that is a staple at four-star properties, and housekeeping efficiency. Early check in was arranged, yet we found our room unfinished: bed made, surfaces cleaned, but no soap, toiletries or tissues in the bathroom, no glasses for beverages. Though it was March, the weather was warm, and the room was extremely stuffy; a/c was disconnected for the season, so we had to make-do with an open patio door – which could not be left open while we were out, since it’s very…"
 March 2013,4,Overnight trip to Rabat,I recieved a genuine warm and friendly welcome upon arrival. The staff showed excellent customer skills. My room was clean and fresh and the bedding high quality. the evening meal was wonderful and a large menu to choose from. I really enjoted breakfast with the large range to choose from and beautiful setting. Would recommend to any traveller.
 February 2013,4,Pleasant 1 night stay,"We were on a 2 week trip all over Morocco, so my comparative ratings are based on Moroccan experiences. Very pleasant room, comfortable bed, modern bathroom. Terry robes and slippers were especially welcome. Breakfast buffet was extensive and tasty, but the room was very crowded and the staff couldn't keep up with the table turnover and food/juice/coffee replenishment."
 February 2013,4,Good choice in Rabat,"My husband and I stayed here for one night as part of a Gate 1 Travel trip to Morocco. The check-in area was tight so our tour manager had us sit in the bar area until he had the rooms straightened out. Very small elevators could fit only a couple of people with luggage at a time. The room was very nice and quite comfortable--no complaints. We were able to walk to a park area near the palace without any trouble. There is an outdoor sculpture park (concrete) set down off the street a very short distance from the hotel (walk directly straight out the front door for a couple of blocks--it is on the right). There were several outdoor cafes around the perimeter of the park where we had a less-than-delicious lunch, but we enjoyed the people-watching and the restaurants seemed to…"
 March 2013,5,A great place to Stay in Rabat,"We stayed at this hotel on our first night of a tour throughout Morocco. The hotel is quite nice and we were immediately impressed. We are elderly travelers and had no problems with any of the facilities at this hotel. One caveat, the tubs are slippery and use of the tub mat provided is a must. We were impressed with the fact that almost immediately we were handed a TripAdvisor sticker by a staff member and encouraged to submit our comments following our stay. Our room was renovated, comfortable (great beds) and immaculate. The room service staff was friendly, helpful and noninvasive. They gave us additional supplies quickly upon request. The room was medium sized but quite adequate, as was the bathroom. The shower had great water pressure and temperature and was easy…"
 February 2013,5,LA BRASSEIE for Dinner,"We flew in, exhausted after a long trans-atlantic flight and just wanted a quick meal. What we got was probably one of our best dinners during our stay in Morocco. You must try their chicken tajine. It was the best I had while in Morocco, and I tried it in just about every city over a two week stay. The service was ok, but would have been better I'm sure if only they'd spoken more english, or we'd spoken more french. It's a white table cloth ambiance, but because it's a hotel restaurant, the two nights we were there, it was mostly fellow travelers or businessmen. AS FOR THE HOTEL, THE BEDS WERE ALSO PROBABLY THE MOST COMFORTABLE OF OUR STAY WHILE IN MOROCCO."
 February 2013,4,Good first impression of Morocco,"We got to this hotel around 10.30 am and staff was prepaired to receive our bus tour. They were helpfull in filling out forms and assigning room keys. When asked a question, if the person addressed couldn't quite understand, they fetched someone who could. Most staff were really nice and helpful. Location of this hotel is good-easy walk to all the interesting older parts of Rabat-we had a great time exploring the walls, Medina and Harbour. Rooms were nice and even the streetside ones were quiet. Wi-Fi was good and breakfast was plesant."
 March 2013,5,Beautiful Hotel,"This was our tour hotel in Rabat. It is in the business district. A very modern, nice hotel. The staff was very friendly and helpful. They spoke very good English. We asked them to recommend a nice place to eat. They sent us to a cute little place that had excellent food. The rooms were modern and very nice. WiFI was free and connection was good."
 February 2013,4,Very Comfortable,"We only stayed in this hotel one night with a tour group. The location is good. It is walkable to many of the attractions in Rabat. The food in the restaurant at the hotel was very good, although the service was slow. Overall a very pleasant stay."
 February 2013,4,Pleasant stay for a business traveler,"I stayed at Le Diwan for one month on business. It is clean and the staff are professional. The highlight is the restaurant. The chef makes excellent Tangine (traditional Moroccan dish). Service is more relaxed than what I'm used to coming from NYC but I know it has to do with the food being made fresh and on the spot rather than being rep-prapared and re-heated. Room service is more relaxed and, in my experience (since I'm not proficient in French), unpredictable. As a business traveler it was nice to not stay in a hotel with primarily tourists. Only a few people could speak English but the few who did spoke it perfectly. Travelers who know French won't have any problems communicating with the staff. The only thing missing from Le Diwan is a gym."
