 October 2018,5,Wonderful bed !,"After a long day travelling from Chefchauoen it was great to check in to this hotel. Very welcoming staff, well appointed room with everything one needs when travelling, but the bed ! It was how I imagine sleeping on a cloud would be like. Soft, luxurious, as soon as I hit the bed after dinner I didn't know a thing until it was time to get up. Very good breakfast with all you need and more plus attentive staff to pour your coffee ! I am sure you won't do better than the Hotel Le Dirwan when you visit Rabat. And, the reception staff are multi lingual so there are no communication problems."
 October 2018,4,2 Nights in Rabat,"This hotel provides a great location to navigate Rabat by foot. Within a 5 minute walk to the Museum of Contemporary Art as well as the Museum of Civilization. 30 min (or so) walk to the Atlantic Coast. Everything between the hotel and the coast is what you want to see. The room is comfortable and clean. There are 2 closets, a desk, a sitting chair and a small balcony. The restroom has a shower/bath combo and offered a hair dryer as well. Across the street and next door are 3 or 4 different banks with ATMs. The hotel restaurant I hear is quite good. I will be trying it this evening."
 September 2018,3,Ok,Spent two nights here. Rooms were dated and the bed mattress was extremely firm and I like a firm mattress. The hotel has a lobby bar and there are many ATM’s near the hotel. The buffet breakfast was adequate but nothing special.
 September 2018,3,Nice small hotel - 94 rooms,"We stayed two nights are this hotel. There was free Wi-Fi, good air-conditioning, mini-bar, spa, safe, hair dryer, balcony, tea and coffee. There was a small balcony, but no chairs or table. The hotel needed a good cleaning, the bathroom needed some work, and was somewhat dated. Staff was very nice. It was centrally located and easy to get around. Breakfast was excellent."
 September 2018,2,Not The Best,When I arrived in the lobby it had an outdated look. The small lobby was cluttered with bicycles and acrylic cases holding purses. It could use a good cleaning. I used the rest room in the lobby and gunk was on the wall. My room smelled so musty I had to request a new one. It still was musty but tolerable. The air conditioning was minimal and did not really cool the room. Unfortunately I cannot recommend this hotel.
 September 2018,5,So good,WE stayed 2people and a baby in the hôtel. Diwan is the perfect place to spend quality Time with family or in a couple The food is absolutely fantastic and thé place clean and authentic. Staff is incredibly nice and helpful . WE would recommend this place to anyone intrested in enjoying a quiet Time in rabat.
 September 2018,3,ok But not 4 star,"Although this hotel looks great in the photos, other than the lobby, I am not sure where any of those bedrooms are. The restaurant is good. The rooms are very clean, the bathroom is ok but our bath needed some repair work. The staff was great and helped you out if needed. The elevators are a 4 person or 2 person with luggage."
 November 2017,4,Great Hotel,Stayed here for two nights during a tour of Morocco. The hotel was clean and comfortable. The hotel staff...all professional and polite. The location was not ideal...not close to major attractions. They serve a lot of tour groups...so a rather busy hotel. The breakfast buffet was good with a variety of food.
 June 2018,5,Great,"Perfect location on the city centre n As they say "" service from the heart"" They have a great team very helpful staff and such a wonderful reception from the check-in to chek-out. Good breakfast with smiling staff. Thanks i will come back as soon as i can."
 May 2018,3,Clean Hotel,"This hotel is not in a great location if you are a tourist. While you are within about a 15 minute walk to Mohamad V blvd, the hotel itself is right on a roundabout with heavy traffic and nothing nearby that is suitable for tourists. The purpose of this hotel in this particular location escapes me. The hotel itself is small, but very clean and most of the staff was very friendly. The housekeeper did open the door and just walk in while I was still in the room and I found that uncomforting. The room however was clean, we did not have our towels replenished on our second day. The food in the hotel is average fair. Nothing that you are going to remember either well or poorly."
 March 2018,4,very nice modern hotel,"the location is terrific in the middle of the town and easy walking distance to anything the hotel food was terrific and the room were lovely.and very modern, there is lots to do in the area of the hotel as well"
 May 2018,4,Stay at Hotel Le Diwan Hotel,"We stayed two nights at the hotel. The first night was on our own and the second was included in our tour with the Overseas Adventure Travel tour group. When we arrived, we were almost overcome by the extremely sweet smell of the flowers that decorated the lobby. If you have an allergy to that sort of thing, you should stay somewhere else. We came in late at night and were very tired, but the staff was wonderful and kind through the check in procedure and the whole time we were there. The breakfasts were good. The hotel was clean, and we would definitely stay there again."
 May 2018,5,Very nice,Diwan is a very good hotel.good food .the atmosphere during the evening at the bar With candle light is very nice.i really apreciated the excellent service and the breakfast.thank you very much we will turn again.
 May 2018,5,‘Wow experience’,Visited their buffet restaurant for Iftar. I am very satisfied with the food varieties and quality. Totally met my expectations. Their hospitality is also well appreciated. Service associates smiling face made the evening. I will definitely come back here.
 June 2017,4,Second Visit- Pleasant stay!,"Visited Le Diwan Rabat second time within 1 year. It was pleasant stay as my previous visit. Hotel is centrally located. It was a nice touch that they put mini sweets/pastries in the bedroom in the evening. The rooms were spotless and the bed was comfortable, though washrooms are small. Hotel restaurant is good but costly. There are good and cheaper options available nearby."
 May 2018,3,One night was enough,Room was ok. Difficult to avoid water spray on the floor from the shower over the bath. Pillows too soft and lifts are slow and wonky. Poor service at breakfast and ordering an omelette seemed to be an ordeal for staff member.
 April 2018,5,Fabulous and helpful customer service,Staff was extraordinary and really went out of their way to make our stay wonderful. They made great suggestions as to places to visit and checked in with us on our return to see how we enjoyed ourselves.
 April 2018,2,"Great spa, stay elsewhere","I stayed with some friends and we really enjoyed our hammam scrub and massage at the spa in the hotel. Unfortunately, two of my friends had their locked luggage broken into. Nothing valuable was missing, but the zippers were separated and no longer work properly. Upon checkout I asked to pay for an item that was missing from the minibar. I explained that I had not taken anything during my stay, so the charge was removed. The air conditioning did not work in the rooms, so we were glad to visit during a cooler time. Breakfast was very nice with plenty of options and omelets. We had confirmed an airport pickup that did not show up. I’ve stayed at a few other hotels in Morocco and the Le Diwan does not measure up in terms of quality and hospitality."
 April 2018,4,A Nice Hotel in a Good Location,"Frankly, we were delighted to be in our room at Le Diwan, after four plane flights and coping with the Air France strike action. Later we noticed that the room was comfortable, well appointed and in an excellent location. The lobby was cheerful with flowers which appealed to plane-wilted travelers, and the reception desk even gave my sister a small bouquet of roses when they discovered the day was her birthday. The hotel is located across from a bank and an ATM and only several blocks from both the Art Gallery and the Museum of Archaeology/Civilization that houses the antiquities from Volubilis. Just remember, if you walk there, that Rabat drivers think zebra crossing crosswalks are merely decoration on the road. Cross at the stop lights, preferably with Rabat citizens who…"
 April 2018,4,"Good hotel, but not quite the level I expect for an MGallery Hotel","This hotel looks great from outside, but could use an upgrade of the rooms and bathrooms. Friendly staff, though the room cleaning staff should speak better French, rather than almost exclusively Darija! Restaurant was enjoyable with a good selection for lunch and dinner. The breakfast options fell short of my expectations and staff in the breakfast restaurant could be friendlier."
 April 2018,4,"Good location, Comfortable Bed, Friendly Staff","No complaints at all about the bed (really comfy) or the staff (really friendly) or the location (very central and near many things). Only down sides were elevators slow and not working properly and the bad breakfast!! Rotten fruit and moldy cheese! Perhaps it was just because this breakfast was early for our tour group, but it seemed like some of it had been left out or something."
 May 2017,3,Very Pleasant place Welcoming Staff But ....!!,"The Hotel has a beautiful reception and Grounds to match. Professional Front desk "" Young Receptionist"" Very friendly Management ,both gentleman and lady in the front desk are communicative and very helpful, doorman ,security and all of them were fantastic.I was there me and my wife, once we get to the hotel, I was struggling with parking area, when I found a spot beside the hotel, then it came from nowhere an old man blocking my way asking for money in order to park my car after,after 20 minute of arguments and inappropriate insults finally the doorman find a spot for me, it was very stressful to deal with that old man ( he was illegally taking advantage of that space ) well, after all, it wasn't the hotel's mistake, but hope if they can fix that parking issues. Rooms were…"
 March 2018,5,"Comfortable, well located hotel",Small things matter a lot. The WiFi was outstanding everywhere in the hotel. Was able to monitor some important events back home. The hotel front desk staff was very helpful. The room was spotless. Breakfast buffet had a variety of fresh fruit and pastries. The room was quiet and the bed comfortable.
 March 2018,4,This 4 star hotel in Rabat has comfortable rooms and is clean and well located in Rabat.,We stayed at this 4 star rated hotel in downtown Rabat for one night only during a busy visit to Morocco. It is probably a popular hotel for business people visiting this capital city of Morocco. Rooms were okay size wise and beds were comfortable enough.
 April 2017,5,"""Absolutly Amazing"" Excellent Hotel","This was my Husband first time staying in Rabat and we really enjoyed our selves. Breakfast had good variety of choices, and staff were very accommodating. Noura Miriam, Yassin they was excellent. Room attended was very helpful. Front desk staff and Security men's were very courteous and helpful. We can not wait for our return stay in May 2018. Inch'allah"
 March 2018,4,Comfortable & Clean,"Very well located in Rabat. Easy check in. Our room was on the top floor with a nice view. Our room was spacious , clean and comfortable. Bathroom was comfortable, the bathtub into the shower is high to get into, not bad but be aware of. Bidet is a nice touch. Beds were comfortable and the comforter was nice and warm. Things to consider this hotel does a lot of business with tour groups so be aware of large groups that could be there. Staff is very friendly. Nice intimate bar with great staff. Restaurant for dinner was very good. We had a fish dish with a brown flavorful sauce and a salad that was wonderful. Breakfast buffet is a breakfast buffet, nuff said."
 February 2018,5,Nice Start,"It was our first night in Morocco and I couldn't understand why after a long international flight we would travel 2 more hours to Rabat. I'm glad that we did! The Le Diwan was a wonderful way to start our visit to Morocco and Rabat is much calmer and cleaner than Casablanca. The first night we dined in the hotel restaurant. The soup was delicious! The wait staff was very friendly. The room was clean and well equipped. Breakfast was bountiful albeit a bit hectic with spotty service (not enough coffee, had to ask for utensils), but there was about 40 of us on the bus tour that bombarded the room all at once. There are some restaurants within walking distance and taxi service is readily available and reasonable."
 March 2018,1,Terrible is understated,"Booked a double room for 1 night and due to unforeseen circumstances I was not able to make it with my wife. Even-tough the reservation was guaranteed with a Visa card, Accor platinum membership status with all my details and a phone call to verify all the details, my wife was not permitted to check in because the reservation is under my name. Its really disgusted that they treat women so disrespectfully. Eventually, i cancelled the reservation after minutes of arguing with the Front desk manager on the phone to allow my wife to check in because it’s very late and look to at as a humanitarian case but with no success. They promised not to charge me no-show. Let’s wait and see!!!!! Accor should watch out for there properties in Morocco. This is the second Accor property among top…"
 February 2018,4,Short Stay,Had a one night short stay at this hotel. Arrived on a Sunday for a start of my Morocco tour and most business was close. Hotel was nice and small. Room was clean and nice size. My only concern was there was no peep hole for the door. I was a little concerned when having to open the door late night for room service.
 March 2018,5,Good,Wonderful dining am loving it. Its a great place I love it. Great hospitality. Sure worth visit. People are great and places and roads are awesome. Do visit . I will come back soon. I love the food. Bhago .
 January 2018,4,Very comfortable,"The only real negative was the smoke in the lobby (there is a bar in the lobby and smoking is a normal thing there). Otherwise very comfortable, very nice staff, good rooms. Location is in a business district--but it is possible to walk to some nice and interesting areas. We also had dinner in the restaurant and it was quite good. Not Moroccan food, but good flavors. There is no special charm to this hotel--more modern than quaint."
 February 2018,5,"Great service, great location","This is an ideal hotel for your stay in Rabat. Staff extremely helpful, and friendly, making your stay a joy. There is a great bar area, with live music regularly, the adjoining restaurant has a good varied menu, and breakfast service is very good with an excellent selection. Rooms are comfortable, well equipped with a good bathroom. Would highly recommend."
 January 2018,5,Nice hotel and location,"Nice location! Easy 15 minute walk to the Medina, nice, safe neighborhood. Spacious, clean room. We had a small balcony on our front side room. Breakfast was good, plenty of food and choices. Bar in the lobby. Staff were all friendly and accommodating. Would recommend!"
 January 2018,4,Pretty Good!,"Nice hotel with friendly staff; some English, mostly fresh speaking. The rooms are lovely with nice beds, sheets and pillows and excellent water pressure in the shower. The air conditioning doesn’t work that well and to open the window is just too noisy with the street traffic. Our package included a breakfast buffet and had all the basics, eggs, sausages, fresh and canned fruit, yogurt, cheese and meats. They also have coffee. Order a cappuccino if you want milk - but it’s not really a cappuccino with foam. The hotel has several ATMs outdid to the left and right of the hotel to exchange money."
 January 2018,5,Comfortable Well Located Hotel With Good Staff,"We stayed here two nights. We had dinner in their restaurant the first night and had a terrific meal, with a great starter Moroccan Salad and a Salmon dish that was outstanding. We had a bottle of Moroccan wine recommended to us by the waiter which was very good and only about US$30. Our room was on the first floor button noisy at all. Comfortable bed and nice desk to work at. Good storage. Staff was very helpful"
 January 2018,5,Excellent Hotel & Service!,"I stayed at this hotel on my first stop with a tour group visiting Morocco and we received the most amazing welcome from the hotel staff. All of the staff was so attentive and the hotel atmosphere was superb. My friend and I had our luggage delayed by the airline, and the hotel manager went above and beyond providing us with complimentary shirts and some basic essentials to get us by until our baggage arrived. The restaurant food was excellent and the prices were very reasonable. The rooms were cozy. I slept like a baby! Breakfast was great. There was a wonderful variety of breads and the Moroccan soup was a hit in my book. We didn’t have enough time to try the spa services, but the people in our group that did said it was fabulous service. I am so grateful that this was the…"
 January 2018,5,Le Diwan,"Amazing. This hotel and staff go above and beyond. Air France lost my luggage leaving me without clothing, toiletries and daily necessities. It is very scary to be in a new country without your luggage. The first night in the hotel we were talking with staff about our situation and disappointment with our airlines. Turns out the man we were speaking with was the general manager (Alaa Squalli) of the hotel. When we went back to our room we found two new (AC/DC) shirts on our beds, slippers and robes. We were also given a toothbrush and toothpaste. Just that made us feel more relaxed and cared for. We had clean clothes to wear the next day and a robe to wear to bed. The next day, one of the other employees (Noura) commented on our shirts and asked about our situation. Turns out…"
 January 2018,3,Nice Neat Boutique Hotel,Room small but functional. Good shower. WiFi good at first but spotty at times. Fairly good location within walking distance to museums and Médina. Restaurant attractive with a limited number of selections.
 November 2017,5,Kim and Richard k from Canada,"The staff provided exceptional service over our two week stay. Friendly, welcoming , caring and ready to help in any way. The breakfast is outstanding as are the breakfast staff exceptional. Noura and her team are amazing. The front desk staff are extremely helpful and made excellent recommendations for visiting the city . We loved our stay and will look forward to return. We enjoyed the beautiful art, good food , professional environment and good location. 5 star service!!!!!"
 December 2017,3,Rough/tired hotel with great staff,This hotel is nicely situated and there are quite a few restaurants in walking distance. The Kasbah and even Chellah ruins are within a 1 to 1 1/2 mile walking distance. The staff was very helpful and the breakfast was decent. We stayed for two nights. We had two rooms on the fifth floor. The carpet in the hallway was absolutely the worst I have seen in a hotel especially considering this is Sofitel. There were large spots on the carpet and it looked really old. Same thing for the room carpet. The lobby and hallways are also a little dark. Overall it’s okay but would have liked to stay at the other Sofitel.
 December 2017,5,Morocco trip,"Spent 2 nights at hotel as the first stop in our Morooccan tour. It was a very long day of travel so it was wonderful relax in the well appointed rooms. Breakfast provided a variety of options even for the vegans in the group. Had a marvelous time at the hotel lounge making friends and having a good time singing and dancing. Great location, very nice rooms and the awesome staff made our short stay memorable."
 December 2017,4,Business trip,Very convenient hotel for few days business trip. Very helpful staff! Restaurant offers very nice French/Moroccan food with good selection. Parking area could be a bit bigger and its difficult to drive in directly from roundabout.
 December 2017,5,Great Staff,"very nice stay in the hotel, even if it was just for 3 days but it was a sweet experience in terms of pretty much everything even the smallest details, cosy rooms after a long tiring day nd a cool view over the neighbourhood nd that low light bar downstairs is just perfect . overall a ""Great Stay"".."
 December 2017,5,Excellent,I appreciate really the great and personal service of the staff . Definitely coming back and recommending the hotel 100/. Thanks for all the great food I enjoyed and the talking with the people working there who were very kind in different levels
 November 2017,4,Nice hotel is a good location in Rabat,We stayed here as part of a tour group. The rooms were very clean and nice. The breakfast was very good with lots of options. The location worked well being on a main thoroughfare and just a few blocks from the main part of the city. There are 3 banks just across the street so getting local currency is easy. There are several nice restaurants near by.
 October 2017,4,Well located downtown Hotel,Employees were very helpful and the location excellent. Our Moroccan trip began here and it was a good place to start. We walked to most everything or took a cab for $2. Negotiate BEFORE you get in the cab. Imane & Badr were especially helpful when our friend was ill.
 October 2017,4,Good location with friendly staff,"We stayed at the hotel for two nights with a Gate 1 tour. The lobby is small but the staff were friendly and helpful. The location is near resturants and banks for those needing an ATM. On our flight to Morocco a lens of my wife's glasses came out and we could not get it back, In coming into Rabat we notices an optical shops which happened to be a block from the hotel. The man at the shop quickly fixed the glasses-without charge. The hotel is also a good place to learn to negotiate traffic in the large cities of Morocco, where pedestrians do not have the right of way"
 October 2017,4,Good Location,Travelling with a group so check in was quick. Rooms were large and clean. Breakfast was very good with a wide variety to choose. Staff were friendly and quick to answer any questions. Centrally located with several nice restaurants within walking distance.
 November 2017,5,Our favorite hotel of our tour!,"This was the nicest hotel that we stayed at on our Gate 1 tour of Morroco. It had a quiet elegance and charm and was centrally located close to attractions and numerous great restaurants. Staff was very friendly and spoke good English. The rooms were spacious enough and included a stocked minibar and a couple free bottles of water. The beds were the most comfortable we slept in during our time in Morroco and the air conditioning worked well for us warm blooded Americans in Morocco's ""cold season."" Room was a little small and on the darker side. Would certainly stay again and recommend it to anyone. Only downside is their breakfast is astronomically expensive. Definitely google a locally owned place where you'll get a delicious meal for a fraction of the cost."
 November 2017,4,"Location, Location: Le Diwan","We stayed at Le Diwan Rabat with Gate 1. The company takes pride in choosing properties that are centrally located and this hotel is no exception. We drove 1 1/2 hours after landing in Casablanca so the first order of business was to exchange money. There are three banks across the (very busy) street. As a sidebar, friends wanted to change USD but most banks do not provide this service. Instead, you need to go to an exchange office. I used the ATM with no difficulty. Rabat Exchange, a short walk from the hotel has favorable rates. Our room was clean and comfortable although small. The entry way has an inset place to put a suitcase; a luggage rack also is available. We appreciated the kettle for morning tea and the small balcony for a view of the city. Adequate toiletries,…"
 October 2017,4,Nice place to stay,"The room was very adequate, nice, clean and comfortable. The breakfast spread was more than enough. The staff very friendly. The stairs up to rooms, no handrail. Used elevator. The room had a door that opened onto a patio with plants and such. Probably during earlier months would have been place to sit. Able to get map and directions at Lobby Reception. There is no traditional gift shop. There are on display things you can buy, but they are high end. No washcloth in bath (but that is typical of any lodging in this country). Hair dryer included, and it worked well."
 October 2017,5,Good hotel,"Very good hotel ,good service .excellent sttaf.im from egypt .i came here with my freinds for a conferrence.very tasty food.thank you very much for your help.i will come back again.thanks a lot.see you next year."
 October 2017,4,Nice Gem in Rabat,"Traveled as part of a group tour. Immediate check in and helpful front desk. Room was just the right size with bathrobe, slippers, and bathroom amenities. Room could use updating but it was clean. Really well located about 20 minutes walking from the Medina. Lots of restaurants nearby. Breakfast was kind of sparse but adequate."
 October 2017,4,Good hotel but WATCH OUT AT CHECKOUT- 3% charge unless you tell them not in $US,This is a pleasant and well located hotel. Good food in restaurant. But they fooled us at checkout by not asking if we wanted the charge in Moroccan currency or $US with a 3% charge. Our Capital One Visa doesn't charge for the conversion.
