 January 2023,5,Comfortable room and 5 stars bathroom,"Very nice riad, a mix of tradition and modern design. Very kind people, excellent breakfast and service. Very convenient location in the Medina and very close to the seaside for a breathetaking sunset, and very close to Oudaya Kasbah"
 December 2022,5,Beautiful Riad!,"Beautiful little Riad! The staff was so accommodating! They informed us of an app to order pizza delivery at night. The next morning, they set up a delicious breakfast for my family that consisted of fresh juice, fried eggs, pomegranate, and assortment of breads."
 December 2022,5,Riad Zyo is a perfect hotel,Zyo is a beautifully designed boutique hotel with large rooms and modern bathroom. Designed and decorated in a modern way with traditional nuances. Beautiful courtyard with a lovel small pool. Food was the best we have had in Morocco. Service was impeccable. Loved it all!
 November 2022,5,Perfect in every way (with kind and honest staff!),"This Riad is amazing. Beautiful and well located. I rarely write reviews, but the food and service were spectacular and so I felt I had to. My husband is vegan, I am not, and they made us his-and-her taglines for dinner, both were incredible. As for breakfast, normally I skip it, but this was one of the best breakfasts I have had (see photo, they also offered eggs but I was not hungry enough to have them). In terms of service, everyone was kind and lovely. What stood out the most was when my husband and I checked out three mornings ago, we forgot our wallets and passports in the safe. We were two blocks away and the front desk person came running after us with our wallets and passports. This could have been disastrous, but he was so honest and literally saved our trip. …"
 October 2022,5,Beautiful Spot Near Edge of Medina,"A sweet spot just inside the Rabat medina, we found this place welcoming and elegant. The room was large, and gave us room to manage our bags without using the bed. While the medina can be a noisy place, window shutters definitely make for easier sleeping. The host provided us with a great dinner recommendation (Dar Naji) about a 10 minute walk from the riad, breakfast tasty and plentiful."
 November 2022,5,Wow,"This is a beautiful and modern riad. No simple spartan aesthetic here. The lobby and seating area right away let you know you’re in for a treat. The roof is pretty and spacious. And the rooms was so amazing we were taking photos of it. Huge modern bathroom with 2 toilets. A shower that looked like it was from a Manhattan penthouse. High ceilings, gorgeous tile work, carvings, and beautiful wood door and window slats. Helpful staff. Would I have preferred to not be on the ground floor, yes bc the windows open onto the area off the lobby where everyone walks and there is no view of the outdoors, but that’s probably the room type our tour company selected. Still, the room was quiet despite a loud outdoor party happening next door. Very tasty breakfast and location is convenient…"
 August 2022,5,Gorgeous Riad,A beautiful Riad that showcases local artist’s work. The owner was welcoming and spent time chatting to us about his Riad. His pride for it showed through. The pool area was gorgeous and the rooms vibrant and unique. Our breakfast was very tasty. The staff were wonderful. A fabulous stay.
 October 2022,5,Fantastically and unexpectedly modern!,"As many other reviewers have mentioned, this Riad is a really a modern hidden gem in the heart of the the old Medina. From the moment we entered we were blown away by the beauty and simplicity of this riad. The initial bedrooms we had in the main floor riad were spectacular, but due to an electricity issue on the main floor were accommodated on the 2nd floor with two separate rooms. Both rooms were very modern and very well furnished. We had everything we needed and the beds were very clean and comfortable. The riad overall was very quiet and they had a wonderful quaint rooftop. Breakfast was very well presented and tasty-everything seemed to be a work of art! Although we only stayed one night, I would highly recommend this place based on its overall location and services…"
 October 2022,5,Wonderful riad,"Excellent all around. Beautiful room, clean, location, quaint. We loved the breakfast and all the art. Staff were very very helpful and friendly. Rooms were very quiet. We would recommend this riad to everyone. So location was right in the center of the old city and we saw several women walking alone at night so it felt very safe."
 September 2022,5,Oasis in the Rabat medina!,"A beautiful and charming place to stay. Quite an oasis amid the hustle and bustle of the Rabat mednia. Walking through the door, you step into a tranquil courtyard with a sparkling plunge pool. Mohammed greated us with cookies and some mint tea. The rooms are well appointed and comfortable. Some are in the ""new"" building that sits on the site of the old post office, and some in the attached riad that has been throughly and lovingly renovated, that dates back to the 14th century. We met the owner, Ali, who showed us his photo album of the before-during-and-after photos of the renovation. Breakfast each day was more than ample and delicious, Mohammed, Hamza and the rest of the staff couldn't have been more accomodating."
 January 2023,5,Comfortable room and 5 stars bathroom,"Very nice riad, a mix of tradition and modern design. Very kind people, excellent breakfast and service. Very convenient location in the Medina and very close to the seaside for a breathetaking sunset, and very close to Oudaya Kasbah"
 December 2022,5,Beautiful Riad!,"Beautiful little Riad! The staff was so accommodating! They informed us of an app to order pizza delivery at night. The next morning, they set up a delicious breakfast for my family that consisted of fresh juice, fried eggs, pomegranate, and assortment of breads."
 December 2022,5,Riad Zyo is a perfect hotel,Zyo is a beautifully designed boutique hotel with large rooms and modern bathroom. Designed and decorated in a modern way with traditional nuances. Beautiful courtyard with a lovel small pool. Food was the best we have had in Morocco. Service was impeccable. Loved it all!
 November 2022,5,Perfect in every way (with kind and honest staff!),"This Riad is amazing. Beautiful and well located. I rarely write reviews, but the food and service were spectacular and so I felt I had to. My husband is vegan, I am not, and they made us his-and-her taglines for dinner, both were incredible. As for breakfast, normally I skip it, but this was one of the best breakfasts I have had (see photo, they also offered eggs but I was not hungry enough to have them). In terms of service, everyone was kind and lovely. What stood out the most was when my husband and I checked out three mornings ago, we forgot our wallets and passports in the safe. We were two blocks away and the front desk person came running after us with our wallets and passports. This could have been disastrous, but he was so honest and literally saved our trip. …"
 October 2022,5,Beautiful Spot Near Edge of Medina,"A sweet spot just inside the Rabat medina, we found this place welcoming and elegant. The room was large, and gave us room to manage our bags without using the bed. While the medina can be a noisy place, window shutters definitely make for easier sleeping. The host provided us with a great dinner recommendation (Dar Naji) about a 10 minute walk from the riad, breakfast tasty and plentiful."
 November 2022,5,Wow,"This is a beautiful and modern riad. No simple spartan aesthetic here. The lobby and seating area right away let you know you’re in for a treat. The roof is pretty and spacious. And the rooms was so amazing we were taking photos of it. Huge modern bathroom with 2 toilets. A shower that looked like it was from a Manhattan penthouse. High ceilings, gorgeous tile work, carvings, and beautiful wood door and window slats. Helpful staff. Would I have preferred to not be on the ground floor, yes bc the windows open onto the area off the lobby where everyone walks and there is no view of the outdoors, but that’s probably the room type our tour company selected. Still, the room was quiet despite a loud outdoor party happening next door. Very tasty breakfast and location is convenient…"
 August 2022,5,Gorgeous Riad,A beautiful Riad that showcases local artist’s work. The owner was welcoming and spent time chatting to us about his Riad. His pride for it showed through. The pool area was gorgeous and the rooms vibrant and unique. Our breakfast was very tasty. The staff were wonderful. A fabulous stay.
 October 2022,5,Fantastically and unexpectedly modern!,"As many other reviewers have mentioned, this Riad is a really a modern hidden gem in the heart of the the old Medina. From the moment we entered we were blown away by the beauty and simplicity of this riad. The initial bedrooms we had in the main floor riad were spectacular, but due to an electricity issue on the main floor were accommodated on the 2nd floor with two separate rooms. Both rooms were very modern and very well furnished. We had everything we needed and the beds were very clean and comfortable. The riad overall was very quiet and they had a wonderful quaint rooftop. Breakfast was very well presented and tasty-everything seemed to be a work of art! Although we only stayed one night, I would highly recommend this place based on its overall location and services…"
 October 2022,5,Wonderful riad,"Excellent all around. Beautiful room, clean, location, quaint. We loved the breakfast and all the art. Staff were very very helpful and friendly. Rooms were very quiet. We would recommend this riad to everyone. So location was right in the center of the old city and we saw several women walking alone at night so it felt very safe."
 September 2022,5,Oasis in the Rabat medina!,"A beautiful and charming place to stay. Quite an oasis amid the hustle and bustle of the Rabat mednia. Walking through the door, you step into a tranquil courtyard with a sparkling plunge pool. Mohammed greated us with cookies and some mint tea. The rooms are well appointed and comfortable. Some are in the ""new"" building that sits on the site of the old post office, and some in the attached riad that has been throughly and lovingly renovated, that dates back to the 14th century. We met the owner, Ali, who showed us his photo album of the before-during-and-after photos of the renovation. Breakfast each day was more than ample and delicious, Mohammed, Hamza and the rest of the staff couldn't have been more accomodating."
 October 2022,5,Lovely Riad inside the Medina in Rabat. A place you must experience!,"From the moment we walked into this beautiful riad we felt like we were at home. We were welcomed by the some delicious cookies and the traditional Moroccan Mjnt tea. The details in de orating this location was wonderful. Our room was beautiful with a comfortable bed and large bathroom. Our breakfast the following morning was Exceptional. If your planing on staying in Rabat this is the place to come too. The owner was kind and helpful and directed us to a lovely restaurant outside the Medina . If you want to experience Morocco you need to stay in the Medina. We loved our stay here and the staff was so accommodating. Thank you for,a wonderful experience!"
 September 2022,5,Great location,"Food is great, service amazing, location is perfect. We had a really nice experience at this riad! I loved the proximity to the restaurants and the shoreline. It is close to all the fun parts but tacked away from the hussle of the city noise."
 August 2022,5,Fabulous choice in Rabat!,"What a wonderful welcome to Morocco after a long flight from the US! After a delicious dinner, the owner gave us a tour of his careful restoration of the historic building and the gallery of local artists’ work. Everyone was friendly and helpful and the accommodations lovely and comfortable. The bathroom and shower were especially nice. I highly recommend this choice in Rabat!"
 August 2022,5,"Stunning, peaceful, ideal for art lovers","Absolutely stunning riad and the owner is so incredibly lovely. Showed us around the villa and was incredibly knowledgeable about art. He makes a point to showcase art throughout the property of up and coming Moroccan artists, which is so lovely and the art is stunning. Most peaceful little oasis, the most beautiful place we visited in Rabat and were lucky enough to stay here!"
 July 2022,4,A Modern Twist,"Great location near the medina. All the charm expected of a Moroccan riad, but with a modern twist. The decor is contemporary and modern compared to the more traditional decor seen in most riads. Hospitable staff. Mint tea and pastries to welcome you upon arrival. I was allowed to choose between the room I had reserved and another that was unoccupied. I appreciate being given that choice, because I actually chose the other unoccupied room. Both rooms were comfortably furnished. However, the room I chose was more spacious with better natural lighting. The food was good. My only issue was noise. It was quite loud with children laughing and playing late into the night. It was my first day in Morocco. Despite being exhausted after 25 hours of international travel, I could not…"
 May 2022,5,Beautiful Riad in Beautiful City,"A elegantly designed, smartly organized, well run and perfectly located riad with a gracious and smartly attentive staff. We had a chance to meet and chat at length with the owner, Ali Chraibi, who generously lavishes his love of art and graceful living on his riad. He is proud of his creation and we were more pleased & happy to reside there than as any other riad, hotel or Airbnb my wife and I have ever stayed at. And the city of Rabat itself was a great discovery, fascinating and beautiful. We can't recommend this riad and this city more!"
 April 2022,5,"Chic, chilled out hotel","Warm, friendly welcome! Great location for the medina and kasbah ! Nice room, great shower with plenty hot water and pressure ! A first in morocco ho ho ho ! Cool modern chic now with a beautifully restored extension. Rooftop terrace with real grass to chill out on after a days sightseeing !"
 April 2022,5,Simply Beautiful!,"It was such a pleasure staying at the lovely artistic Riad Zyo! Loved that there was a blend of the modern and old Moroccan architecture in one riad + beautiful works of art all around! Such a feast for the eyes! Was lucky to also have been the first guest to occupy my room in the new wing. Great breakfast! Strong Wi-fi! Good location right at the edge of the Medina. While the humble and very hospitable owner, Dr. Ali is an active surgeon, he is a patron of the arts and closely involved in the design of the riad as well as personally attends to the guests when he’s there! Highly recommended!"
 March 2022,5,Stay in the heart of the City in Rabat Surrounded by Art,"You are treated like family in this traditional, Moroccan building with unique rooftop garden, nice pool/fountain and interesting artwork everywhere. The hotel is located on a quiet street a few doors down from great shopping streets with good restaurants. Great, helpful staff!"
 October 2021,5,A Treause,The treasure hidden in the Medina is certainly an unexpected treasure. From the outside like any other Riad . It is in reality two Riads. One entrance an artistically designed modern look with traditionally design elements. However thru another entrance on another small street the other half it is a traditional Riad built in 1375. The tile work still amazing after all these years. The staff is friendly.
 October 2021,5,Chic and comfortable,This was our first stop in Morocco and it was an awesome transition. The hotel staff was kind and attentive. The rooms were clean and comfortable. Water pressure was great. The hotel itself is gorgeous and a nice blend of old and new. Rooftop deck was amazing. Breakfast was delicious. Would highly recommend!
 September 2021,5,"Stylish, conveniently located lodging with rooftop dining - - * highly recommend *","Ideal place to start our 15-day Moroccan adventure with a two-day stay. Warm welcome with tea and cookies, plus a later greeting from the owner (a physician). Delicious fresh fish dinner, served in a well-decorated (two oversize portraits of children) room with three tables alongside the courtyard (see photo). Medallion cabernet sauvignon wine from Morocco was the only red selection, fortunately -- delicious, and it became our choice throughout the trip. (Cost here of 250 dirhams was the lowest.) Dinner also is served on the terrace -- as are breakfasts, if wanted. Comfortable, quiet, well-sized room with inner courtyard view and bottled water provided daily. Ideal location near a main shopping and banking boulevard, a tram line and within a 10-minute walk from the Casbah…"
 October 2021,5,Stylish and cozy place to stay. Amazing,This is one of the most beautiful Riads we have been in Morocco. A perfect combination of Morocco heritage and modern design. Must go there. The rooms are cozy and stylish. The breakfast was delicious. I felt there as if I were at home. You really should stay there when in Rabat
 September 2021,5,Delightful,"This was our first stop in Morocco and we were delighted with the friendly welcome. It was wonderful watching the proper way to make mint tea, served with delicious homemade pastries. The courtyard with pool was just as lovely as the photos and we opted for their dinner: chicken tagine. It was fab. Would definitely recommend."
 May 2021,5,Hospitality and Beauty,"We are delighted. The hotel is clean, tidy, beautiful and full of hospitality. Beautiful paintings are eye catching. Food are delicious and mouth watering. And the hotel owner sit with us chatting along dinner sharing stories about Moroccan life style. 👍🏻 Do not forget to enjoy the rooftop..."
 May 2021,5,First night in Morocco.,"Upon arrival in Rabat we were greeted by the owner of the property. He carried our luggage to the room, which was modern and very clean. That evening his chef prepared a dinner for two of local Moroccan food. Because of COVID regulations being lifted we were the only guests in a 12 room hotel. Extremely friendly staff and we highly recommend this property. Bill and Angie Lardent Smyrna, TN We used Audrey Travel who contracted with TraveLink who provided us with a professional driver for our ten day trip."
 February 2021,5,By far the best place to stay in Rabat,"Riad Zyo was recommended to us and it has by far exceeded all our expectations. The owners, Ali, his son Younès and the entire staff were more than just super helpful and friendly : they made us feel like Riad Zyo was our home for a week. Breakfast was delicious and tailored according to our taste. Whatever we needed - taxis, laundry, recommendations etc - there was always someone to immediately find a solution. The riad in itself is a beautiful mix of contemporary architecture, cultural heritage and art gallery. The rooms were comfortable and clean, we slept very well. It is also conveniently located, close to pretty much everything there is to see in Rabat. We can only hope to have other occasions to come back. Once again, a million thanks for this wonderful experience…"
 February 2021,5,Tea and Dinner,"This place is a hidden gem. We visited jist to have a private dinner but should have also stayed at least one night in one of their beautiful rooms. We were greeted by the chef when he arrived. Took us on a wonderful tour of the Riad and prepped some tea for us on the roof top terrace. In the middle of the hustle and bustle of the medina, the noise softens as you enjoy the view of your surroundings. You feel you are in the old part or Rabat but you are comfortably sitting at a well appointed and beautifully landscape terrace. The owner was wonderful as well. He took us on a short tour of their expansion into the next Riad. One side is modern while the new side is traditional. You can see how much care they've taken in renovating both sides. The dinner was amazing. It was…"
 September 2020,5,A.M.A.Z.I.N.G!,"Riad Zyo clearly exceeded our expectations. Hidden between the little streets of the old Medina, the moment you step in, you feel that you're already in a different world. The lighting, the colors, the interior design, the cleanliness, the staff... everything is very well thought. Every little corner of this Riad has history and the attention to the details is mind-blowing! I definitely recommend it!"
 March 2020,5,Beautiful Riad with Artistic Design,"The riad has the feel of an art gallery. It is tastefully designed and the room is very spacious and spotlessly clean. It has a great location as the supermarket is just nearby. The host, maybe an artist himself, skilfully made some mint tea for us when we arrived and explained how the steps were needed to refine the tea. It’s great. Thank you very much. We enjoyed our stay in this riad very much and will definitely come back again."
 February 2020,5,Beautiful little Riad,The Riad is a stilish little place in the Medina of Rabat. Very friendly staff and owners. Delicous breakfast. They gave me homemade cinnamon icecream with fresh orange slices when came back after a loung city walk. Beautiful pictures on the walls like a art gallery. Thanks for the nice stay
 October 2019,5,Artsy elegance in the Rabat medina,"I only had one night in Rabat during my tour of Morocco. I would have gladly stayed longer. Riad Zyo was a dazzling riad in a convenient location. It was pleasing to the eye with its many artworks, rooftop garden, and brilliant turquoise central pool. My room was comfortable, and they offered a delicious tagine for dinner and a full breakfast in the morning. Ahmed and Mohammed were most helpful and welcoming. Riad Zyo was perhaps my favorite riad during my two week travels through Morocco."
 January 2020,5,Excelent service at Zyo Ryad,"We were assisted at Zyo Ryad Design by Hisham, who is the most perfect guest host we could expect! Thank you so much Hysham, for your kind assistance, the Ryad is beautiful and comfortable! We will recommend to all our friends!"
 December 2019,3,could be better,"we stayed in Riad Zyo one night at December 2019 (we got 3 rooms for that night). 2 of the rooms had no hot water at the evening and one of them did not have hot water on the next morning as well. the carpets were dirty in all the rooms, and one of the rooms the air condition was on 30 degree but it was no good. luckily they have another option for heating so after a few hours the room was warm. the Riad is very lovely and all were very polite and friendly. the breakfast was wonderful and very generous and the breakfast room was lovely and heated. (Morocco in December is very cold at night and it was very important to have hot water and heating). we all thought it can be much better with some more care and maintenance."
 December 2019,5,Honeymoon trip,"We did a five day tour honeymoon tour at stayed at Riad Zyo for one night. The room was beautiful and authentic, very comfortable and modern infused with the beautiful Moroccan culture. Our reception was so warm and friendly. This hotel felt like home away from home because of how lovely the hotel staff are. Mr Ali was so kind and hospitable during our breakfast and the breakfast was just lovely. We came back again and stayed another day at the end of our trip because we enjoyed it so much and again, we were not disappointed. Thank you Mr Ali for the little honeymoon souvenirs. I would highly recommend this hotel. Clean, comfortable, spacious and beautiful. The small pool at the reception was my favourite! Strongly recommend to anyone looking for a warm and intimate stay!"
 December 2019,5,Best Riad in our Morocco Trip,"By far, this was the best riad we stayed in our 16-day tour in Morocco. Friendly and realiable service, perfect location near the medina/souks, stylish and modern rooms and a wonderful breakfast. Well done, guys!"
 December 2019,5,"Small room, but excellent experience","My wife and I stayed here on our first night of a whirlwind tour of Morocco. (I’ve posted a separate review of our excellent tour company, Good Travelling in Morocco.) Beautiful, charming place, with a welcoming friendly staff. Room we stayed in was quite small, but otherwise comfortable. Wonderful bed; quiet; good climate control; bathroom small with limited space to place stuff, but shower was reasonable size. Breakfast was excellent, with a mix of traditional and modern. Like many other charming riads, getting to the room requires going up steep, winding, uneven stairs, so not a good place for anyone who’s mobility challenged, but not a problem for us. Rabat was not the highlight of our trip to Morocco, but it was worth visiting for sites such as the “Incomplete Mosque”,…"
 December 2019,5,"Beautiful accommodations, excellent dining",This beautiful Riad was elegantly appointed. The chef made special accommodations for a gluten free diet and the food was wonderful. We had to depart very early the next morning and the staff again made special accommodations to be sure coffee and cakes were waiting for us. Excellent experience in every way!
 November 2019,5,Charming Riad,"Riad Zyo is ideally situated inside the medina. We stayed here on our first night in Morroco and it did not disappoint. Our room was spacious and included basic amenities we would possibly need. The staff were friendly and helpful. The breakfast was good. Overall, Riad Zyo provided a very comfortable stay. Highly recommended!"
