 October 2019,5,Perfect Riad Stay,"I reserved three rooms in Riad Zyo for myself and the friends I was traveling with, and we were all so happy with everything about our stay. The location is convenient to explore the very colorful and traditional Medina. Upon entering Riad Zyo after our flight from NYC and a short tour around Casablanca, we were overwhelmed how beautifully yet simply the Riad was decorated, especially with the amazing photographs and colorful paintings. We were warmly greeted by a staff member, invited into the salon, and offered mint tea and home-made cookies. Every member of the staff was so hospitable and pleasant. The home-made breakfast by Adda was served in a lovely room, with beautiful coordinated plates and bowls. Omelettes were offered in addition to the baked goods and jams. The rooms…"
 November 2019,2,"Avarage Hotel, Nothing Luxurious.","Me and my friend were offered a bigger room at the second floor but wasn't anything surprising. There was a glass door in the bathroom which you can see through and wasn't comfortable having that type of door in the hotel room. Also the bath was very dirty, like someone threw bunch of sand or dirt. Noticed the bed sheet underneath was covered brown or red stains, don't know if that was blood by any chance but had to get rid of it because no way I was sleeping on it. The breakfast I and my friend had was very good, however, we didn't choose anything. Staff members were bringing breakfast for us without telling us what we wanted. Overall, the hotel needs improvement with hygiene."
 October 2019,5,"The warm hospitality, the location and the breakfast were great!","This was a lovely stay. The location is perfect in the Medina, walking distance to major sites like Udayas or an easy taxi ride away from Chellah ruins. The breakfast at the Zyo was really great, they offered omelet with cheese and the best Msemen (flakey filo dough type pancakes) that we had our whole trip, and fresh squeezed orange juice with coffee of course! The host who welcomed us Ishmaan (apologies for spelling), was so warm and took time to orient us on the location and the sites. Later the following day after I took a small fall on the uneven streets in the Medina he came to the rescue with bandaid and first aid for my elbow. We loved our time at the Zyo and recommend it wholeheartedly."
 October 2019,5,Lovely riad and super nice staff,We stayed here on the first night in Morocco. It's a beautiful and clean riad with a great location. The reception staff was very friendly and helpful. The breakfast was well prepared and tasty. I highly recommend it.
 September 2019,5,definitely recommend,"We, two couples, stayed only one night at beginning of our trip. Welcoming hosts, dinner nice, able to order a bottle of wine, accommodation ie rooms very nice. We were impressed and would recommend. It was a bit of an oasis after bustle of flights, airports, drive, etc. So we were pleased to be welcomed."
 October 2019,4,"Nice place, food okay",We stayed there one night on our way to Chefchaouen. Lovely little riad. Room was small but very nice. Lots of outlets for charging. We had dinner there and it was tasty but small portions and expensive. Dinner cost over 50 USD. If you want to save some money there a many street restaurants to choose from. Would definitely recommend this place.
 October 2019,5,Penny,We stayed at this Riad two nights ago! They were very gracious and did everything they could to Make sure we were happy! They had a wonderful breakfast The decor was very aesthetically pleasing. On the top floor there was a wonderful little retreat where you could see the scenery for miles
 September 2019,5,Fantastic Riad,It was our first night in Morrocco. The host was extremely welcoming. Offered coffee and the most amazing mint tea with biscuits before going to our room. The bed was extremely comfortable. Had an amazing breakfast. The Riad is a beautiful place to stay and would highly recommend it to anyone staying in Rabat. Very quiet and centrally located.
 September 2019,5,Modern and beautiful riad,"Located in the medina, a few steps from the main street. Zyo is a modern and luxury riad. Even it is near the medina, it is so tranquil. We spent only one night there. The riad provides you everything you need: super comfortable big bed and pillows, clean room, big towels, hair dryer, a/c, safe etc. It also has a stunning rooftop terrace and swimming pool at the center."
 September 2019,5,Amazing,"Very nice Riad, great location in the Medina, amazing room with a great shower. Friendly staff! Increadible dinner I had in the terrace, with great food and thanks to all staff! The mint tea they serve is awesome!"
 September 2019,5,Amazing!,"From the moment we stepped inside this beautiful place, we received a great service for our stay. The rooms are beautiful and the food is amazing. Look no further this is the best place to stay in Rabat."
 September 2019,5,Overnight in Rabat,Riad Zyo is clean and beautiful. Staff is friendly and the wifi is fast 😁 loved our room and coming home to comfort after two days of flying to Morocco. Expect to be greeted with a steaming cup of Mint tea and a smile
 August 2019,5,Fabulous !,We were made to feel welcome the minute we arrived by Ishaam. He served us lively mint tea and Moroccan pastry. The Riad is beautifully designed with a pool in the middle a lovely lounging area and breakfast room. The bedrooms are stunning with lovely bathrooms . And the best is the rooftop to sit and relax . The Riad is located in the Médina and you can walk to the markets for food and shopping . Also lovely sites to explore in walking distance. Breakfast was unusually different and very tasty. Will definitely recommend it.
 August 2019,4,Comfortable Accomodation,"Super friendly staff who goes out all way to help guest with their checking in and answer all enquirys , centrally located in the Médina that sells cheap food , Basic amenities provided , shampoos/Bath Wash/ Hair dryers etc.If eating in crowded street if Médina is not your scene , the in house comfortable dining area serves local cuisine , however I had not eaten in this place other then the morning inclusive breakfast ."
 July 2019,5,Beautful Raid with a lovely team.,"We spent time at Riad Zyo at the end of our round trip from Marrakech to the desert and back to Fes and Rabat. We enjoyed Rabat and Riad Zyo enormnously. The city Rabat is a mixture of modern and tradition Marocco, as is Riad Zyo. The Riad is a traditional patio house which has been modernised in a very tastful way. What you get is a comtemporary atmosphere in the heart of the old city ('medina'). Even in the rooms traditional handmade elements like floor tiles remind you of the rich and old culture of Marocco. But the real treasure of Riad Zyo are the people. We haven't felt so welcome in a long time. All warm, helping and interested people,: the hotel owner, the manager, the cook, the cleaners… Highly recommended!"
 June 2019,5,Lovely place and great service,"We stayed there for one night while visiting Rabat. The place is lovely and relaxing. I explained my gluten dietary restrictions to Hicham, the manager, and he arranged for a lovely breakfast packed with eggs and fruit. Definitely could have stayed longer."
 June 2019,5,Lovely mesh of old and new,"A lovely little riad in the heart of the old market. Clean and beautiful, with eclectic modern paintings which somehow work perfectly with the traditional Moroccan style. Everything was wonderful - service, rooms, beds, bathrooms. Gorgeous little pool in the center of the structure,surrounded by a sitting area and a small dining room. Super friendly service."
 June 2019,5,Wonderful,"We had a one night stay at this gorgeous Riad. The staff were so friendly - it really made the stay! Our rooms were beautiful, a modern take on traditional Moroccan style. We liked the art that was everywhere. Breakfast was good and we loved the pool and roof terrace. Location was great too - perfect for exploring the Medina."
 April 2019,5,Great Riad in the Medina,"We had a wonderful stay at Zyo Riad. Rooms were bright, clean, and comfortable. Food was excellent, Internet fine. Well run! Be sure to check out the pool and roof top garden. We will definitely be back!"
 April 2019,5,Artistic riad in the medina,"Wonderful riad in the Medina of Rabat. The place is beautiful, with a nice artistic touch that really catches the eye. The staff is super friendly (special mention to Hicham!) and helpful and the food is very good, also! We had a truly amazing stay, and if we ever come back to Rabat we'll definitely choose Riad Zyo again."
 March 2019,4,Excellent,"We enjoyed our one night stay here very much. The room was spacious, bright and clean. We dined in the restaurant and enjoyed our meal. The hosts were charming and made us feel welcome on our first night in Morocco."
 March 2019,5,"Élégant, well located","We stayed only one night, due to travel schedule. Each room is unique, many great design touches. Young staff, friendly and eager to help. Served a properly prepared mint tea. Delicious group dinner and breakfast. Sweet roof top thoughtfully designed and well maintained. You may arrive bedraggled but you will leave refreshed. Oh, mature couple, frequent travelers."
 March 2019,5,Exceptional 10/10,Travelled as 65 year old couple. Accommodation booked by tour company. Walk to the Riad is down an alley from the main road..We became a bit more anxious as we were walking towards the Riad with our luggage. Once the door opened you are in an oasis of tranquility. The difference from the outside to the inside is quite remarkable. We were met by Mohammed the manager. Very welcoming and offered us tea and cookies and showed us to our room. The entire place was spotless. Nice size bedroom and nice bathroom with shower. We were in the room (called-Favourite). It’s up one flight of stairs and the window faces the alley/lane but this was not an issue at all with regards to any noise. The bed was very comfortable-large king size bed and lots of cupboard space. We were only staying…
 March 2019,5,A lovely place to stay in the Medina,We stayed here the first night in Morocco. It was lovely and the staff were friendly. We had a nice room overlooking the street which was quiet by 8pm. We were greated with the traditional mint tea and cookies. The breakfast was delicious with eggs to order. The location in the Medina was perfect.
 February 2019,5,A modern riad,"We been only a night to this beautiful modern riad in the middle of the Médina near a road full of shops.. the room it was really nice and clean, the staff is professional and they welcome you with a cup of mint tea at your arrived.. the breakfast is really good"
 January 2019,5,Beautiful Riad Combining the Old with the New,"Our first night in Morocco was spent at Riad Zyo and what a delightful experience it was. When we entered the riad we were greeted by a charming member of the staff who offered us freshly brewed mint tea and then showed us to our room. The rooms are built around a lovely blue pool which is the focus of the riad. Our room was very clean, very comfortable and quite modern with WiFi included. We chose to have dinner at the Riad and are so pleased that we did. The food was delicious and beautifully prepared. I do not hesitate to recommend Riad Zyo to Trip Advisor travelers."
 September 2018,4,Lovely Ryad,"The ryad - essentially a guess house - was cozy, simple, clean and well maintained with friendly staff. We arrived early one morning and the staff met us by the car to carry our luggage to the hotel which is a short 2 minute walk. Upon entry, they led us to the common sitting area, across from the lobby to complete the paperwork where they also poured the traditional Moroccan tea and snacks to welcome us - which was beautifully presented. The Ryad seemed to have been recently completed renovation - there was no dust or work happening while we were there but there were a few minor things in the one of the rooms that they had previously told us they were working to fix but overall it did not affect our stay as our rooms were spacious and comfortable. The rooftop patio is a…"
 February 2019,4,Modern Riad,"Stayed at Zyo one night, appears to be recently refurbished. Rooms were fresh, light and bright, finished to high standards. Modern fitouts - radiators, hair dryers, bright lights, etc. Nice roof terrace with small garden to sit in the evening, no views though. There was a water feature in the courtyard, wasn’t sure if it’s meant to be a small pool! Nice lounge area and dining area. Good location for the medina, short walk to shops, restaurants and the beach. Breakfast was included, was good, a number of different cakes and pastries on offer. Hot water shower was temperamental and WiFi signal was weak, but otherwise, was a good stay."
 December 2018,4,Lovely boutique hotel with a modern take on the traditional Moroccan ambiance.,"In the Medina, yet reasonably accessible except for a short walk. Very hospital staff, excellent service. Rooms are modern and well appointed. Breakfast and dinner were excellent. Decor is a contemporary take on Moroccan decor, and unlike the traditional riads we stayed in elsewhere. Highly recommended."
 December 2018,5,"Welcoming, beautiful and well located Riad in the Rabat Medina","The riad looks even better in person. The courtyard is stunning and the rooms are well appointed. Hisham, who works at the Riad, was a wonderful host who went out of his way to make us feel comfortable. Riad Zyo stood out as one of the best riads that we stayed in during our trip to Morocco. Thanks to Hisham, Mohamed and the staff at Riad Zyo for making our stay memorable."
 December 2018,5,VERY GOOD,"Perfect Riad (hotel) , good location, good room and very good bed . Typical and traditional decoration ,very nice! the breakfast is very good with traditional food ! If you visit Rabat , it is a very good place to stay."
 December 2018,5,"Beautiful, contemporary, excellent service",A real treat to stay here - beautiful artwork and tile-work throughout this classy riad. Breakfast also fantastic. Felt immediately at home. Short walk to great street food in the centre of Rabat. Make sure to check out the rooftop terrace with a great view of Rabat.
 December 2018,5,Nice place and friendly staff!,"We stayed there just last night for one night before traveling to another city and this Ryad was the perfect place for us. The room was inviting and the place even had a lovely rooftop terrace where we played cards while enjoying a pleasant evening. Hisham, was the one who waited on us. He was kind, friendly and very helpful. I highly recommend it."
 December 2018,5,Boutique Riad,"A modern expression of traditional Moroccan riad in a very strategic location of Rabat. Just out of the riad, you have many restaurants and small shops for you to patronise. The riad is dazzling with Moroccan-styled design but with modern colours. If not for the cold weather, I will really love to have a dip in the pool because it was so beautiful. The staffs were extremely nice and breakfast was superb! If you are going to stay in the hotel, it is a must to get the breakfast! The room was very clean. All the basic amenities were provided for! We love the riad very much! Love, Joreen and Anjana"
 October 2018,5,Great Small Riad in Rabat,"Zyo is a small riad (5 or 6 Rooms). in Rabat. Our flight into Casablanca was delayed and by the time our driver had gotten us to the Riad it was close to 11:00 pm. The staff of Zyo had been kind enough to keep the kitchen open to serve us dinner which we very much appreciated since there didn’t appear to be any other options for food in the area. The dining area is pleasant with interesting art and is adjacent to a small central pool that is open to the sky. The room was of modest size and comfortable. Getting to the Riad is a bit of an issue. When we arrived late in the evening, and we we left at around 9:00 am the following morning, the street to the Riad was closed. So we had to haul our luggage a few 100 yards to get to the Riad. This was an unpleasant experience…"
 October 2018,5,Best Riad in Morocco,"You will not be disappointed in this hotel. It's newly renovated, clean and brighter than any other riad we stayed in during our two week trip. The meals were superb; even the mushroom omelette served at breakfast was delicious. The service was impeccable, too."
 October 2018,4,Very nice modern Riad,"Our experience was a good one. The food was very good, the location is central in the Medina, and the service was excellent. The only issue was our room was on the first floor off the central area and there were people speaking loudly in this area in the evening. This issue was the people, not the hotel itself."
 August 2018,5,Favorite and most beautiful riad visiting Morocco,"We did a tour of the imperial cities passing thru Rabat. This was by far my favorite riad. After passing the reception area, there is a pool in the courtyard to relax in after walking around the city. The blue of the pool is so beautiful with the white of the building and the art from local artists. I also got lucky to have the room with the terrace garden outside. Besides being beautiful, the staff was wonderful, and the food was outstanding. The chef not only made the best food we ate on our trip, but also again beautifully presented. This was by far my favorite riad on all levels."
 October 2018,5,A spotless well run beautiful riad,"We were given a warm welcome on check in and after tea and a chat about where to go in the Médina were shown to our room. As with most roads, the room was small but there is a beautiful roof terrace and a very inviting small pool on the ground floor. The Riad is very centrally located being in the heart of the old Médina. We loved our stay and would definitely recommend."
 October 2018,5,An oasis in the capital,"Juxtapositions of modernity within the traditional medina. An oasisi for the weary traveller with its own garden on the rooftop. Great hospitality, delicious food, wonderful deco, what more could one wish. Highly recommended."
 October 2018,5,Without doubt one of the best,"Its hard to know whether its the fantastic friendly service, lovely food, or the stunning room/outdoor areas that make this riad so memorable. A stay here will never disappoint. Its location in the medina but close to Avenue Laalou makes it very handy/easy to get to using a taxi. Mohammed has such an attention to detail, be it at your arrival with refreshments, during breakfast or dinner, or when helping plan your local tour guides."
 September 2018,5,Sepp kleinen,Very nice area inside the city of rabat clean room a varied breakfast tanks to my brother ahmed for his services and welcoming us and giving us all of his time in dinner and i hope to visite you again
 October 2018,5,Modern riad,We stayed at 7 places in Morocco and this was the nicest spot. Lovely room and central courtyard and rooftop. The breakfast was delicious! The Riad is right in the Médina so very handy location for exploring the old town.
 September 2018,5,First time vacation in Morocco,Fabulous location close to the important sights. Authentic Moroccan charm with a wonderfully contemporary flair making it a joy to stay at. Restaurant is superb. Staff is charming and accommodating. The owner shows his love of what he has created in the Ryad Zyo. Perfect base from which to explore the wonders of Rabat
 September 2018,5,"Good location, great service",This was our first two nights in Morocco. We were pleasantly surprised with quality and decor. Both of the two breakfasts and dinners were a great way to get introduced to local cuisine. They have a roof side pool which looked inviting though we didn't use. We found our stay to be welcoming and comfortable.
 July 2018,4,Great location,"A very modern riad for our one night stay in Rabat. There is a pool for you to relax in as well as common reading and eating area. It's a short walk to lots of small shops and places to get a quick snack. Perhaps a 10 minute walk back to the Andulsian Gardens. The room itself was clean and modern with a small desk. Even though we had a room on the ground floor next to the pool, it was still pretty quiet. Breakfast the next morning was very filling."
 March 2018,5,Best breakfasts and most genuine hospitality we experienced on our trip,"We stayed here for three nights in March and found the Riad Zyo staff incredibly welcoming. They truly embody the warm hospitality one reads about while planning a trip to Morocco. We had dinner at the Riad one night and it was some of the best food we ate on our two-week trip. The breakfasts were varied and far far better than the other two riads we stayed in elsewhere. The mattresses are firm, which is great for some, but not so for me. When I made a little whine about that at breakfast one day, we returned to the room to find a different mattress being installed. When I admired a little porcelain tagine being used at dinner, our last night, I asked the owner where I could find them and he had one wrapped up to send home with me. This kind of responsiveness was so touching,…"
 August 2018,5,Amazing! Highly recommended.,Zyo riad is stunningly beautiful! The staff are lovely and very helpful. The garden Oasis in the roof is very tranquil and a wonderful space to unwind! We had dinner and breakfast both of which were lovely. Don’t miss a chance to stay here.
 June 2018,4,Riad Zyo Pristine,"A beautiful modern Riad, we had a very nice welcome with mint tea. A short walk to the Medina. I enjoyed a swim in the beautiful refreshing pool. Breakfast was special and the bright breakfast room looked out over the pool. A great way to start the day. Staff all very friendly.Very impressed and would stay again."
 July 2018,5,Sure to win your heart over,Quaint place to truly give you a taste of Moroccan hospitality. The receptionist/manager Waled was well-informed about guests' needs. The food they served was simply exquisite and of good portions. It was fresh and tasty and of Moroccan authenticity. They have a rooftop as well where you can lay down at and look at the overview of the neighbourhood. Walk outside and you will be greeted with locals going on about their day and restaurants. The place was rather artistic with a little pool and very well-maintained. We were truly satisifed and it is value for money.
 July 2018,5,Wonderfull place,"This place is really worthwhile staying at. We were welcomed personally by the owner and offered water, tea and coffee with home cookies (free of charge). The place is a riad but in a modern light style. It has a lovely rooftop terrace and lovely little swimming pool to cool down. We had a very nice lunch there, but the real treat is the breakfast: they serve you all kinds of lovely home made treats in stead of the usual buffet. We felt spoiled! The room was great. Very pretty and spotless clean. We highly recommend this place."
 July 2018,5,Bella Zyo,"Amazing Riad un the heart of Rabat medina.once that you open the main door you're immediatlely it by the beauty of this place,a mixture of modern and old history.Recently renewed,very clean and comfortble. A nice swimming pool,a beautiful garden on the rooftop where you can have a rest and get your green the.staff very knd,Akran speaks good english and he was very helpfull and kind.great breakfast.this the place to be in Rabat!"
 July 2018,5,Terrific!!!,"My friend and I spent only one night in this fantastic riad but there’s nothing else to say that it was terrific! Akran is very kind, nice and helpful. The riad is at the beginning of medina and near to the main street."
 June 2018,5,The perfect stay,"Everything about our stay was perfect. The location in the medina was ideal for exploring Rabat on foot. The room was clean and modern, yet it still felt like we were in a Moroccan riad. The breakfast was different both mornings, offering a tasty variety of freshly baked items. From the start of our stay, the polite and helpful service we received from Mohammed really helped us to make the most of our stay in Rabat. He helped us to plan a route that enabled us to see all of the most interesting locations. The roof terrace was an ideal spot to enjoy mint tea. Definitely give this place a try."
 May 2018,5,Lovely riad,Just stayed one night. In the medina but very easy to walk from the main street where you are dropped off. Excellent location to explore the Kasbah & medina. Very good breakfast. And exceptional front office - very friendly & helpful. Go for it!
 May 2018,5,Lovely modern riad,"I only had a short one night stay at the end of my trip, but I very much enjoyed this stylish little riad which had a unique, modern, artsy feel. I opted to have dinner here and the meal was delicious, as was the included breakfast in which the staff kept bringing out more and more plates of food. The location seemed convenient, though I didn't have much chance to explore."
 April 2018,4,Charming Riad in good location,"We stayed here, on our first night of our trip to Morocco and it was a comfortable place to stay. This is a modern take on a traditional Riad, and the owner displays works of art of contemporary Moroccan artists in the public spaces. We had a warm welcome upon arrival, excellent and helpful staff, excellent breakfast. My only disappointment was the room was that the room we were in was really small even though there were more spacious rooms available."
 April 2018,5,Luxury in the middle of the Medina,"My husband and I stayed here for two nights. It was the perfect location in the Medina and to walk to the Kasbah. Breakfasts were wonderful with fresh squeezed orange juice, hot coffee, and home baked goods and eggs! We highly recommend a stay here!"
