 May 2019,4,Very pleasant stay,"The staff were fantastic, highly professional and welcoming from reception check in to the house crews. The room was lovely and very comfortable, spacious, bright and with a balcony to 'people spot' from. Plenty of coffee/tea in the room and bathroom complimentary toiletries too. Shortly after my check in, the floor manager checked that everything was to my satisfaction. I don't know who was more surprised? Either me about being asked or the floor manager finding me in my jammies mid-afternoon. I didn't eat in the restaurant that evening, however went down to breakfast by 0815 ( early by my standards!) the next morning and found the buffet a bit lacking as they had obviously been very busy before I got there. That said, the waiting staff were tremendous and made sure that I…",Hotel_Royal_Tulip_City_Center_Tanger-Tangier_Tanger_Tetouan_Al_Hoceima,Hotel_Royal_Tulip_City_Center_Tanger,Tangier_Tanger_Tetouan_Al_Hoceima
 June 2019,4,A pleasant stay,"We stayed last week 4 nights in this lovely hotel. De staff was very kind, especially two of them, unfortunately i don’t remember their names. One was a man who was working there at the 2nd of June in the morning, and the other one was a girl who was working the 30th of May. This girl gave me so many good advices for places to visit. The staff at the breakfast room was very kind too. The room was very clean and the view was great. We had an upgrade, what we loved of course:) Two points of critic; There was a misunderstanding about the dinner. I thought dinner was 340 dirham for two person (one adult one child) but it was for one person. That’s very expensive, especially when one of us is a child and the other one vegetarian. But they solved it very slightly. So thank you for…",Hotel_Royal_Tulip_City_Center_Tanger-Tangier_Tanger_Tetouan_Al_Hoceima,Hotel_Royal_Tulip_City_Center_Tanger,Tangier_Tanger_Tetouan_Al_Hoceima
 March 2019,2,Not 5 star hotel reception/restaurant - Reception et restaurantes pas au nivex d'un 5 etoiles,Positive: + Room with balcony Negative: - Reception/Conciarge: The reception is not good in turist advices and it is practically absent in any assistence after sales. - Restaurants: There is only one restaurant in the evening and the service is very slow. - Swimming pool,Hotel_Royal_Tulip_City_Center_Tanger-Tangier_Tanger_Tetouan_Al_Hoceima,Hotel_Royal_Tulip_City_Center_Tanger,Tangier_Tanger_Tetouan_Al_Hoceima
 May 2019,1,Bad Experience!,"First 5 star hotel where we got stolen our money! We were three girls travelling from Spain and booked a room from May 4 to May 5. First even though there is indoor pool at the hotel, you have to pay in order to use it! So we paid and entered and put our bags in lockers . After being in swimming pool and massage (also paid) we took our bag and only in the evening during dinner found out that there is no cash left in the bag. As it was hidden in the wallet under bills from shops it could not fall. After we went to check the room if everything is ok, we realized that from a bag of one money has also disappeared. We went to the reception to ask about the clarification for which they said it is issue of spa department and we should come here in the morning. Ok we waited the morning…",Hotel_Royal_Tulip_City_Center_Tanger-Tangier_Tanger_Tetouan_Al_Hoceima,Hotel_Royal_Tulip_City_Center_Tanger,Tangier_Tanger_Tetouan_Al_Hoceima
 April 2019,5,An amazingly beautiful hotel,"i went to this fancy hotel, my friends and i to enjoy a tea corner that they have ( el momento ) , my 2 other friends slept in the hotel and they find it very nice , it’s a new hotel where the food is delicious and the personals are professional & kind !i highly recommend it.",Hotel_Royal_Tulip_City_Center_Tanger-Tangier_Tanger_Tetouan_Al_Hoceima,Hotel_Royal_Tulip_City_Center_Tanger,Tangier_Tanger_Tetouan_Al_Hoceima
 March 2019,5,X.O Bar,Located in the Royal Tulip is a piano lounge called X.O Bar. Naoufel and Mohamed Guenouni made our night caps pleasant as we listened to the amazing piano player. The hotel is very nice but this was the icing.,Hotel_Royal_Tulip_City_Center_Tanger-Tangier_Tanger_Tetouan_Al_Hoceima,Hotel_Royal_Tulip_City_Center_Tanger,Tangier_Tanger_Tetouan_Al_Hoceima
 February 2019,5,Excellent hotel,"I spent two night in this great hotel with very professional staff. The service was fantastic, the facilities are clean and room is very convenient. The hotel is situated in a very touristic area, walking distance to the beach and a mall. As the parking space is limited, we came late in the evening but the staff took care of the car. The breakfast buffet is awesome with variety of Moroccan food. I recommend this hotel.",Hotel_Royal_Tulip_City_Center_Tanger-Tangier_Tanger_Tetouan_Al_Hoceima,Hotel_Royal_Tulip_City_Center_Tanger,Tangier_Tanger_Tetouan_Al_Hoceima
 December 2018,4,Very comfortable hotel,"I have stayed in Tangier many times in other hotels and areas. This was my first stay in this one and in this area. No regrets whatsoever, on the contrary, i'll be back. Nice staff, large comfortable rooms, incredible breakfast, good hammam... Everything to make your stay an enjoyable experience is there.",Hotel_Royal_Tulip_City_Center_Tanger-Tangier_Tanger_Tetouan_Al_Hoceima,Hotel_Royal_Tulip_City_Center_Tanger,Tangier_Tanger_Tetouan_Al_Hoceima
 December 2018,5,Awesome stay,"I loved this hotel. Centrally located in the city centre and close to malls, the corniche, restaurants, cafes and the train station. Tangier now is only 2 hours from Casablanca by LGV (high-speed train). The room is very nice and staff are friendly. All rooms have balcony.",Hotel_Royal_Tulip_City_Center_Tanger-Tangier_Tanger_Tetouan_Al_Hoceima,Hotel_Royal_Tulip_City_Center_Tanger,Tangier_Tanger_Tetouan_Al_Hoceima
 November 2018,5,Best staff and service,"The Royal Tulip is situated very close to the train station and mall. The rooms are beautiful, clean and the hotel provides free breakfast. Best of all is the staff--specifically Sabrine and Ahmad. They helped us get acquainted, gave us restaurant recommendations, booked tours for us and were just so friendly and pleasant. I can't say enough about how great the staff is.",Hotel_Royal_Tulip_City_Center_Tanger-Tangier_Tanger_Tetouan_Al_Hoceima,Hotel_Royal_Tulip_City_Center_Tanger,Tangier_Tanger_Tetouan_Al_Hoceima
 November 2018,4,"Disappointed walk-in, management made it up to me","I'm a regular here and have previously left a glowing review. Disappointed last night to arrive as a walk-in at 8pm and being quoted the same price as any other customer, despite clearly signaling I'm a frequent customer. Complained on TripAdvisor and directly to management the next morning and I received the apologies I wanted and a complementary upgrade. The management, specifically Mehdi, was very attentive and responsive to my complaints, which is ultimately the best one can expect. I still recommend the hotel.",Hotel_Royal_Tulip_City_Center_Tanger-Tangier_Tanger_Tetouan_Al_Hoceima,Hotel_Royal_Tulip_City_Center_Tanger,Tangier_Tanger_Tetouan_Al_Hoceima
 October 2018,5,Most Friendly staff,I had the best experience in Royal Tulip Tangier. At the check-in they gave me a free upgrade to a see view room. Whenever I called the reception they were always available and friendly. I totally recommand this hotel for its staff and luxury sercices.,Hotel_Royal_Tulip_City_Center_Tanger-Tangier_Tanger_Tetouan_Al_Hoceima,Hotel_Royal_Tulip_City_Center_Tanger,Tangier_Tanger_Tetouan_Al_Hoceima
 October 2018,5,"Very good hotel, close to railway station","Very good hotel, close to railway station. Good amenities (restaurants, bars, wifi/internet, concierge service). Rather calm, not too far from city center and medina. Large choice of food and wines. Taxi service on request.",Hotel_Royal_Tulip_City_Center_Tanger-Tangier_Tanger_Tetouan_Al_Hoceima,Hotel_Royal_Tulip_City_Center_Tanger,Tangier_Tanger_Tetouan_Al_Hoceima
 October 2018,5,Brother Sister time together,"May be you find it a little strange that someone is reviewing a hotel that they have not visited yet. Well, I can tell you that my family went to this hotel when it was inaugurated back in the day. When my sister told me she has a conference there, I did not hesitate to decide to come and spend few days at the hotel and also visit with my sister. So, from Toronto Canada, I will God willing come to a hotel who impressed my family who are all travellers and know about hotels; and always stay in this hotel for the quality of the staff who are hired, the quality of the service which is being offered. I am looking forward to it.",Hotel_Royal_Tulip_City_Center_Tanger-Tangier_Tanger_Tetouan_Al_Hoceima,Hotel_Royal_Tulip_City_Center_Tanger,Tangier_Tanger_Tetouan_Al_Hoceima
 September 2018,5,words can hardly express how much I love this hotel,"Difficult to express in words how much I enjoyed this wonderful hotel! Had a lovely 4 nights stay, all was more than perfect from the moment of check-in (big thanks to Mohamed) till I left. The luxe suite with sea view was very spacious en spotless clean, so was the entire hotel. Great sleeping comfort. Breakfast was very varied, all fresh and tasty, a beautiful start of the day. The entire staff is very friendly and professional. Well worth the 5 stars. Very good location close to the train station and shopping mall, quiet and safe area. Am solo female traveler, felt very safe. Even though I love the charmes of the medina I was every evening happy to return to the comfort of this luxurious hotel. Thank you!",Hotel_Royal_Tulip_City_Center_Tanger-Tangier_Tanger_Tetouan_Al_Hoceima,Hotel_Royal_Tulip_City_Center_Tanger,Tangier_Tanger_Tetouan_Al_Hoceima
 October 2018,4,for us best experience of Marokkean Hotels...,"jumping over by ferry from Algeciras this was our first stay in Marokko - on our selfdrive discovery experience ! And actually after all, it was the best in super quality and ok-pricing. We consider this hotel on a good spanish level, super quality room, very nice Bell-captain Ahmed ( he was excellent and charming - super guy - ready for more in this business, I would believe)... we got nice ""walk-in-rate"" from flexible front-desk lady and had a balcony nice room - view to swimming pool and beach - breakfast for marokkean hotel standard extra-ordinary ! Tapas in 1st floor restaurant really excellent..... very nice all over and to recommend - try to get best rate, as in this country everything is negotiable ;)!!",Hotel_Royal_Tulip_City_Center_Tanger-Tangier_Tanger_Tetouan_Al_Hoceima,Hotel_Royal_Tulip_City_Center_Tanger,Tangier_Tanger_Tetouan_Al_Hoceima
 September 2018,5,Looong Stay Duration,"Let me say briefly; Stayed here more than 1 month. Therefore my feedback would not based on my feeling only but also my observations. First of all I want to thank Mr Saad Boumraya to have such a high motivated and friendly team. Especially to Kaoutar and Lina at reception. Many days I saw that hotel was full , where I didn't expect so much. Breakfasts provide large variety. Cleanliness of rooms and common areas are also in high standards. It is located near to coast in the city center.",Hotel_Royal_Tulip_City_Center_Tanger-Tangier_Tanger_Tetouan_Al_Hoceima,Hotel_Royal_Tulip_City_Center_Tanger,Tangier_Tanger_Tetouan_Al_Hoceima
 September 2018,2,"*DO NOT USE THEIR LAUNDRY SERVICE, IT WAS A SCAM*","I asked the hotel if laundry service was available, they sent staff right away to pick my up clothes, they listed each item and then had me sign. The next day my clothes were delivered with a receipt that didn't mention price just the list of clothes with my signature from the day before. When I checked out of the hotel, I noticed a laundry bill of 1625 MMD, which is about $170 USD!!! Very surprising that they would overcharge like that, it felt like a scam. Other than the laundry, this is a nice hotel with a good location, restaurant, and pool.",Hotel_Royal_Tulip_City_Center_Tanger-Tangier_Tanger_Tetouan_Al_Hoceima,Hotel_Royal_Tulip_City_Center_Tanger,Tangier_Tanger_Tetouan_Al_Hoceima
 August 2018,5,Stayed in several rooms.,"My friends came for my wedding so I was staying with them from time to time in their hotel while I was getting ready. They complained since they were there longer than i was, that the service wasnt good that they asked for things hours before and didnt get them fast(this is what they said) I on the other hand had a great experience I booked this hotel the night of my wedding as my room was cancelled in another hotel. Once I was checking in I saw the Barcelona team which was playing in town that week come in(maybe that's why the service was a bit slow, mind you it was August peak season) anyway back to the story. Checked in told them it was my wedding night and the manager upgraded me to a suite. Which was just gorgeous and the service the next morning was quick and fast for…",Hotel_Royal_Tulip_City_Center_Tanger-Tangier_Tanger_Tetouan_Al_Hoceima,Hotel_Royal_Tulip_City_Center_Tanger,Tangier_Tanger_Tetouan_Al_Hoceima
 August 2018,5,Very good spa,I book massage and hammam The receptionist Lamia was very helpful and smaily The hammam man Abdullah was excellent I definitely recommend this spa and I will visit it again It worth every penny Thanks,Hotel_Royal_Tulip_City_Center_Tanger-Tangier_Tanger_Tetouan_Al_Hoceima,Hotel_Royal_Tulip_City_Center_Tanger,Tangier_Tanger_Tetouan_Al_Hoceima
 June 2018,4,beautiful week end at tangier,"the service was very beautiful in the hotel, stuff very active and ambitious, specially guest relations they were very supportive and even drew an itinerary for us to visit the city, assured transportation and reserved restaurants for us the stay was amazing i totally recommend it",Hotel_Royal_Tulip_City_Center_Tanger-Tangier_Tanger_Tetouan_Al_Hoceima,Hotel_Royal_Tulip_City_Center_Tanger,Tangier_Tanger_Tetouan_Al_Hoceima
 July 2018,5,Best hotel in town,"I’m at the hotel ATM, while I’m writing my review. This place is one of the best in Tangier, well located 2 Min from Tangier central train station, close to the beach. Beautiful sophisticated design. Lovely professional staff. The food we had the was a bit boring and less than what I’m used to it in this hotel. Could have been better !",Hotel_Royal_Tulip_City_Center_Tanger-Tangier_Tanger_Tetouan_Al_Hoceima,Hotel_Royal_Tulip_City_Center_Tanger,Tangier_Tanger_Tetouan_Al_Hoceima
 November 2017,5,Incredible,"This hotel is simply incredible, they welcome you with Moroccan tea and cookies, the bed was one of the most comfy beds i've experienced, the breakfast is just TOP. Their services are amazing. Loved it and can't wait to be back.",Hotel_Royal_Tulip_City_Center_Tanger-Tangier_Tanger_Tetouan_Al_Hoceima,Hotel_Royal_Tulip_City_Center_Tanger,Tangier_Tanger_Tetouan_Al_Hoceima
 June 2018,4,Closest you can get to 5 star,"Very much enjoyed staying at this hotel. Stay was not perfect, but every issue was dealt with quickly and in an efficient manner. As usual staff lacks training and facilities lack inspection so it is up to the client to report things, but that is usually the case in Morocco (unfortunately). Very good location. Excellent breakfast. Very nice staff (except for SOME of the ladies who need to realize smiling is absolutely necessary when working in a hotel of this level). Would stay here again.",Hotel_Royal_Tulip_City_Center_Tanger-Tangier_Tanger_Tetouan_Al_Hoceima,Hotel_Royal_Tulip_City_Center_Tanger,Tangier_Tanger_Tetouan_Al_Hoceima
 April 2018,1,Horrible,Hotel is overcrowded. Staff is inefficient. Breakfast and diner is a nightmarre. Room service is absolutely unprofessional. And the sport area is more a discotheque than a place where you practise peacfully ! The best is that they do not even propose a towel for the sport. You have to bring your own... To be avoided. Ah yes .. the best is that there are some ongoing work next to the hotels and workers finished at 23:00 and start at 6:00... great!,Hotel_Royal_Tulip_City_Center_Tanger-Tangier_Tanger_Tetouan_Al_Hoceima,Hotel_Royal_Tulip_City_Center_Tanger,Tangier_Tanger_Tetouan_Al_Hoceima
 April 2018,5,Wonderful staff,"We went there with my parents for a night. Travelling around Morocco. From the beginning I wasn't satisfied at all but at the end I have to recognize the staff (all services housekeepers waiters and receptionists) and managers professionalism. A special thanks from my parents and I to two ladies not sure about their name oumaima and khaoutar you're tip top. Great location, rooms ok. Hope to see ya guys next year insha ALLAH Sophie Sophie",Hotel_Royal_Tulip_City_Center_Tanger-Tangier_Tanger_Tetouan_Al_Hoceima,Hotel_Royal_Tulip_City_Center_Tanger,Tangier_Tanger_Tetouan_Al_Hoceima
 April 2018,5,Great Hotel,"i Booked online, no payment until i got there. Reception service was excellent, especially from a young lady named Koupter. She made our stay extra special and extra comfortable. The hotel itself is in a good location, close to everything. Do not miss breakfast, it is fantastic!",Hotel_Royal_Tulip_City_Center_Tanger-Tangier_Tanger_Tetouan_Al_Hoceima,Hotel_Royal_Tulip_City_Center_Tanger,Tangier_Tanger_Tetouan_Al_Hoceima
 March 2018,5,Best stay in a hotel in Morocco,"Stayed here three times in total, and each time, they do better than last time we stay there. We are always pampered in a very luxurious way. Breakfast buffet was the highlight of our stays because it had so many choices... Rooms are spacious and very clean. So calm... definitely staying there soon.",Hotel_Royal_Tulip_City_Center_Tanger-Tangier_Tanger_Tetouan_Al_Hoceima,Hotel_Royal_Tulip_City_Center_Tanger,Tangier_Tanger_Tetouan_Al_Hoceima
 March 2018,5,Business in Tangier - Hotel not too far from the Tangier sea and harbour promenade.,"Spacious rooms with good beds, big bathrooms and balcony. Very good cleanliness. Excellent breakfast with wide range of food. Excellent services including pools, massage. 2 restaurants, bars, large fitness.",Hotel_Royal_Tulip_City_Center_Tanger-Tangier_Tanger_Tetouan_Al_Hoceima,Hotel_Royal_Tulip_City_Center_Tanger,Tangier_Tanger_Tetouan_Al_Hoceima
 February 2018,5,Great Hotel in Tanger,"This Hotel is great. Large rooms, king size beds, cleaning is excellent, large bathroom with all you need. Breakfast is Top. You have a huge variety of food, and quality is excellent. Hotel personnel are very professional and are always looking to see what you may need. This is really worthing the price, well placed, near a shopping mall if you want to check local shops. I strongly recommend this Hotel as one of the best choices for a short stay in Tanger.",Hotel_Royal_Tulip_City_Center_Tanger-Tangier_Tanger_Tetouan_Al_Hoceima,Hotel_Royal_Tulip_City_Center_Tanger,Tangier_Tanger_Tetouan_Al_Hoceima
 November 2017,5,Great Hotel,Stayed just one night while visiting the city for some working assignment and I found this property to be a great choice. Rooms are spacious and well appointed. Wifi speed was fair enough and the breakfast was really great with so many choices. Overall it was a very good stay an if I have to come back to Tanger this will be clearly my best choice.,Hotel_Royal_Tulip_City_Center_Tanger-Tangier_Tanger_Tetouan_Al_Hoceima,Hotel_Royal_Tulip_City_Center_Tanger,Tangier_Tanger_Tetouan_Al_Hoceima
 December 2017,4,Great choice for Tangier,"This hotel is really a great choice! Everything is modern and perfectly clean. My king size bed was very comfortable and gave me a good sleep. Most amenities were perfectly working, but only the WiFi, which is free, was a bit slow at times. Cleaning staff use a fresh room fragrance which I liked very much. The wall of the room as well as the floors are decorated with old photos of Tangier or some nice pieces of art that show parts of the city. The concierge desk is a very good place to get some ideas about what to do and how that can be organised. Thank you. The breakfast buffet was just good. Everything one would expect from a buffet in an international hotel was available, but nothing more. The staff is very mixed: some members are really nice, helpful and up for a little…",Hotel_Royal_Tulip_City_Center_Tanger-Tangier_Tanger_Tetouan_Al_Hoceima,Hotel_Royal_Tulip_City_Center_Tanger,Tangier_Tanger_Tetouan_Al_Hoceima
 December 2017,5,Perfect for business,"My room was clean, spacious, and modern. The wifi is great, the shower water pressure is great, the towels are decent (but not great). Sara at Guest relations was super helpful when I had a tech issue and with advice on where to eat. I can't comment on breakfast because I ate a traditional Tanger café down the road. I recommend.",Hotel_Royal_Tulip_City_Center_Tanger-Tangier_Tanger_Tetouan_Al_Hoceima,Hotel_Royal_Tulip_City_Center_Tanger,Tangier_Tanger_Tetouan_Al_Hoceima
 November 2017,5,Wonderfull stay !,"This hotel is very nice , clean and the staff is very helpful . Saad is a great person in the right place to welcome and put guests at ease. Restaurant has very nice food and friendly service Breakfast is complete and various. Hotel is in a good location , walking distance to sea and shopping area",Hotel_Royal_Tulip_City_Center_Tanger-Tangier_Tanger_Tetouan_Al_Hoceima,Hotel_Royal_Tulip_City_Center_Tanger,Tangier_Tanger_Tetouan_Al_Hoceima
 November 2017,5,The best hotel in tangier,"That was my second stay in this hotel the atmosphere changed and I feel more welcomed. The staff are making more attention to details, I was impressed. Professional team and very good hotel. I will comeback",Hotel_Royal_Tulip_City_Center_Tanger-Tangier_Tanger_Tetouan_Al_Hoceima,Hotel_Royal_Tulip_City_Center_Tanger,Tangier_Tanger_Tetouan_Al_Hoceima
 November 2017,5,Back with joy,"Tangier is now so generous in terms of hotel accommodation. Still, it is so nice to get back to a place and get even more delighted. We stayed at Royal Tulip during a long week end. We had a business day but decided to stay beyond. The venue had all the amenities from the cozy rooms to the nice spa. The breakfast combines local specials and global touch. The staff is cheerful across the board. If you need help ask for Sara. She can make it happen from speeding up your check-in to recommending the right menu within the hotel. I will certainly recommend Royal Tulip be it for business or for a relaxing weekend with the family.",Hotel_Royal_Tulip_City_Center_Tanger-Tangier_Tanger_Tetouan_Al_Hoceima,Hotel_Royal_Tulip_City_Center_Tanger,Tangier_Tanger_Tetouan_Al_Hoceima
 November 2017,5,Delightful oasis,"We were here on a group trip to Morocco. Every aspect of the hotel was excellent. The room was large and very clean. Everything worked very well. Strong WiFi in the room. Meals were very tasty. We ate in both the standard dining room and the vasco restaurant. Staff were competent and friendly. Only two small quibbles. 1. Shower is hard to operate. Once you figure it out, there is plenty of hot water. 2. Lobby has three elevators. They have separate controls so you need to press the buttons for all of them to avoid waiting for a slow elevator.",Hotel_Royal_Tulip_City_Center_Tanger-Tangier_Tanger_Tetouan_Al_Hoceima,Hotel_Royal_Tulip_City_Center_Tanger,Tangier_Tanger_Tetouan_Al_Hoceima
 August 2017,5,Royal hotel,Yes a Royal hotel. Nice and clean room with balcon and city views. Staff very friendly. Restaurant 1 first floor it’s elegant and service was excellent. The 2 waitresses were very professional and helpful. Breakfast was perfect. Definitely I will be back next year.,Hotel_Royal_Tulip_City_Center_Tanger-Tangier_Tanger_Tetouan_Al_Hoceima,Hotel_Royal_Tulip_City_Center_Tanger,Tangier_Tanger_Tetouan_Al_Hoceima
 July 2017,5,Excellent hospitality,"Amazed by the staff, they were at the service and very professional, the room was very clean and the breakfast buffet was so good! I had a very good stay with my relatives and we really enjoyed it. I highly recommend this hotel for everyone whose next destination is tangier.",Hotel_Royal_Tulip_City_Center_Tanger-Tangier_Tanger_Tetouan_Al_Hoceima,Hotel_Royal_Tulip_City_Center_Tanger,Tangier_Tanger_Tetouan_Al_Hoceima
 September 2017,5,Lovely hotel,"I booked a night in this hotel while traveling from Tarifa to Marrakech and was not disappointed. The hotel staff was very professional and friendly. I injured my foot while out sight seeing and they were very quick to offer to help me to get inside the hotel and to my room. They even brought me an ice pack. The room was very clean (and I am a certified germaphobe), and the breakfast buffet was wonderful. A perfect way to start the day. I hope to make a trip back to Tangier and will surely stay at Royal Tulip City Center.",Hotel_Royal_Tulip_City_Center_Tanger-Tangier_Tanger_Tetouan_Al_Hoceima,Hotel_Royal_Tulip_City_Center_Tanger,Tangier_Tanger_Tetouan_Al_Hoceima
 September 2017,5,Royal Tulip is Certainly Royal,"I work for a truck manufacture and for the last twenty years have organized an incentive trip for our top sales consultants, sales managers, service and parts managers at our independent distributors. It is a consistent and ongoing program and is the best in the industry. Well, the Royal Tulip is right up there with the best. A magnificent hotel that is clean, friendly and state of the art. I am ashamed to say I only speak English and a little German. The staff was very patient and was very helpful going and getting an individual to help us out ordering and making some arrangements. Excellent service and very thoughful of the guests. I would recommend this hotel to all going to Tangier. Also, amazing and wonderful city.",Hotel_Royal_Tulip_City_Center_Tanger-Tangier_Tanger_Tetouan_Al_Hoceima,Hotel_Royal_Tulip_City_Center_Tanger,Tangier_Tanger_Tetouan_Al_Hoceima
