 September 2017,3,"good hotel , not more","Room is very nice , breakfast is good but service is not ready on time 1 day on 2 (i have done 3 stays of 3 nights in this hotel) , the hotel is not far from the front sea and the center (15 min by walk) , sport room is very good So in average according the price paid",Hotel_Royal_Tulip_City_Center_Tanger-Tangier_Tanger_Tetouan_Al_Hoceima,Hotel_Royal_Tulip_City_Center_Tanger,Tangier_Tanger_Tetouan_Al_Hoceima
 September 2017,5,Nice hotel,"It doesn't have sea view but have very nice locations beside the mall , restaurant, coffees and 5 mints walking to the beach. The gym is well prepared,the breakfast have enough variety and the stuff very very helpful for sure I will come again.",Hotel_Royal_Tulip_City_Center_Tanger-Tangier_Tanger_Tetouan_Al_Hoceima,Hotel_Royal_Tulip_City_Center_Tanger,Tangier_Tanger_Tetouan_Al_Hoceima
 August 2017,2,Not worth 5 stars. AT ALL.,"After an exhausting 6hrs drive, I've arrived to the hotel knowing that the Executive room that I have booked was downgraded to business. Why? No idea. I have yet to see with the hotel in the morning. We booked as a couple and received towels for 1 person, 1 bathrobe and all the amenities suitable for a single person (including the room type itself.) Stains are all over the carpet, towels are used up and look quite cheap... Not at all the service I have paid for... The 2 star ratings were for the friendly personnel. Other than that, the hotel is mediocre and not worth the 5 stars. AT ALL.",Hotel_Royal_Tulip_City_Center_Tanger-Tangier_Tanger_Tetouan_Al_Hoceima,Hotel_Royal_Tulip_City_Center_Tanger,Tangier_Tanger_Tetouan_Al_Hoceima
 August 2016,5,Excellent and Sophisticated Stay,"Wife and I spent a week at the Royal Tulip. There were a few glitches on check-in and we were offered tea and cookies as they were worked out. We opted for the stocked bar, and enjoyed chatting with the bartenders. The room was nice, and had a great view. An easy walk to the train station, the mall, and the modern nightlife area the location was perfect. Waterfront is a few blocks, and restaurants, ice cream and family fare abound. Its a 15 minute taxi to the old city and there are plenty of options for westerners. Highly recommend.",Hotel_Royal_Tulip_City_Center_Tanger-Tangier_Tanger_Tetouan_Al_Hoceima,Hotel_Royal_Tulip_City_Center_Tanger,Tangier_Tanger_Tetouan_Al_Hoceima
 June 2017,5,Wonderful,Wonderful hotel and staff. The staff was very friendly and helpful. Quite a luxurious hotel with every amenity you could need. Rooms were very spacious and clean. Nice breakfast in the morning. I would highly recommend.,Hotel_Royal_Tulip_City_Center_Tanger-Tangier_Tanger_Tetouan_Al_Hoceima,Hotel_Royal_Tulip_City_Center_Tanger,Tangier_Tanger_Tetouan_Al_Hoceima
 May 2017,4,Good Hotel with Poor Restaurants,I have stayed at this hotel for four nights. Location is good especially if one wants to enjoy walking by the newly renovated city center cornish. Staff are reasonably nice although they seem to need more training on hospitality etiquettes. Cleanliness is reasonable except for the corridors which are clearly dirty and filled with food and beverage spills. Restaurants are very poor for such a big hotel although the breakfast is not bad overall.,Hotel_Royal_Tulip_City_Center_Tanger-Tangier_Tanger_Tetouan_Al_Hoceima,Hotel_Royal_Tulip_City_Center_Tanger,Tangier_Tanger_Tetouan_Al_Hoceima
 May 2017,5,Modern first-class hotel near Tangier downtown and ferry terminal,"On a recent visit to Tangier, my son, daughter, her friend and I stayed at the Royal Tulip City Center. First class experience all-round. Rooms were spacious, modern and comfortable. On-site pool lovely. We dined at on-site restaurant which had an excellent menu catering to all tastes including vegetarian with an modest but OK wine list.",Hotel_Royal_Tulip_City_Center_Tanger-Tangier_Tanger_Tetouan_Al_Hoceima,Hotel_Royal_Tulip_City_Center_Tanger,Tangier_Tanger_Tetouan_Al_Hoceima
 May 2017,5,Ma,"Very nice place neer to down town, fome some of room is posseble to see the sea and hotel pool. Breakfast is good, more swet as salt. The room is big with balcony, big bath room. The service was perfect.",Hotel_Royal_Tulip_City_Center_Tanger-Tangier_Tanger_Tetouan_Al_Hoceima,Hotel_Royal_Tulip_City_Center_Tanger,Tangier_Tanger_Tetouan_Al_Hoceima
 May 2017,5,Excellent all around,"This was a wonderful place from which to navigate our recent holiday in Tangier. Everything functioned as expected. Nice bars and snack stations. Service staff very friendly. Breakfast buffet was outstanding. The most prominent assist was from the head concierge, Mr. Bouayad: he helped in several ways but especially in arranging our two all day outings with a car and driver to Chefchaouan and Asilah. The only downtick is that upon checkout the hotel did not offer us a choice to settle our account in dirham or in USD causing a surcharge of 3% due to their default USD option. By the time we discovered this practice it was a production to reverse and re-enter the transaction in dirham. Aside from this minor annoyance it was an outstanding experience all around. Highly…",Hotel_Royal_Tulip_City_Center_Tanger-Tangier_Tanger_Tetouan_Al_Hoceima,Hotel_Royal_Tulip_City_Center_Tanger,Tangier_Tanger_Tetouan_Al_Hoceima
 May 2017,5,Wonderful retreat from busy city!,I can't say enough good things about Royal Tulip. The staff is wonderful! I am vegetarian and the staff went out of their way to make me a cooked vegetable meal (that was delicious)! The following day they remembered my dietary needs and accommodated me without hesitation. If you speak english (or if you don't) ask for Badr. Badr speaks impeccable english and gave us amazing recommendations of where to visit and eat. I wish we could have taken Badr with us to the rest of the cities we visited in Morocco. Badr made us feel at home and became a smiling face we looked forward to seeing every morning. Thank you to the wonderful staff at the Royal Tulip! We will be back!,Hotel_Royal_Tulip_City_Center_Tanger-Tangier_Tanger_Tetouan_Al_Hoceima,Hotel_Royal_Tulip_City_Center_Tanger,Tangier_Tanger_Tetouan_Al_Hoceima
 May 2017,5,Great staff & Badr was amazing!,"This was a highlight of our trip through Morocco. Tangier was our first stop & their staff was amazing, especially Badr (guest relations). He helped us with anything from international SIM cards to local insight. We stayed at El Fenn in Marrakech & Four Seasons in Casablanca, the Royal Tulip staff was on par if not better. We missed our flight with Royal Air Maroc because they had no check in attendant (AVOID ROYAL AIR MAROC) for a 5am flight. The Royal Tulip staff helped us organize a private car to Marrakech, let us go back in our room after check out & sent us food. Stellar!",Hotel_Royal_Tulip_City_Center_Tanger-Tangier_Tanger_Tetouan_Al_Hoceima,Hotel_Royal_Tulip_City_Center_Tanger,Tangier_Tanger_Tetouan_Al_Hoceima
 May 2017,4,Nice place,"Royal Tulip was a nice oasis in Tangier. Great fairly spacious modern new rooms with great views. Quiet beautiful large pool. Spa facility was nice surprise. Nice lobby cafe...and hotel restaurant was good too. Breakfast was lavish. ATM in lobby as well. For a Moroccan hotel, this along w the new Hilton, is a top choice for a quick jaunt in Tangier. Clean, friendly, and nicely designed. Bear in mind that once you leave the hotel, hawkers and would-be ""I'm not a guide!"" guides are all around the main beachfront promenade waiting for tourists to ""help"" but are then very difficult to shake. We had one who 'happened by' and then wouldn't leave us for 45 minutes - talking endlessly - and escorting us to the market...we had to get rather firm with him 5-6 times saying 'ok goodbye'…",Hotel_Royal_Tulip_City_Center_Tanger-Tangier_Tanger_Tetouan_Al_Hoceima,Hotel_Royal_Tulip_City_Center_Tanger,Tangier_Tanger_Tetouan_Al_Hoceima
 April 2017,4,The Tulip smells good.,"Nice hotel with good breakfast offerings. Lots of good restaurants and a major shopping center outside the hotel doors. Nice to see some English language channels, evening turn down service and small chocolate along with friendly staff.",Hotel_Royal_Tulip_City_Center_Tanger-Tangier_Tanger_Tetouan_Al_Hoceima,Hotel_Royal_Tulip_City_Center_Tanger,Tangier_Tanger_Tetouan_Al_Hoceima
 April 2017,4,Great Location and Nice Facility,"I liked this hotel for its new facility and modern decoration. The location is excellent for city center and walking distance to the sea and new shopping mall. Hotel price is reasonable and staff very very friendly, especially the reception lady (sorry as I can't recall her name). The point for improvement is the breakfast which was not the expected standard, and staff not really taking care for serving customers during the dining, and instead concentrating on the set up of the empty tables. I think they need more training.",Hotel_Royal_Tulip_City_Center_Tanger-Tangier_Tanger_Tetouan_Al_Hoceima,Hotel_Royal_Tulip_City_Center_Tanger,Tangier_Tanger_Tetouan_Al_Hoceima
 March 2017,5,Great,Very nice renovated luxury hotel in the center of tanger. Alternative and pro active staff with spacious clean and beautifull rooms. Great spanish tapes and pool. The place to be when in tanger and not only for business,Hotel_Royal_Tulip_City_Center_Tanger-Tangier_Tanger_Tetouan_Al_Hoceima,Hotel_Royal_Tulip_City_Center_Tanger,Tangier_Tanger_Tetouan_Al_Hoceima
 March 2017,5,Excellent,"Beautiful hotel. Clean, comfortable and well located. Friendly and professional staff. Badr at the reception was outgoing and an excellent ambassador. Outstanding food in dining room for dinner and breakfast. Perfect croissants were a delightful surprise. Many services for personal or business stay. Would be happy to stay at this hotel again.",Hotel_Royal_Tulip_City_Center_Tanger-Tangier_Tanger_Tetouan_Al_Hoceima,Hotel_Royal_Tulip_City_Center_Tanger,Tangier_Tanger_Tetouan_Al_Hoceima
 February 2017,5,Amazing hotel with full satisfaction,"Breakfast is full of choices, room is very clean and even write welcome card with my name. Staff is very friendly. Good location near by the sea and train station! very convenient. The Spanish food is very good. hotel have day travel service with a nice car.",Hotel_Royal_Tulip_City_Center_Tanger-Tangier_Tanger_Tetouan_Al_Hoceima,Hotel_Royal_Tulip_City_Center_Tanger,Tangier_Tanger_Tetouan_Al_Hoceima
 January 2017,5,lovely with great staff,"This hotel is situated in a nice position for sight seeing and is close to the beach. The area has been redeveloped since my last visit a few years ago and is now very nice The hotel is beautifully clean, the restaurants are good with nice food although msybe a bit limited, the bars sre nice, with sttentive and helpfull staff. They screen foitball and often have live music. The rooms are nice and have balconies, big bathrooms and sgain, beautifulky clean. I haveto mention the staff. Ì do t think i have ever stayed in a hotel with nicer or more helpfull staff. Noyhing was to much trouble, even when i arrived back very tired from work they arranged hot food for me in the bar, totally unexpected. I think the hitel price is reasonabke cobsidering how well i was treated.",Hotel_Royal_Tulip_City_Center_Tanger-Tangier_Tanger_Tetouan_Al_Hoceima,Hotel_Royal_Tulip_City_Center_Tanger,Tangier_Tanger_Tetouan_Al_Hoceima
 February 2017,5,Excellent hotel close to city mall,"Very impressive hotel, good and courteous staff, excellent breakfast. Close to eating places like Kentucky and MacDonald etc. Good views from higher floors (4 plus). Even numbers have sea plus pool view and odd numbers have city or big buildings view. Wifi is good except room 817. Dosent work in the room, why know one knows. So if you want wifi in room don't get room close to lifts. (We used cameltrektours.com. For transport to come to this hotel and around Morocco. Had very knowledgable driver Hamid. Contact Moha 00212661821652.).",Hotel_Royal_Tulip_City_Center_Tanger-Tangier_Tanger_Tetouan_Al_Hoceima,Hotel_Royal_Tulip_City_Center_Tanger,Tangier_Tanger_Tetouan_Al_Hoceima
 January 2017,5,3 night stay for a conference,"Beautiful hotel, spacious room and excellent breakfast menu offered. I highly recommend this hotel for its attentive staff and it's great location for both families and business trip. Thoroughly enjoyed my stay.",Hotel_Royal_Tulip_City_Center_Tanger-Tangier_Tanger_Tetouan_Al_Hoceima,Hotel_Royal_Tulip_City_Center_Tanger,Tangier_Tanger_Tetouan_Al_Hoceima
 January 2017,5,Visited in a conference,"Well, what a beautiful Hotel...Brilliant Staff, Spacious rooms, Food was absolutely amazing with so much choice as well as the convenient location which is closed to all city's major access. I recommend this hotel for Business travelers as well as families as it is a relaxing place for a holiday. Really enjoyed my Stay. Thanks,",Hotel_Royal_Tulip_City_Center_Tanger-Tangier_Tanger_Tetouan_Al_Hoceima,Hotel_Royal_Tulip_City_Center_Tanger,Tangier_Tanger_Tetouan_Al_Hoceima
 January 2017,5,A real splerge,"Tangier offers a wide range of hospitality venues, making it hard for visitors to pick. Royal Tulip has managed to set a great precedence. The hotel is located at the newly developed city. The rooms are meticulously arranged offering all the amenities. The staff is another blessing; they are behind every single nice touch, just name it. A generous breakfast and fabulous view we can get from the 7th floor. One genuine witness towards the staff, they are attentive to the queries. To commend highly is Ms. Sara from the guest department and Ms. Chaimaa at the desk. I saw them in action at a peak situation which they handled with grace.",Hotel_Royal_Tulip_City_Center_Tanger-Tangier_Tanger_Tetouan_Al_Hoceima,Hotel_Royal_Tulip_City_Center_Tanger,Tangier_Tanger_Tetouan_Al_Hoceima
 January 2017,5,Excellent customer service,"In the Tangier for the first time visited the hotel. The rooms are nice, great facilities but what is absolutely excellent is guest relations they went above and beyond to accomodate us, in particular Sara. We tried the gusto restaurant and we found it ok.",Hotel_Royal_Tulip_City_Center_Tanger-Tangier_Tanger_Tetouan_Al_Hoceima,Hotel_Royal_Tulip_City_Center_Tanger,Tangier_Tanger_Tetouan_Al_Hoceima
 January 2017,5,Best hotel in the world :),"I visited to Tangier second time and l tried to this hotel. I can say that best hotel in Tangier. Location ,clean rooms,rich breakfast,fast wifi and very very kindly staff. Especially the quest relation Ms. Sara with her beautiful smile:)",Hotel_Royal_Tulip_City_Center_Tanger-Tangier_Tanger_Tetouan_Al_Hoceima,Hotel_Royal_Tulip_City_Center_Tanger,Tangier_Tanger_Tetouan_Al_Hoceima
 January 2017,5,Very nice hotel,Royal tulip is a very nice and comfortable place to stay while in Tangier. Rooms are very spacious and well furnished. Breakfast is very rich. Staff are helpful and hotel has a very nice location near the new waterfront of Tangier,Hotel_Royal_Tulip_City_Center_Tanger-Tangier_Tanger_Tetouan_Al_Hoceima,Hotel_Royal_Tulip_City_Center_Tanger,Tangier_Tanger_Tetouan_Al_Hoceima
 December 2016,5,Afternoon Tea,My husband & I wanted a place where we could spend a nice afternoon together. We highly recommend The Royal Tulip (Afternoon tea moment) . We had great time at the hotel. The place is so cosy & beautiful & the staff are welcoming & caring. Our visit was so pleasant. We're looking forward to spending the new year's eve there.,Hotel_Royal_Tulip_City_Center_Tanger-Tangier_Tanger_Tetouan_Al_Hoceima,Hotel_Royal_Tulip_City_Center_Tanger,Tangier_Tanger_Tetouan_Al_Hoceima
 December 2016,5,Best Hotel in Tangier,"I am a regular visitor to tangier staying at least one week per month for nearly 16 years. I decided that I would try this new Royal Tulip hotel for a change. Great decision! the rooms were perfect, (as a new hotel you don't expect anything else.) But what really surprised me was the standard of service. The service I experienced was first class. From the reception to the porter to the security to the bar and the restaurant, everyone was pleasant, attentive, smiling, and happy to help. I generally do not eat in hotel restaurants however on this occasion I ate in both the Vasco and the Tapas restaurants and the food was really good. I have already book the hotel for my next trip in January.",Hotel_Royal_Tulip_City_Center_Tanger-Tangier_Tanger_Tetouan_Al_Hoceima,Hotel_Royal_Tulip_City_Center_Tanger,Tangier_Tanger_Tetouan_Al_Hoceima
 December 2015,3,Modern hotel handy to the railway station,"This hotel is literally diagonally across the road from the railway station - the one time we didn't need to hail a cab. The entrance and half of the rooms overlook the railway yards and a building site. There appears to be a lot of new construction happening at that end of town. Our room (803) faced over the yards and was bright, clean and spacious. We didn't use our balcony due to copping smoke from neighbours next door. There are internet terminals on the ground floor opposite the tea salon. We didn't get to use these as they were being hogged by children. Breakfast had all of the usual suspects on the buffet but the highlight were the tiny individual desserts. An indulgent thing to have at that time of the day but small enough to have more than one. Orange juice was a…",Hotel_Royal_Tulip_City_Center_Tanger-Tangier_Tanger_Tetouan_Al_Hoceima,Hotel_Royal_Tulip_City_Center_Tanger,Tangier_Tanger_Tetouan_Al_Hoceima
 November 2016,5,Great hotel. Great location.,This hotel offers it all. The location. A+. The amenities. A+. The staff A+. They do it all and they do it well. As a point to explore all things Tangier this hotel is perfectly situated. The rooms are spacious and clean and the staff diligent.,Hotel_Royal_Tulip_City_Center_Tanger-Tangier_Tanger_Tetouan_Al_Hoceima,Hotel_Royal_Tulip_City_Center_Tanger,Tangier_Tanger_Tetouan_Al_Hoceima
 November 2016,5,Great hotel in Tangier Center!,"Had a lovely room with city views which were great as the Hilton next door is not yet open so lots of privacy using the terrace! The beachside rooms are to die for - i took a peek! The staff is very friendly and helpful, particularly the front desk. Lovely tea salon in the lobby and the restaurant El Vasco is fabulous!",Hotel_Royal_Tulip_City_Center_Tanger-Tangier_Tanger_Tetouan_Al_Hoceima,Hotel_Royal_Tulip_City_Center_Tanger,Tangier_Tanger_Tetouan_Al_Hoceima
 July 2016,5,Excellence!!!,"Perfect hotel, Perfect service, Very clean & comfortable rooms. Very warm and cosy bar. all the rooms have stunning view. The location is great. The hotel lobby is one of the best i've ever seen. There's also a gym with lots of equipment.",Hotel_Royal_Tulip_City_Center_Tanger-Tangier_Tanger_Tetouan_Al_Hoceima,Hotel_Royal_Tulip_City_Center_Tanger,Tangier_Tanger_Tetouan_Al_Hoceima
 October 2016,5,"Superb service, wonderful hotel","Arrived in Tangier on business, exhausted at the end of my 5th week travel and after another 14 hour day. Turns out I had arrived the day I booked to check out, pre-paid. No problem, they rebooked me immediately in a great room with an ocean view. Dinner in the Spanish restaurant, Vasco, was simply amazing (best hotel restaurant food and service I've ever had!). Right next to Tangier train station and mall with supermarket. And it's super modern and clean and comfortable. Great service, great price, great food. I've even started a TripAdvisor account just to relay how impressed I am.",Hotel_Royal_Tulip_City_Center_Tanger-Tangier_Tanger_Tetouan_Al_Hoceima,Hotel_Royal_Tulip_City_Center_Tanger,Tangier_Tanger_Tetouan_Al_Hoceima
 October 2016,5,suprised,the best hotel in tangiers just by the beach next to all the shops absolutely fantastic really the best 5 star hotel in tangiers food is to die for and the rooms are beautiful the staff just cant do enough for you fantastic will stay again very soon lovely place to stay,Hotel_Royal_Tulip_City_Center_Tanger-Tangier_Tanger_Tetouan_Al_Hoceima,Hotel_Royal_Tulip_City_Center_Tanger,Tangier_Tanger_Tetouan_Al_Hoceima
 September 2016,5,Best hotel in tangier,"Again I stayed at what I think is the best and finest hotel in tangier in Morocco, Again my room for the ten nights I stayed was 5 stars it was maintained to a high standard by the wonderful maids on the 8th floor The front of house staff are so professional polite and extremely well trained in all aspects of there trade And the customer relations man Mohammed again going out of his way to make everybody's stay at the hotel a stay to remember i recommend this hotel to all who wish to visit tangier whether on business or pleasure And it was my pleasure to write this recomedation",Hotel_Royal_Tulip_City_Center_Tanger-Tangier_Tanger_Tetouan_Al_Hoceima,Hotel_Royal_Tulip_City_Center_Tanger,Tangier_Tanger_Tetouan_Al_Hoceima
 September 2016,5,"Great hotel, great staff","This hotel was chosen by the tour that I had joined. It is within walking distance to the beach. I ate at the breakfast and dinner buffet which was delicious. For example for dinner they had fresh cuts of a variety of fish , chicken, beef that they cook before you. Numerous selections to choose from. Fresh, tasty salads, wide variety of fresh fruits and cakes, fresh bread. Breakfast was also delightful with a chef making omelets for you. Again a variety to choose from. Staff are very helpful and attentive. There is a swimming pool and spa",Hotel_Royal_Tulip_City_Center_Tanger-Tangier_Tanger_Tetouan_Al_Hoceima,Hotel_Royal_Tulip_City_Center_Tanger,Tangier_Tanger_Tetouan_Al_Hoceima
 September 2016,5,Simply Fantastic,"This hotel is absolutely fantastic. The accommodations, service and location. Note, it says it's in the city center but that's a matter of perspective. For us, as tourists, it didn't seem like the stereotypical Moroccan city center with people wheeling and dealing at your doorstep. It's actually in a very nice area with large buildings and hotels a short cab ride away from the touristic ""city center"" with the exotic chaos you would imagine and perhaps crave as you heard to Tangier. The hotel and its staff are extremely welcoming. Don't miss the tea and snacks in the lobby! So tasty! And the hotel breakfast is another don't miss. The food is very authentic (in my American foodie opinion). The selection is vast an tasty. The cab ride to the Medina should only cost you about 10…",Hotel_Royal_Tulip_City_Center_Tanger-Tangier_Tanger_Tetouan_Al_Hoceima,Hotel_Royal_Tulip_City_Center_Tanger,Tangier_Tanger_Tetouan_Al_Hoceima
 July 2016,5,Chic Luxury,"Eons ahead in quality and standard from the other sub brands under the Tulip umbrella brand. One of the best hotels I have stayed at. Totally modern with most amenities and immaculate attention to detail. Cleanliness and service were superlative too, as was the food, the pool area and other common areas. At the poolside you could enjoy a lavish dinner spread, live singing and music, sheesha (hubbly-bubbly), or keep abreast with live Euro Cup Football ! Equally comfortable were the beds, and a well equipped toilet. Of course commonly needed add-ons like a kettle, iron and ironing table, fridge etc. were provided in mint condition. In short would never stay anywhere else in Tangier if I ever visited this city again.",Hotel_Royal_Tulip_City_Center_Tanger-Tangier_Tanger_Tetouan_Al_Hoceima,Hotel_Royal_Tulip_City_Center_Tanger,Tangier_Tanger_Tetouan_Al_Hoceima
 August 2016,5,Great,Beautiful and comfortable rooms. Great service and really kind people... We checked out many of the 5 stars but this one really had the best room. Pool is well taken care of and all of the areas are comfortable to sit and relax.,Hotel_Royal_Tulip_City_Center_Tanger-Tangier_Tanger_Tetouan_Al_Hoceima,Hotel_Royal_Tulip_City_Center_Tanger,Tangier_Tanger_Tetouan_Al_Hoceima
 March 2016,4,Recommendable hotel while on business: Good quality rooms & excellent breakfast,"Stayed in the hotel during a business trip. Rooms are large and clean with a big bathroom including bath tub. Breakfast includes a large buffet with plenty of options like fruits, yogurt, bread and egg. Overall, a place to recommend while on business.",Hotel_Royal_Tulip_City_Center_Tanger-Tangier_Tanger_Tetouan_Al_Hoceima,Hotel_Royal_Tulip_City_Center_Tanger,Tangier_Tanger_Tetouan_Al_Hoceima
 June 2016,5,100% recommend,I have stay at the Royal tulip three times this year and I must say each visit has been a great experience The front of house staff the lob staff and basically all the staff at the hotel give 100% to the customer nothing is too much for them The rooms are of a high standard 5star The upkeep of the hotel is fantastic I have had need of some services while in the hotel and the man of the hour was Mohammed MKAOURI the guest relations front of house Who went out of his way to do everything I asked of him many thanks Mohammed your a star I give the Royal tulip 10 out of 10 Great place to stay,Hotel_Royal_Tulip_City_Center_Tanger-Tangier_Tanger_Tetouan_Al_Hoceima,Hotel_Royal_Tulip_City_Center_Tanger,Tangier_Tanger_Tetouan_Al_Hoceima
 May 2016,4,A very good hotel near the sea,"I spent 2 nights in this very nice hotel. The room was large and I even had a sea view as the hotel is not far from the sea. Room service was fast and breakfast plentiful. In the bar they have some big screen TVs and good local beer. The airconditioning was the best I have experienced so far - noiseless and very effective! The Wifi was, on the other hand, sometimes really slow or non-existent.",Hotel_Royal_Tulip_City_Center_Tanger-Tangier_Tanger_Tetouan_Al_Hoceima,Hotel_Royal_Tulip_City_Center_Tanger,Tangier_Tanger_Tetouan_Al_Hoceima
