 December 2022,5,Wonderful hotel close to many things,"We stayed as a family for 3 nights on the Tangier part of our Moroccan vacation. This hotel was across from the train station and Tangier city mall and a block or so south of the main Tangier beach and boardwalk, so easy walking distance (1/2 hr or so in either direction) of the marina and Malabata area. Room was very comfy and modern, nice size pull out bed for our daughter. Nespresso and water in room free of charge. Breakfast was good, lots of variety. Front desk arranged a tour for us with a guide, which was fantastic and hit all the sights we wanted to see. The bar could’ve been a bit better, but we were able to get a cold beer and a glass of wine. Overall a great hotel!",Hotel_Royal_Tulip_City_Center_Tanger-Tangier_Tanger_Tetouan_Al_Hoceima,hotelName,city
 December 2022,1,Spa,"The worst experience ever. Instead of 1.5 hours massage I received only 30min massage. Reception cannot speak English, I ended up waiting at the reception for my friend who received 1.5 hours massage there. Instead of relaxing evening I had the worst time ever arguing and waiting for my friend. They offered another 1 hour massage but the therapist looked like she was about to cry when we went to the room. I didn’t want a massage from someone who was very unhappy and unprofessional. The whole experience was extremely tiring.",Hotel_Royal_Tulip_City_Center_Tanger-Tangier_Tanger_Tetouan_Al_Hoceima,Hotel_Royal_Tulip_City_Center_Tanger,Tangier_Tanger_Tetouan_Al_Hoceima
 December 2022,5,"Spa recommendation, special thanks to Dina and Asmaa","I went to the Spa center of Royal Tulip and i must say the indoor pool is the best in Tangier And a special thanks to Dina & Asmaa who welcomed me , they are so kind and generous, the water’s temperatures was 29c which is so warm, which i loved about this spa",Hotel_Royal_Tulip_City_Center_Tanger-Tangier_Tanger_Tetouan_Al_Hoceima,Hotel_Royal_Tulip_City_Center_Tanger,Tangier_Tanger_Tetouan_Al_Hoceima
 October 2022,3,Not sure how this can possibly be a 5* hotel,"I must admit that I am surprised with the vast majority of reviews on here that are giving the Royal Tulip City Center Hotel 5 stars. There is simply no comparison between this hotel and true 5 star hotels. There is nothing remotely outstanding or memorable about the Royal Tulip. The location is good; it's near the main train station of Tangier, as well as the Medina area. I think there is a shopping centre nearby. It's just off a main road where taxis are easily available. Check in staff were pleasant, but nothing special. The room was fine, but not thoroughly cleaned when we first entered. The curtains were somewhat dirty and so was the carpet in some areas. The size of the TV was tiny compared to the size of the wall. The main issue I had was with the shower bath. The water…",Hotel_Royal_Tulip_City_Center_Tanger-Tangier_Tanger_Tetouan_Al_Hoceima,Hotel_Royal_Tulip_City_Center_Tanger,Tangier_Tanger_Tetouan_Al_Hoceima
 May 2022,4,"Beautiful Tangier, a bridge between Africa and Europe ..","My son and I arrived from Casablanca before sunset, I did not stand long in front of the reception, the professionalism of the employee who occupied me with opening a dialogue in the name with me until he handed me room cards, the hotel was crowded with citizens coming to visit from Europe, you need to stand long to reach your room, the rooms are large and clean with Romantic balcony view, conducive to relaxation and meditation, comfortable bed, delicious full breakfast and staff waiting to fulfill your requests, surprising they could not remove a dark stain on the flooring!",Hotel_Royal_Tulip_City_Center_Tanger-Tangier_Tanger_Tetouan_Al_Hoceima,Hotel_Royal_Tulip_City_Center_Tanger,Tangier_Tanger_Tetouan_Al_Hoceima
 July 2022,5,"The hotel staff were courteous, helpful and charming in dealing with us. The beautiful reception staff were very helpful","We spent a long weekend in Tangier staying at this hotel. The facilities were excellent. Food was good and location was ideal for us, as it was central. I cannot praise the young beautiful ladies at reception enough for all the help and assistance given to us and always with a happy smile.",Hotel_Royal_Tulip_City_Center_Tanger-Tangier_Tanger_Tetouan_Al_Hoceima,Hotel_Royal_Tulip_City_Center_Tanger,Tangier_Tanger_Tetouan_Al_Hoceima
 July 2022,5,Good one,"I stay 2 days in royal tulip it's a good hotel and the staff also very good especially Ananthu,Jayakansar thanks them for good serice. I recomment everyone to stay here. The food was awesome brekfast will visit again",Hotel_Royal_Tulip_City_Center_Tanger-Tangier_Tanger_Tetouan_Al_Hoceima,Hotel_Royal_Tulip_City_Center_Tanger,Tangier_Tanger_Tetouan_Al_Hoceima
 May 2022,5,Amazing staff and spa experience,"Amazing experience, the staff were extremely nice and helpful. If you go ask for Lina or Asmae, they managed to accommodate me last minute and this is definitely my go to spa place whenever I am next in Tangier. Would highly recommend to friends and family.",Hotel_Royal_Tulip_City_Center_Tanger-Tangier_Tanger_Tetouan_Al_Hoceima,Hotel_Royal_Tulip_City_Center_Tanger,Tangier_Tanger_Tetouan_Al_Hoceima
 April 2022,5,Awesome breakfast,This was the beat breakfast in all the City with a great selection and only 100 diram Great coffee and great selection of teas and even fresh mint Muhammad was the main dining room attendent and he was so kind and thoughtful. He is the diamond at the hotel and took plates away and was so thoughtful and kind and really made breakfast so enjoyable and went out of his way to make all perfect!!!,Hotel_Royal_Tulip_City_Center_Tanger-Tangier_Tanger_Tetouan_Al_Hoceima,Hotel_Royal_Tulip_City_Center_Tanger,Tangier_Tanger_Tetouan_Al_Hoceima
 April 2022,5,Incredible hotel,"This hotel is quite honestly one of the best hotels that I've stayed in. The rooms are beautiful and spacious, the views are to die for and most importantly the staff are very kind, helpful and polite. Naoufal specifically went above and beyond his duty and was helpful in every way possible. He is a true asset to Royal Tulip and an amazing gentleman. Special thanks also to Hasnae and Lina at the spa. My daughter and I had an amazing afternoon there. So polite, helpful and friendly. Until next time :) Darifa",Hotel_Royal_Tulip_City_Center_Tanger-Tangier_Tanger_Tetouan_Al_Hoceima,Hotel_Royal_Tulip_City_Center_Tanger,Tangier_Tanger_Tetouan_Al_Hoceima
 December 2021,5,Mr Marco Acquaviva,"I’m Marco , Italian property entrepreneur london based, I ve been 1 week in Marocco travelling looking for new properties investment , but unfortunately they close out and in flight so I must to spent extra 10 days around While I’ve been driving for 18 days all over the country, I must get hotel wherever I stopped I was looking for a better place in tangier cause first experience in others hotel was not happy at all Searching in booking . Com I found royal tulip city centre Luxury hotel but with very reasonable price, so strait away I booked I received a very good welcoming as soon I check in, people given with big smile very good help from the parking , receptioning, till luggages brought it in the room, after a very good comfortable sleep I woke up so fresh and I walk strait…",Hotel_Royal_Tulip_City_Center_Tanger-Tangier_Tanger_Tetouan_Al_Hoceima,Hotel_Royal_Tulip_City_Center_Tanger,Tangier_Tanger_Tetouan_Al_Hoceima
 October 2021,5,Amazing 3 nights,"Great hotel, nice location, Amazing staff, and so professional services. It was so so clean rooms, quiet and good room size. The breakfast was awesome, fast service not crowded and helpful staff. I would like to thank Mr. Hussain in reception he was excellent and help us.",Hotel_Royal_Tulip_City_Center_Tanger-Tangier_Tanger_Tetouan_Al_Hoceima,Hotel_Royal_Tulip_City_Center_Tanger,Tangier_Tanger_Tetouan_Al_Hoceima
 October 2021,3,"Just okay, nothing special.","This is your typically business hotel. Something you company would book if you had a short business trip. I would not call this hotel a 5 star. This is a 3 star by all standards. The price of course reflects this. If you are staying in the city a couple night then it’s okay but I couldn’t spend a week here. Staff is friendly, decently clean and breakfast was okay. Otherwise, a three star experience.",Hotel_Royal_Tulip_City_Center_Tanger-Tangier_Tanger_Tetouan_Al_Hoceima,Hotel_Royal_Tulip_City_Center_Tanger,Tangier_Tanger_Tetouan_Al_Hoceima
 October 2021,5,Welcome home,"From the first moment you enter the hotel until your departure, you are not only a guest, but the master of the house. The hotel and facilities are first class and constantly maintained. The interior is a very chic design, everything seems to be coordinated. The spa and wellness area is just world class, a great atmosphere for sauna, hammam and your wellness :) The rooms are equipped with all comforts, and for little surprises the friendly polite and courteous staff is always around. A perfect team that is second to none. Reception, lounge, restaurant and especially the breakfast buffet. Simply a dream. You have the feeling of individual care by professional staff, who read your every wish from your eyes. Pure luxury. This rating goes to the entire staff, which was unanimously…",Hotel_Royal_Tulip_City_Center_Tanger-Tangier_Tanger_Tetouan_Al_Hoceima,Hotel_Royal_Tulip_City_Center_Tanger,Tangier_Tanger_Tetouan_Al_Hoceima
 August 2021,1,Horrible Hotel,"I would give 0 if I could! Absolutely disgusting.. first room was promised with sea view got placed infront of noisy main road! It was dirty mouldy bathroom and broken dirty fridge. Went to speak to the staff lying and rude saying they were full, as soon as we say we want a refund they found us ""magically "" a ""better "" room! Managed to get another room after arguing about it for ages .. and then the worst thing happened to my husband, he got stuck in the lift with no oxygen for more than 40 min until someone came to help.. if it wasn't for my parents in law and other room guests my husband would have died in that lift. Even the rooms telephone had no signal so there was no way to call for help! No one came to help! And then as an apology they offered food for free! And made…",Hotel_Royal_Tulip_City_Center_Tanger-Tangier_Tanger_Tetouan_Al_Hoceima,Hotel_Royal_Tulip_City_Center_Tanger,Tangier_Tanger_Tetouan_Al_Hoceima
 July 2021,4,Very good city center hotel,"very ggod hotel in the city center, where a car is not really needed. the rooms space is great, clear, and comfortable. The breakfast is good too. for negative points, I feel the hotel quite crowded and under staffed, with a need to wait to be serviced sometimes. In overall, we had a good stay.",Hotel_Royal_Tulip_City_Center_Tanger-Tangier_Tanger_Tetouan_Al_Hoceima,Hotel_Royal_Tulip_City_Center_Tanger,Tangier_Tanger_Tetouan_Al_Hoceima
 May 2021,1,Objective feedback,"I will be very objective in my feedback, I have made several hotels in Morocco of different categories. I spent three nights at the Royal Tulipe and it does not deserve its 5 stars, it is at most a 3 stars. the quality of service is very low. the food is cheap. the room service is very bad, the reception is not professional. the breakfast which is included in the stay is of very poor quality, you can eat in a cafe better than that. the hotel is soundproofed there is traffic and there is noise from outside. the wifi is very bad I had to work on my data. It is a pity that a hotel to be well located is to degrade that its level of reception, rooms, catering. the hotel is expensive compared to the other hotel whose quality is 10 times better",Hotel_Royal_Tulip_City_Center_Tanger-Tangier_Tanger_Tetouan_Al_Hoceima,Hotel_Royal_Tulip_City_Center_Tanger,Tangier_Tanger_Tetouan_Al_Hoceima
 March 2021,5,Outstanding service and wonderful view,"Houssaine the Concierge and Mohammed the bellhop were just outstanding in their helpfulness and kindness. I had a great view with a balcony overlooking the ocean. The room was spacious and comfortable. The bathroom was modern. The gym was quite large and they had fun classes. I enjoyed my massage, along with the pool and sauna (they could be a little quieter in the spa area as there were staffs taking loudly outside my massage room for half the massage). Breakfast was plentiful, and they made efforts to provide me with Vegan options. Houssaine even sent me up lovely flowers and a fruit platter. I'll definitely be back!",Hotel_Royal_Tulip_City_Center_Tanger-Tangier_Tanger_Tetouan_Al_Hoceima,Hotel_Royal_Tulip_City_Center_Tanger,Tangier_Tanger_Tetouan_Al_Hoceima
 January 2020,5,Great hotel,"I was there in january with my husband. We’ve booked 5 days. First we had a normal room. After a problem they did not only gived us a suite, but they also sent us flowers and a really sweet letter ( i think here name was hajar who wrote the letter) i also really want to thank Saad, he called us a 3 or 4 times to make Sure everyting is fine.believe me, i went to a lot of hotels in tanger, but this is the best. They really listen to the visiters and do the best they can to make sure you enjoy your stay. At The breakfast you have a lot to choose.",Hotel_Royal_Tulip_City_Center_Tanger-Tangier_Tanger_Tetouan_Al_Hoceima,Hotel_Royal_Tulip_City_Center_Tanger,Tangier_Tanger_Tetouan_Al_Hoceima
 February 2020,5,Perfect,I was planning to stay just two nights in this hotel. It was ended to be four nights. Location is the best in Tangier. Breakfast was amazing. When it comes to staff they were the best part of my stay. Mr. Yassir is one of the most enthusiastic and supportive hoteliers i have ever met. He gave me precious advices to discover Tangier the best. Mr. Ahmed & Mr. El-Hassan were very nice and professional. Highly recommended hotel for all types of travellers.,Hotel_Royal_Tulip_City_Center_Tanger-Tangier_Tanger_Tetouan_Al_Hoceima,Hotel_Royal_Tulip_City_Center_Tanger,Tangier_Tanger_Tetouan_Al_Hoceima
 February 2020,5,"Outstanding Hotel, Better Staff","We were making our way north from Marrakech eventually leaving to Spain from Tangier. We stumbled upon the Royal Tulip City Center because it was near the train station. Our intent was to stay one night and search for other hotels in the area; we ended staying at the Royal Tulip all three nights. We were in a large comfortable room on a higher floor with views of the mountains. Since we wanted to travel to Chefchaouen, Hajar at the front desk arranged a driver for a day trip there. She was charming and beautiful and loved practicing her English with my wife. She seemed genuinely excited when my wife asked to extend our stay. All of the staff was wonderful. Hussein, the evening desk clerk, made sure we had transportation to the Tangier-Med port when our ferry from Tangier-Ville…",Hotel_Royal_Tulip_City_Center_Tanger-Tangier_Tanger_Tetouan_Al_Hoceima,Hotel_Royal_Tulip_City_Center_Tanger,Tangier_Tanger_Tetouan_Al_Hoceima
 February 2020,5,The best in town,A great hotel with extremely friendly staff. Very generous and welcoming. Especially Mr. Hussein. I highly Recommend this facility and it is definitely worthy. Located in a great spot near the see and many cafés.,Hotel_Royal_Tulip_City_Center_Tanger-Tangier_Tanger_Tetouan_Al_Hoceima,Hotel_Royal_Tulip_City_Center_Tanger,Tangier_Tanger_Tetouan_Al_Hoceima
 January 2020,3,Okay stay,"We stayed for two nights--and, that's one night too many to stay in Fez. We took a taxi from the airport to the hotel and made the mistake of not deciding on a price before they took us. Upon getting out of the taxi, we tried to settle the bill, and the driver tried to pull one on us, but the concierge helped us with setting things straight. So that was nice. We got in around 21:00 or so and were only given Moroccan tea on our arrival (some people have said a snack, too?--we didn't get any and were super hungry.) Check-in was simple. Bell hop took our suitcases to the room. Our room was HUGE and HOT. This is December, why in the world is it so hot in the room? Glad that we could open the patio door. We kept it open all stay. The AC wouldn't work. Our bed was comfortable and…",Hotel_Royal_Tulip_City_Center_Tanger-Tangier_Tanger_Tetouan_Al_Hoceima,Hotel_Royal_Tulip_City_Center_Tanger,Tangier_Tanger_Tetouan_Al_Hoceima
 January 2020,1,New Year's Eve Fiasco!,"We spent four nights at this hotel over the New Year's period and bought tickets for the hotel's New Year's Eve dinner and party. What a disaster! After asking several times when they would begin serving the dinner for New Years, I was told 9:00 PM. We arrived at 9:20PM, hoping we wouldn't be too late or too early. We were too early by three hours as it turned out. We sat down and after an hour we were presented with a chocolate bon bon. Weird. Then about 30 minutes after that we were presented with a martini glass half-filled with a cold seafood bisque. No spoon, you just had to find a way to gulp it down. It got to be around 11:30PM with no other food presented to us, and we had gone through several stages of denial, anger, acceptance to the whole nightmare, when they…",Hotel_Royal_Tulip_City_Center_Tanger-Tangier_Tanger_Tetouan_Al_Hoceima,Hotel_Royal_Tulip_City_Center_Tanger,Tangier_Tanger_Tetouan_Al_Hoceima
 December 2019,5,Everything was just perfect,"PROS: - Top design with spacious and modern lobby - The view of the waterfront was amazing, in the morning hours we could see clearly the Spanish coast of another continent - The attached gym has its own building and two additional class rooms (spinning and yoga), fantastic Tchnogym equipments - Perfect breakfast buffet with everything we wanted - Superb service —> highly recommend!!!",Hotel_Royal_Tulip_City_Center_Tanger-Tangier_Tanger_Tetouan_Al_Hoceima,Hotel_Royal_Tulip_City_Center_Tanger,Tangier_Tanger_Tetouan_Al_Hoceima
 December 2019,3,Good hotel for short stay,"I have stayed only 2 nights , the breakfast was great but the dinner need some improvement to have more variety like rice and macaroni The reception was really nice but my room was city view which was little bit boring",Hotel_Royal_Tulip_City_Center_Tanger-Tangier_Tanger_Tetouan_Al_Hoceima,Hotel_Royal_Tulip_City_Center_Tanger,Tangier_Tanger_Tetouan_Al_Hoceima
 December 2019,5,Highly recommended,"I had the pleasure to be guest in Royal Tulip, Tangier, Morocco. I will use this hotel again next time, higly recommand. Thanks to Ms. Hiba i have a new understanding of Hospitality management, Manner, Professionalisym and taking royal care of the customer! Please Thank your employees for their hard work and consider, without them this can be quite ordinary hotel.",Hotel_Royal_Tulip_City_Center_Tanger-Tangier_Tanger_Tetouan_Al_Hoceima,Hotel_Royal_Tulip_City_Center_Tanger,Tangier_Tanger_Tetouan_Al_Hoceima
 October 2019,5,Best hotel we had in Morocco!,"Great hotel - spacious room, very clean and nicely designed. We stayed with a group. Breakfast was plentiful and versatile - very tasty! Great location! Very good service, friendly staff. We spent 10 days in Morocco - this was our best hotel in Morocco! Highly recommended.",Hotel_Royal_Tulip_City_Center_Tanger-Tangier_Tanger_Tetouan_Al_Hoceima,Hotel_Royal_Tulip_City_Center_Tanger,Tangier_Tanger_Tetouan_Al_Hoceima
 September 2019,5,Excellent !,"We very very much enjoyed our stay at Tulip hotel. We were very warmly greeted with delicious mint tea and pastries and helped out with our lugagge. The staff are great, big congrats for the attentive and helpful staff ! Location is excellent! We felt so good! The room was perfect, the view amazing, the breakfast so delicious. We loved our stay, will definitely return!",Hotel_Royal_Tulip_City_Center_Tanger-Tangier_Tanger_Tetouan_Al_Hoceima,Hotel_Royal_Tulip_City_Center_Tanger,Tangier_Tanger_Tetouan_Al_Hoceima
 August 2019,5,Beautiful hotel with an amazing staff on our first time to Morocco,"This is our first time to Morocco and we could not have been more impressed. The hotel had luxury accommodations and was very clean. The staff was very kind, generous , and gracious. They were very eager and willing to help us. Reception helped us the most; we asked for recommendations regarding restaurants and sights around Tangier and we’re not disappointed!. They called us taxis whenever we needed and even changed our currency for us. Meryem ,one of the receptionists,was a huge help to us. She was so kind and helpful, and answered every question we had. You can easily tell she is passionate about her work and was eager to help. The food was excellent and room service was easy and quick. Wassima was also a very helpful receptionist and helped us feel at ease and excited for…",Hotel_Royal_Tulip_City_Center_Tanger-Tangier_Tanger_Tetouan_Al_Hoceima,Hotel_Royal_Tulip_City_Center_Tanger,Tangier_Tanger_Tetouan_Al_Hoceima
 September 2019,3,Nice Hotel Good Service,"I stayed in this hotel on a 9 day business trip to Tangier. I found the accommodation to be neat and tidy, with all of the services I needed. There are two main restaurants. One is a buffet at a fixed price and the second is an al la carte restaurant. The buffet is excellent with a wide range of starters, entrees and deserts. However, the coffee machine is not available. Vasco, the al la carte restaurant is excellent also , with a good choice of fish or meat. On a slight downside, I found the room cleaning service a little lacking. As:- - Carpet not vacuumed daily - Used bathroom items not removed. - Only one sachet of Nescafé left daily, which is a little mean! - No coffee whitener/ milk sachets to accompany room coffee. There’s also a bar which specialises in…",Hotel_Royal_Tulip_City_Center_Tanger-Tangier_Tanger_Tetouan_Al_Hoceima,Hotel_Royal_Tulip_City_Center_Tanger,Tangier_Tanger_Tetouan_Al_Hoceima
 August 2019,5,"Great Experience, a true 5* in Tangier","Nice experience. Smooth check-in process, welcome drinks. A special thank you to Saad Boumraya, the Rooms Division Director, for it's warm welcome and for upgrading one of our rooms to a Suite, we were a family of 4, so it couldn't be more timely. Rooms are clean, cozy and spacious. Staff in general was nice and ready to help at any time. Easy check out. Great service all around. This will definitely be my go to Hotel any time I am in Tangier. Thank you !",Hotel_Royal_Tulip_City_Center_Tanger-Tangier_Tanger_Tetouan_Al_Hoceima,Hotel_Royal_Tulip_City_Center_Tanger,Tangier_Tanger_Tetouan_Al_Hoceima
 August 2019,3,Friendly Staff; Not family friendly,"The staff was very friendly. From the receptionist to the poolside waitress, we received friendly and helpful service. The room was clean. The amenities were nice. We enjoyed massages at the spa. Breakfast was ok. The music at the pool was very loud, and although there were primarily families at the pool, the music was very inappropriate. Not only was it filled with curse words, but it was also very explicitly sexual and raunchy. At dinner, it was a bit difficult to enjoy the meal because of the little children running around the restaurant without any supervision.",Hotel_Royal_Tulip_City_Center_Tanger-Tangier_Tanger_Tetouan_Al_Hoceima,Hotel_Royal_Tulip_City_Center_Tanger,Tangier_Tanger_Tetouan_Al_Hoceima
 July 2019,5,Clean and friendly staff,"The location is centrally located, the room was very clean, and the staff were friendly and courteous! Additionally, the breakfast was out of this world, one of the best hotel breakfasts I've ever had and I've stayed at a lot of hotels! I highly recommend staying at this hotel.",Hotel_Royal_Tulip_City_Center_Tanger-Tangier_Tanger_Tetouan_Al_Hoceima,Hotel_Royal_Tulip_City_Center_Tanger,Tangier_Tanger_Tetouan_Al_Hoceima
 July 2019,5,Enjoyable Family Stay,"We booked one week in this hotel, It was an enjoyable stay, perfect location, room was clean, big with comfortable beds & nice balcony, the staff were so kind, the receptionist Yessir, restaurant manager Noufel, smiley waiter Ismail, lifeguard Sofian & housekeeping lady who kept our room to high standard every day, leaving chocolate & flowers in our room made us feel special. Hotel downside, it should have more variation in fruits especially when you are in country like morocco, music was little bit loud afternoon & should include more kids channels. Overall the experience was brilliant as family, we will definitely would stay there again & recommend it to family & friends.",Hotel_Royal_Tulip_City_Center_Tanger-Tangier_Tanger_Tetouan_Al_Hoceima,Hotel_Royal_Tulip_City_Center_Tanger,Tangier_Tanger_Tetouan_Al_Hoceima
 June 2019,5,Beautiful hotel,"I stayed here for 4 nights in June and have to say the hotel is absolutely fantastic, food was beautiful, pool was great, all the staff were brilliant. We ate in the al a Carte restaurant one night and the food was out of this world , would definitely recommend it. The staff were really good if you needed anything and always there at your beckoned call. I can also recommend the brandy and cigar bar, it has a great relaxed feel to it and the drinks are reasonably priced with a great selection. I think I will be back soon on another business trip and will definitely book into this hotel again. Fantastic place",Hotel_Royal_Tulip_City_Center_Tanger-Tangier_Tanger_Tetouan_Al_Hoceima,Hotel_Royal_Tulip_City_Center_Tanger,Tangier_Tanger_Tetouan_Al_Hoceima
