 January 2023,5,Moroccan hospitality at its best.,Amazingly beautiful property with all the comforts of Marriott set in a stunning garden style Moroccan hospitality. Thank you Najim and Houcine for your Moroccan hospitality and attention to all of our details for our stay. You Rock!! I can’t wait to bring the family back here.,Fes_Marriott_Hotel_Jnan_Palace-Fes_Fes_Meknes
 September 2022,5,Excellent hotel,"We stayed at the hotel for a couple of days. The staff was welcoming, nice, professional, and helpful. The room has a pool view, which was very nice. The room was very clean with a nice bed and balcony. In the Pitch Cafe, Nabil Saffahy was amazing, with good customer service with a smile. Badr in the other restaurant was super nice and helpful too. I recommend Fes Marriott",Fes_Marriott_Hotel_Jnan_Palace-Fes_Fes_Meknes
 December 2022,4,Great Hotel with Only One Problem,"Beautiful hotel and big rooms, but the air conditioning was turned off so the rooms were too hot for sleeping well. Everything else was great - the breakfast was huge and delicious, and the staff was very friendly and helpful. They also arranged a ride for us from Fes to Marrakech, as well as rides to restaurants.",Fes_Marriott_Hotel_Jnan_Palace-Fes_Fes_Meknes
 January 2023,5,Great hotel in a beautiful old world city that has the new and old beautifully balanced,"The property is large and very well kept. The room was also very spacious and clean and well maintained. The bathroom was large and clean. Best part the only hotel out of all we stayed at in morocco that had a health faucet! Breakfast buffet was very elaborate and staff every where was very courteous. Dinner in the traditional Moroccan restaurant was excellent, both food and ambience with live music. All in all faultless… Suggestions- a weighing scale in the room. A pedestal fan- since the a/c is off in the winter Hot water (for shower) in the morning was sporadic so can be looked into…",Fes_Marriott_Hotel_Jnan_Palace-Fes_Fes_Meknes
 December 2022,2,Worst Marriott Ever,"Reserved a 3 person’s bedroom. Couch bed was unbearable and they didn’t have any alternative for us. I had to book an extra room only to know the next day they did have rollerbeds. Barely any hot water in the shower. A/C not working and they won’t call you a taxi unless it’s a big service car. Front desk said they were “sorry” but they clearly couldn’t care less. With so many other great options in town, I clearly wouldn’t recommend anyone staying here.",Fes_Marriott_Hotel_Jnan_Palace-Fes_Fes_Meknes
 December 2022,2,Don't expect 4 or 5 star service,"Good: The in house Moroccan restaurant is quite good, with a reasonably large choice of local food. The bell captains are prompt and friendly as are the hostesses in the breakfast restaurant. Bad: The rest of the staff in the breakfast restaurant is simply unfriendly and the service there is quite bad. The odds of getting your eggs made right are quite low, and some staff acted like they were being bothered by the guests. Only once in four days did the staff clear the empty plates during breakfast. Ugly: The heater in our room wouldn't turn off, so one of our rooms was quite hot for 2 days. When I reported it, the first person at the front desk told me to open my windows. Eventually common sense prevailed, and they sent maintenance to the room. The solution was a…",Fes_Marriott_Hotel_Jnan_Palace-Fes_Fes_Meknes
 December 2022,5,Awesome Value. Super Nice Hotel. Great Staff.,"Wow. We had the pleasure of being in Fes when Morocco advanced in The Cup. What a wild and awesome party throughout The City! The hotel is beautiful, in a great location, and the staff bent over backwards for us. It’s modern, accommodating, and nicer than places we usually stay. Najim was super helpful and made us feel so welcome. Mohammed and Imad helped us with directions to the Medina (decent walk, or short cab). We usually rough it, but splurged on this hotel which is a great value for the cost. I usually talk up staff that are great, but these folks truly were some of the most helpful and friendly group I’ve ever experienced. And yeah guys… you can have a beer or two at the bar!",Fes_Marriott_Hotel_Jnan_Palace-Fes_Fes_Meknes
 November 2022,5,Mesmerized!,"Amazing!! I felt connected with the people of morocco in this hotel. They tend to go the extra mile with everything. Starting with the front desk people, also housekeeper organized my make-up, and Nabil in the bar made us felt at home. I'm not going anywhere else next time I stay in Morocco.",Fes_Marriott_Hotel_Jnan_Palace-Fes_Fes_Meknes
 November 2022,5,Excellence in Fes!,"My wife and I stayed at the Fes Marriott for 3-nights. We had such a wonderful time. It started with a surprise upgrade to our room. The room we were assigned had a nice living room and a separate Bedroom arrangement. The front desk staff (Mohammad, Manal) and the Concierge (Imad, Najid) - were so welcoming, courteous and supportive. Mohammad helped us understand the places we could drive by ourselves (we had a car), where to park, how much to pay the attendant. They also helped us get reservations to a wonderful restaurant inside the Medina that we had on our list (Restaurant Dar Hatim). The next day we tried the breakfast. It has a nice spread of Moroccan and Continental dishes. We are light eaters, only had coffee, moroccan tea and a banana each...so don't know much about…",Fes_Marriott_Hotel_Jnan_Palace-Fes_Fes_Meknes
 September 2022,4,Very comfortable and spacious hotel,"Very nice hotel spread out with only 3 floors. Rooms are spacious with a very nice balcony. The balcony has 2 chairs and a small table. The bathroom is spacious too. Has provision for making coffee/tea in the room. Breakfast buffet has reasonable choice , though they didn't put out the cold cuts for the group tours. After covid, seems like most hotels even in the 4 to 5 star category don't put room slippers out unless you ask for them. Hotel is in the city and there is a good supermarket called Marzan about 10 to15 mins down the road.",Fes_Marriott_Hotel_Jnan_Palace-Fes_Fes_Meknes
 November 2022,2,Sleepless in Fes,"I have never stayed in a hotel that is so noisy, I am in room 211. There is noise from Every Direction. I am here for 7 nights two nights to go and no chance of a good nights sleep. I would rate the experience 1 star but the staff are excellent and very attentive and the food is very good too. Unfortunately a good nights sleep is not possible.",Fes_Marriott_Hotel_Jnan_Palace-Fes_Fes_Meknes
 October 2022,3,The hotel needs maintenence,"First we need to wait for almost an hour at the reception because they couldn't find the reservation. Then my room had the bathroom faucet broken and didn’t have towels. So, I need to call the reception for the repair in the bathroom and ask for towels. It was took another hour!",Fes_Marriott_Hotel_Jnan_Palace-Fes_Fes_Meknes
 November 2022,5,Special celebration dinner beautifully accommodated,"Stayed for three nights with a group of active older adults from the US. Excellent, clean, comfortable, very spacious accommodations and just perfect for our group. Where this hotel really shines is their dining room staff. Our folks were treated like royalty. The staff was very helpful and accommodating at the breakfast buffet and really went out of their way to serve special diets and help those who needed assistance. We also had a special private celebration dinner and the staff was just wonderful!! They waited on our group, helped serve a special cake and made all sorts of arrangements so that everyone felt special. No special request was overlooked. Extreme attention to detail! We just had a perfect experience. They are the tops in customer service! Special thanks to Sahel…",Fes_Marriott_Hotel_Jnan_Palace-Fes_Fes_Meknes
 November 2022,1,Worst food in fez,"Marriott fez worst meal ever ordered lamb chops nothing but bones please go some other places while you're in fez ,waste of money, please try other hospitality venues which are much quality in food , I have travelled from UK didn't expect this kind of crabby food hear in morocco",Fes_Marriott_Hotel_Jnan_Palace-Fes_Fes_Meknes
 October 2022,5,Beautiful oasis in Fes,Absolutely beautiful property in Fes with wonderful staff. We had dinner at Jnanl Fassi and it remains to be our favourite meal in Morocco. Our server Chifra was great. He was so sweet and attentive. Was very happy and excited to share his culture with us. Breakfast was amazing very traditional with so many options. Breakfast was hot and delicious.,Fes_Marriott_Hotel_Jnan_Palace-Fes_Fes_Meknes
 October 2022,5,Wonderful Place to Stay!,We ate and drank at thebar next to the pool two nights in a row and Noussair was our server. He was pleasant and got our orders accurately to us both evenings. It was very busy and he works hard to make you happy . He could use more help. They have an omelette station and wonderful selection of breakfast items!,Fes_Marriott_Hotel_Jnan_Palace-Fes_Fes_Meknes
 October 2022,4,Nice place.,"Good hotel with friendly staff but would especially like to comment on our pool bar waiter tonight for Happy Hour and appies. He was friendly, a real gentleman and had us laughing quite a few times with his subtle jokes. Sorry can’t remember his name but it was 5 letters long n had an ‘f’ in the middle. I have attached a pic of his smiling face!",Fes_Marriott_Hotel_Jnan_Palace-Fes_Fes_Meknes
 October 2022,3,Looks nice at the surface...but behind...there are a couple of weaknesses.,"The hotel looks nice and great ... at the surface. The details behind are the same as at my previous stays, like two years ago. There was only cold water for the shower. It was not fixed during my 5 nights stay, even I raised it each morning at the desk. At the last day the central power switch was broken..no light. The server in the bar forgot our orders. For me ... OK if you stay for one or two nights. For a private stay I would select another one.",Fes_Marriott_Hotel_Jnan_Palace-Fes_Fes_Meknes
 September 2022,5,Beautiful Hotel and great staff!,"We stayed in this hotel for 2 nights. The décor in the hotel was first class and elegant. The reception staff were polite and efficient. Our room was very spacious, spotless and had all the amenities needed. The bed was very comfortable but unfortunately the pillows were not as good - they went very flat during the night. There were a couple of other negatives. Firstly, the bathroom light could not be switched on without the very bright corridor light (I don't know if this was limited to our room). This meant that during the night we could only go to the bathroom in the pitch black or wake up the other person by putting the light on. The curtain tracks which relied on pull cords were broken so it was very difficult to open and close the curtains. We ate in the Moroccan…",Fes_Marriott_Hotel_Jnan_Palace-Fes_Fes_Meknes
 September 2022,2,Nice from the outside but old rooms,"We had 2 rooms at the Fes Marriott hotel, the hotel has a nice Moroccan style and architecture but the rooms were not in a good shape and need some maintenance. The water in the bath was not going through and after raising the issues to the reception they proposed a similarly bad room. I would not recommend this hotel",Fes_Marriott_Hotel_Jnan_Palace-Fes_Fes_Meknes
 September 2022,4,"Convenient, Quiet Location",The two best things about the Marriott are the staff such as Mr. Chalik and Mr. Mohammad in the Moroccan Restaurant or Mr. Rachid on the front door. We found all the staff going out of their way to make our stay comfortable. The food in the Moroccan restaurant was very good and we kept going back. The property is a little worn but put that aside and you will truly enjoy your stay.,Fes_Marriott_Hotel_Jnan_Palace-Fes_Fes_Meknes
 September 2022,4,Nice convenient Hotel,"This hotel is located outside the Medina. A taxi can get you there in no time to the Medina for 20 dirhams. They only thing is the hotel doesn’t call for taxis you have to walk out on the road to hail one down. It’s wasn’t a big issue for us. It’s a fairly large hotel. It caters to a lot of tour busses. Having said that it’s still big enough that it really doesn’t change any ones stay as most people check in at night and leave the next morning. They have a beautiful large pool and a large fitness club. The rooms were clean, large, water pressure was good, staff at reception were very welcoming. The hotel arranged a tour guide for us to walk thru the Medina and we paid the guide directly for it. The Moroccan restaurant has good food. The pub does too but the service in there was…",Fes_Marriott_Hotel_Jnan_Palace-Fes_Fes_Meknes
 September 2022,3,Disappointed,"Disappointed by the room and maintenance. Not a 5* service either. It’s a crowded hotel and there are so many rooms, you can’t expect a personalized service there. When we arrived at the hotel we had to carry our luggages to the main entry until someone from the staff started helping us. The shower pressure was very low. The air condition was working hard when we arrived in the room, it was very cold and therefore I started to cough the day after… the pool area is ok and you can get a towel there. However the breakfast was also below expectation with not fresh croissant and terrible coffee machine. The only positive thing is the price we paid. Finally we felt like in a 4 stars instead of a 5. I’d rather spend the double the amount and get a way better experience next time.",Fes_Marriott_Hotel_Jnan_Palace-Fes_Fes_Meknes
 March 2022,5,An Absolute GEM.,This property was beautifully appointed. Everything was clean and pristine. All of the employees were guest oriented they were all interested in making sure we were comfortable and we had any and everything we needed from the bellman to the director of guest services everyone was amazing. I received the fastest room service ever. I can't wait to go back!,Fes_Marriott_Hotel_Jnan_Palace-Fes_Fes_Meknes
 August 2022,5,An amazing experience,"We stayed at the Marriott Jann between August 5-7 - five people, including three kids. Cannot speak highly enough of this place. Rooms were spacious. Staff is amazing, attentive to guests’ every needs, professional and courteous. The pool is gorgeous. We had an incredible time. During our stay my wife also needed medical attention which the hotel arranged seamlessly. Thank you!!!",Fes_Marriott_Hotel_Jnan_Palace-Fes_Fes_Meknes
 August 2022,5,Family vacation- beautiful hotel,"Excellent hotel, beautiful rooms, very experienced staff and extremely friendly and welcoming. Don’t even hesitate !! Pool beautiful and serene, start music only at 15:30 not too loud. You feel at home right away. Anything you need you press 0 and they deliver! Made me want to stay longer",Fes_Marriott_Hotel_Jnan_Palace-Fes_Fes_Meknes
 July 2022,5,Best hotel in Morocco!,"Fez Marriott is the best! Where should I start? Check in was easy. The room was large, clean, and wonderfully appointed. The staff was fantastic! The bell man wanted to help us with everything! Literally every time we passed by the front desk, he asked if we needed help with anything. The pool was very large. One side was kiddie size and the other was adult size. Never deeper than my neck. Super clean and crystal clear. The gym. OMG, the gym! This gym has better stuff than most gyms in American cities! Clean. High quality. Nicely staffed. We wish we had this gym back home! The spa was good with a nice massage. The food. OMG the food! Let's start with the breakfast. The only place we've had a better breakfast was the Marriott in Prague. The service was wonderful. Now let's talk…",Fes_Marriott_Hotel_Jnan_Palace-Fes_Fes_Meknes
 July 2022,4,Wonderful service at the hotel's restaurant,The service of our waiter Chfira at the Moroccan restaurant was excellent! The food was delicious (we had Moroccan starters and Fassi Couscous). The Moroccan decor was absolutely gorgeous. Highly recommend!,Fes_Marriott_Hotel_Jnan_Palace-Fes_Fes_Meknes
 July 2022,5,Service Excellence,"As soon as you step through the entrance doors, help is at hand. The front desk staff are friendly and multi-lingual and politely dealt with a few irate customers whose problems actually stemmed from their booking agents. The rooms are spacious as are the bathrooms. The pool area is gorgeous. The breakfast offers more ""western"" options than other hotels I stayed at but they also have Moroccan specialities and endless amounts of cakes and sweet treats as served for breakfast. At breakfast although everything is at hand, staff will bring you coffee/juice/tea, will collect your omelette or bring your anything else you may want or need.",Fes_Marriott_Hotel_Jnan_Palace-Fes_Fes_Meknes
 June 2022,2,Disappointed,"Very mixed feelings on this place. We stayed for two nights. I used a suite night award to upgrade to the executive suite. It was confirmed via email about 6 days before our arrival. But the day of our scheduled arrival, I checked the Marriott app and noticed they had allocated us to a downgraded family suite instead (which is advertised at about half the rate). I tried using the chat feature to remedy the issue but wasn’t getting anywhere with them, so I had to call a couple of times to be able to speak with guest services to get it sorted out. Seems they didn’t take note of the confirmed suite night upgrade, which could have been a bigger issue if they didn’t have that room type available for us on arrival. Aside from that, the concierge is used by the hotel as a revenue…",Fes_Marriott_Hotel_Jnan_Palace-Fes_Fes_Meknes
 June 2022,5,Best hotel ever,"I have travelled the world and been to hundreds of hotels. Never have I come across the kind of hospitality as in Marriott Fez. Every single employee treats you like you are their personal guest. No request is too small or too big. The hotel is sparkly clean and absolutely gorgeous, the food is fresh, the service is simply exceptional from the entrance to the front desk, to the chambermaids, to the restaurant staff and to the pool staff. It was honestly 100% perfect in every way and a great representation/service to Morocco as a whole.",Fes_Marriott_Hotel_Jnan_Palace-Fes_Fes_Meknes
 June 2022,5,Outstanding stay,"Very well maintained hotel. Good housekeeping. Our reservation included breakfast (a must have - great selections). We spent good amount of time by the pool. The food and the service were good, as well. One of the outdoor waiters, Mohammad Al-Maliki, is truly outstanding. He is friendly, timely, and pays attention to details.",Fes_Marriott_Hotel_Jnan_Palace-Fes_Fes_Meknes
 June 2022,5,perfect rooms Hassan and noussairy are the best,i went there at the end of May with my partner and my son. i have to say the rooms are fantastic clean and big. i would like to have a special mention for Hassan Belford the bar manager during the day he was excellent very good customer service attention to details unbelievable he knows our order before even we speak very friendly very respectful he made our holiday also i would like to mention a new waiter around the swimming pool Nousairy he was very friendly and very helpful,Fes_Marriott_Hotel_Jnan_Palace-Fes_Fes_Meknes
 June 2022,4,Excellent stay,"This was a beautiful spot in the new section of Fes with nice clean comfortable rooms. The common areas were stunning and the service was perfect. The buffet breakfast has many options from an omelet station, continental as well as a full American breakfast and many Morocco options. The pool and spa was very welcoming after a long day of traveling.",Fes_Marriott_Hotel_Jnan_Palace-Fes_Fes_Meknes
 June 2022,5,Good Service,"The service at the Fes Marriot was incredible! Always looking out to make sure we were happy with our meals, and helping us try new foods local to Morocco. Special thanks to Hassan Belford and Mr Chafiq! Anne Alexander",Fes_Marriott_Hotel_Jnan_Palace-Fes_Fes_Meknes
 June 2022,5,Family holidays,"Every year when I come back to Morocco, especially to Fès with my wife and children, I stayed at Mariott Jnan palace Fès, the rooms are very clean with beautiful view ,and the swimming pool is wonderful and big enough for a good swim, we enjoyed ourselves in Pitch bar we had international and Moroccan dishes that was amazing, big thanks to M.Hassan Belford for his professionalism and kindness.",Fes_Marriott_Hotel_Jnan_Palace-Fes_Fes_Meknes
 May 2022,5,Perfect service!,Najim and Manal were so professional and kind with us. I would highly recommend them. Perfect service! 5 stars. They booked our transportation services so quickly and everything went well as planned. Don’t hesitate to contact them! And enjoy fes as well,Fes_Marriott_Hotel_Jnan_Palace-Fes_Fes_Meknes
 May 2022,5,Good food and good music,I came to the Jnan El Lfassi restaurant for dinner. The food was delicious and the service was excellent. Chifra was an excellent host. He really made me feel at home. I had the lamb for 2. The lamb was tender and juicy. The portions were very big and we couldn’t finish it. All in all an excellent experience with live music,Fes_Marriott_Hotel_Jnan_Palace-Fes_Fes_Meknes
 April 2022,5,Great value and for friendly staff,"Very nice hotel, with great prices and very friendly staff; from the restaurant to the reception, and also a special note for Najim whi was very helpful and arranged for us to have a covert test in the hotel before our departure and a great sense of humor. I will definitely recommend this hotel it has a very good value",Fes_Marriott_Hotel_Jnan_Palace-Fes_Fes_Meknes
 April 2022,2,"A nice hotel, ruined by a lousy air conditioning","Starting with the good, it is a beautiful resort hotel in the ville nouvelle of Fes. Breakfast with a mix or Moroccan and Occidental offerings. However, reason why I picked this one and not a riad in the Medina was to get a proper night of sleep. And in that, what can be called the primary function of an hotel, it failed. The room was just too hot (measured 27 degrees when I woke up). Seems that the air conditioning can't be made to output cold. All the building gets cold or hot. That is it. Apart from that, there was also an issue with the amount of taxes on the reservation not matching the amount charged on check-in, by a factor of 10. Overall, it was quite a disappointment, clearly not worth the price paid, and due to those simple things that could have been easily fixed. I…",Fes_Marriott_Hotel_Jnan_Palace-Fes_Fes_Meknes
 March 2022,5,Excellent on all accounts,"My travel partner and I just arrived at this magnificent Marriott in Fes, formerly a true palace for the King. Syed and Ikram warmly greeted us and checked us in. The concierge, Najin, was kind enough to show us to our room, where he generously pre-arranged a fruit basket as a welcome gift. We honestly couldn't be more thrilled with our experience thus far. The rooms here are everything you'd expect from a Marriott Hotel abroad. World class. Many thanks to the wonderful staff!!!!",Fes_Marriott_Hotel_Jnan_Palace-Fes_Fes_Meknes
 March 2022,5,Day trip to Meknes / Voulubis with Kos Tours,"I really wanted to visit Meknes / Voloubis but was short on time. Najim from the hotel organized a driver from Kos Tours to pick me up from the hotel. The driver was very nice, the private car was extremely comfortable and Kamal was my driver was patient, safe and very nice! I would 100% recommend a tour with them.",Fes_Marriott_Hotel_Jnan_Palace-Fes_Fes_Meknes
 March 2022,5,Mont Liban - restaurant. Incredible customer service,"We we welcomed from the time we stepped in to the lobby. The Mont Liban restaurant is a beautiful setting to enjoy a wonderful Moroccan meal. There was plenty of delicious soup served in a tureen. The pastilla was the best meal we had In Morocco. We purchased strawberries from a street vendor on our walk to the hotel. Chfira gladly offered to clean and cut some for our dinner. The service was 5 star. While we weren't staying there, it looked like a very beautiful place to stay. If I am back in Fez, this will be my first choice.",Fes_Marriott_Hotel_Jnan_Palace-Fes_Fes_Meknes
 March 2022,5,Haj & Med,"We ate dinner at the moroccan restaurant in Marriott Hotel Jnane Palace in Fess. Beatifuly decorated, excellent food and service, good music, great atmosphere, all led by Hassan Belford the manager of the place",Fes_Marriott_Hotel_Jnan_Palace-Fes_Fes_Meknes
 March 2022,5,Business trip in Fes,"Marriott hotel is very nice, the rooms and the gym are great. Good restaurants and very nice garden to hang around. Najim and all the people have been very kind and helpful. I will go back for sure...",Fes_Marriott_Hotel_Jnan_Palace-Fes_Fes_Meknes
 March 2022,5,Overall great trip,"Beautiful hotel and the room itself was fantastic, spacious & comfortable. Cleaners did a great job everyday. Everyone was super polite & always making sure we were catered too. A couple of down sides were the rates of the excursions to cities (we did Ifrane 1000MAD & Chefchaouen 1700MAD) which were quite expensive considering the driver didn't speak English and so just picked us and waited to take us back. On top of that he asked us for 2000MAD when the trip cost 1700MAD. I'd like to especially thank Manal & Nijam from the concierge services for all their help, they did a great job in organising the activities in our trip and were both a great point of contact. Also would like to thank Fatimah who would see to us at breakfast everyday, always making sure we had everything we…",Fes_Marriott_Hotel_Jnan_Palace-Fes_Fes_Meknes
