 September 2019,3,I WISH,"I wish hotels would give you the rooms as shown when viewing. I thought my room 106 had bedroom and lounge on same level,but no bedroom down about 15 steps . Didn't do my knees a power of good. Booked airport pick-up 200 MAD that's about average for hotels. Felt very embarrassed Marriott's confirmation didn't say I had to pay the driver ourselves. We didn't bother to change any money at Airport and guess what Marriott's don't change English money to MADs. Our room was decorated in dark wood and dark carpet and one balcony faced the car park . Room 106 was very clean and the bed very comfortable. It lacks a few things like slippers and bathrobe.Nothing in fridge. No welcome drink.No money exchange except for a machine in lobby I don't like those. Pool very nice and a nice area…",Fes_Marriott_Hotel_Jnan_Palace-Fes_Fes_Meknes
 September 2019,5,Quiet Reprieve,"In the busy hustle and bustle of Fez, the Jnan Palace was a welcome get away! The grounds and pool were quiet and private. The service provided by Abdeltif Kamane, Slimani Boutaina, and staff was unforgettable. Specifically, my wife and I wanted to host a small birthday party for a niece. All stops were pulled out by the team as they made a custom cake, along with party balloons, et al!! Thanks to Mohamed Maeroufi for his part in executing the details of arranging the table and room decorations. Truly a lovely relaxing stay — so convenient to the Boulevard and the Medina.",Fes_Marriott_Hotel_Jnan_Palace-Fes_Fes_Meknes
 September 2019,4,Just okay,"There is an impressive gate entrance and beautiful lobby and pool area. People liked the Lebanese restaurant with the touristy belly dancer. On other counts, this venue did not live up to the reputation of a Marriott. The food at the buffet breakfast and dinner was mediocre at best. Hardly any staff was available and I could not get a hot cup of coffee. Also the inside of the room was dingy and shockingly they do not even leave a shower cap in the bathroom.",Fes_Marriott_Hotel_Jnan_Palace-Fes_Fes_Meknes
 September 2019,5,"Beautiful ground, excellent service in Nouvelle Fès","We arrived at the hotel after our Sahara tour, 2 days without shower, 8 hours of travel time from Merzouga, you can imagine how tired we were, how we dread for a nice shower and comfortable bed. Rachid, Ayoud and the reception gave us a warm welcome, upgraded our room to a family suite, and even surprised us with a welcome fruit platter and Moroccan sweets ( maybe because of our Marriott elite) , we were so thankful on the thoughtful touch. The location of the hotel is in Nouvelle Fès (New Fès) which is more suburb, modern feel, and doesn’t have the hustle and bustle of the Medina. The hotel is beautiful, lobby is elegant, pool area is big with a great fitness Center. The family suite is on a 2 floors setting, the bed and pillow super comfortable, and finally, some fluffy…",Fes_Marriott_Hotel_Jnan_Palace-Fes_Fes_Meknes
 September 2019,5,Incredible visit!,"We had an incredible 2-night visit! This hotel was formerly a palace which is notable as you walk through its expansive space. Many thanks to Ayoub, the Guest Experience Manager, who went out of his way to greet us, answer any questions, provide advice on must-see Fes attractions, and surprised us as we were celebrating our honeymoon! Exceptional care was presented by everyone we encountered - from concierge, front desk, cleaning staff, waiters to bell hops. Thanks for a great stay - highly recommend this hotel to anyone looking for serenity in Fes!",Fes_Marriott_Hotel_Jnan_Palace-Fes_Fes_Meknes
 September 2019,3,Average Hotel,"Stayed at this hotel for two nights and the overall experience was average at best! The staff were friendly. But not very attentive! The room was comfortable. However, housekeeping is lacking in cleaning the room. Upon returning to our room we found two of our bed sheets on the floor and housekeeping did not bother vacuuming the room! The breakfast buffet was okay, nothing to right home about! The coffee was luke warm and the staff in the dining room was not very friendly. The lobby of the hotel is beautiful as well as the grounds!",Fes_Marriott_Hotel_Jnan_Palace-Fes_Fes_Meknes
 September 2019,5,Wonderful hotel & staff,"This hotel is a beautiful resort/oasis that served as a wonderful home base during our stay in Fes. The rooms and property are well kept and perfect. The amenities are great, and the location is great as well Most importantly, some of the kindest staff I have ever come across. Everyone was so welcoming and helpful. The concierge consistently and quickly set us up with everything we needed Great experience, truly 10/10",Fes_Marriott_Hotel_Jnan_Palace-Fes_Fes_Meknes
 September 2019,5,"Fantastic property, staff and service","We had an amazing stay, the hotel is beautiful, we got upgraded to a suite and it was fantastic. The bed was super comfortable. The staff is incredibly friendly and goes above and beyond. Fatima our breakfast waiter was super sweet and suggested some really good Moroccan dishes to try. The guest experience manager was incredibly helpful in providing suggestions of activities and a tour of the property. The libanese/Moroccan restaurant onsite was delicious with live music every night. Will definitely stay back.",Fes_Marriott_Hotel_Jnan_Palace-Fes_Fes_Meknes
 August 2019,5,Very good hotel,"We had a great room with a massive bed in this hotel. The room was comfortably, breakfast was very good and the pool was fabulous after a hot day touring around Fes. We had the buffet dinner which was very nice although popular dishes ran out and were not replaced. This meant late comers missed out on the best food. Lunch in the Italian restaurant was also very nice.",Fes_Marriott_Hotel_Jnan_Palace-Fes_Fes_Meknes
 August 2019,5,"Excellent Service, Food, and Property",Just finished a 3-night stay at this amazing and beautiful hotel. VERY clean. Large pool/area and new fitness center. Italian and the Lebanese/Moroccan restaurants served delicious food. Very nice breakfast buffet. The staff were all very friendly and professional (like what you get at a Ritz or Conrad). 👍👍😃,Fes_Marriott_Hotel_Jnan_Palace-Fes_Fes_Meknes
 August 2019,4,Bed!!!,"We stayed for 2 nights. The rooms were simply fantastic! The biggest bed i have ever slept!!! This thing was huge!!! Nice breakfast,should have more options for the class of the hotel. We ate to the italian restaurant ""dolce vita""twice cause the libanese restaurant was closed.The first time was very nice but the second was average..we think our pasta must be preheated .. Awesome gym and a very nice pool! Overall a very good hotel!",Fes_Marriott_Hotel_Jnan_Palace-Fes_Fes_Meknes
 August 2019,5,Visit Fez,"Very nice location. very friendly staff, who gave useful suggestions for guides and restaurants. I’d like to mention Mr. Otman in particular, who has driven us to visit Meknes, very kind and professional!",Fes_Marriott_Hotel_Jnan_Palace-Fes_Fes_Meknes
 June 2019,4,"Good, but...",Beautiful property with a pleasant vintage design. Beautiful gardens and very well maintained property. We stayed there for one night. Unfortunately we were kind of disappointed with our experience with the front desk as we had to wait for almost an hour for our room to be ready. Would still recommend.,Fes_Marriott_Hotel_Jnan_Palace-Fes_Fes_Meknes
 July 2019,5,Unforgettable stay! Great hotel and outstanding service,"Stayed 4 days and 3 nights at this Marriott. Beautiful, clean, peaceful hotel. Great location and safe surroundings. Unfortunately during our first night, I had to call the reception desk for an ambulance as my wife was rushed to the hospital (she's ok now). The security staff led by Douiri Youssef took charge of everything. Their health technician Daif Youssef was also a great help. They came with us to the hospital making sure we received good service. Daily I was going back and forth to the hospital and staff members were inquiring about my wife's health. Even the Operations Manager Ali and the General Manager were asking for updates on her health. Again a big thank you to the Marriott staff for their outstanding support. The hotel part, Rooms: beautiful decor, very…",Fes_Marriott_Hotel_Jnan_Palace-Fes_Fes_Meknes
 July 2019,5,Stunningly beautiful!,"Gorgeous property, great service, excellent food options. Would highly recommend! It was our first time in Fez for both me and my husband and we were initially not sure about the decision to stay in new town rather than within walking distance of the medina. Once we arrived at the hotel, however, we were happy with our decision! The hotel has a luxurious feel, from the Moroccan decor to the huge, swanky pool. We were even unexpectedly upgraded to a spacious suite with two floors -- making for quite the relaxing getaway for the end of a busy vacation!",Fes_Marriott_Hotel_Jnan_Palace-Fes_Fes_Meknes
 July 2019,5,"Amazing service, pool and hotel","Loved the massive and very clean pool! There were always chairs available and they were padded well for comfort. The service was outstanding except for one lady behind the front desk. I especially liked Alei. We walked to Fez Borg a number of times to eat at the food court. It's an easy waslk. Take a right at the hotel exit and keep walking straight. You will eventually hit it or you can also follow signs for McDonalds which is next to the mall. I liked Parilla, the grill place, and Pizza Hut. The walk is about 25minutes. There is also a big grocery store called Carrefour in the mall to stock up on snacks/drinks. The hotel itself is really well decorated and exceptionally clean. Nice tilework and lovely arches. We had a 2 level suite which was amazing! Very modern, quality…",Fes_Marriott_Hotel_Jnan_Palace-Fes_Fes_Meknes
 May 2019,5,Unforgettable experience,"I enjoyed my dinner with my family at the - MONT LIBAN- Fes Marriott hotel restaurant, the food was excellent,healthy and varied (Moroccan & Lebanese)great atmosphere, decoration, belly dancer.... I want to thank Mr Hassan Belford, the manager for his suggestions, his charisma and his active listening. Good luck and I will reserve the same table for the next December. Michael Murphy 😍😎🥰👍",Fes_Marriott_Hotel_Jnan_Palace-Fes_Fes_Meknes
 June 2019,5,Dreading the Fes Medina hustle? Go Marriott Jnan.,"PROS: Excellent Staff and welcome… attentive to requirements and needs. OK location with a few local restaurants, but a few side streets that should be avoided if walking alone at night. The hotel management and welcome are excellent ... Abdeltif and Butaina took excellent care and attention during our stay. There are numerous areas for lounging and several restaurants for dining! The pool [as I understand] appears to be [one of] the largest in Fes. CONS: n/a OBSERVATIONS: The Hotel is in the 'new' part of town, but only requires approx. $2-$3 10-minute taxi ride to the Medina [old town]. In the room, only one phone in the Family [2 floors] Room(s)… it's downstairs and is sometimes difficult to reach in time. The phone in the upstairs bath didn't seem to be connected to the…",Fes_Marriott_Hotel_Jnan_Palace-Fes_Fes_Meknes
 August 2018,5,Beautiful hotel,This hotel is very beautiful and quite large. The rooms are quiet and comfortable with huge bathtubs and toilets in their own little room. The bathroom also includes plugs to charge American style electronics. Room service was wonderful and very accommodating. The front desk staff is welcoming and personal. Room rates are extremely reasonable for the services provided and I will definitely stay again the next time I visit Fes.,Fes_Marriott_Hotel_Jnan_Palace-Fes_Fes_Meknes
 June 2019,5,Exceptional!,"On arrival we were greeted by the bellboys Hisham & Rachid with radiant smiles who helped us unload our luggage and rushed us into the lobby for complimentary mint tea and live entertainment. We were quickly checked in by the polite reception staff and our rooms were exceptionally clean, well equipped with fresh towels, a mini-bar, toiletries, hairdryer and iron etc. Everything about the hotel was superb with an enormous pool, on-site restaurants and exquisite decor. The breakfast was grand with a massive variety of fruits, teas, juices and both continental & traditional food. This was our most enjoyable stay whilst we was travelling across Morocco & we would not hesitate to visit again. The hotel and the staff exceeded our expectations and it was truly an exceptional…",Fes_Marriott_Hotel_Jnan_Palace-Fes_Fes_Meknes
 June 2019,5,Cozy stay and great experience,"We stayed in this Marriott hotel for total 4 nights. We thoroughly enjoyed our stay here. From the time we arrived till our checkout, entire stay was awesome. Ali ( manager) and Abdeltif (relationship manager) not only welcomed us warmly first time but also inquired about our stay whenever we met them. They and other people like Boutaina (Guest Relations), Rachid ( guest service) and Sana e ( pool service) showed great professionalism and warmth in all interactions. Rooms are spacious and Hotel has high quality amenities. We had to extend our stay our stay by one night due to unplanned events. And hotel reception (ali) helped us courteously with that too. If you want to enjoy Fes attractions and come back to cozy stay after your excursions then this is where you want to…",Fes_Marriott_Hotel_Jnan_Palace-Fes_Fes_Meknes
 September 2018,5,Dated charm,"Spacious room overlooking beautiful gardens, an OK pool (perhaps kid friendly). Check-in clerk had an attitude that I took no time ignoring. Located a taxi ride from the old Medina, nothing much going on nearby, but its Fes so can't expect anything vibrant",Fes_Marriott_Hotel_Jnan_Palace-Fes_Fes_Meknes
 January 2019,5,comfortable stay,"This hotel is great if you are looking for a nice big spacious room with the amenities of a western hotel. Staff are friendly, courteous and speak multiple languages. ROOM: beautifully decorated with a full bathroom, TV and mini fridge in the room. Balconies are a great touch, as you can sit outside and enjoy coffee in the morning and listen to the faint noises of the outside world. RESTAURANTS: We went to Mount Liban one night, we weren't overly impressed. The food was good, but wasn't work us returning. The Bar is a great area to relax and enjoy an evening cocktail. One night we went they had live entertainment! The only downfall to the bar is smoking is allowed inside and ventilation of really, really poor. The breakfast buffet was nice, lots of variety and has a…",Fes_Marriott_Hotel_Jnan_Palace-Fes_Fes_Meknes
 May 2019,4,Nice place to stay,"Everything seems spread around, with large gardens,pool. Rooms are a reasonable size. Security is taken seriously with controlled access. Hotel is an easy walk to city. Typically Marriott without being outstanding.",Fes_Marriott_Hotel_Jnan_Palace-Fes_Fes_Meknes
 June 2019,1,Not up to Marriott standards,"The overall management has serious issues. Our problems started from check-in. The bellboy was extremely rude to us, delivered the wrong luggage and gave us an attitude. The room we checked into has issues: miss complimentary water, no shower floor towel, and the hot water is not warm at all. The reception is always absent minded, and hide in the rooms behind or take random strolls away from the desks. They are nowhere to be found when called upon. It seems like everyone working here is looking out for themselves and want a tip from you in exchange for services that should be inclusive of any hotel experience.",Fes_Marriott_Hotel_Jnan_Palace-Fes_Fes_Meknes
 June 2019,5,Amazing hotel with friendly staff and delicious food,"Me and my friend have spent 2 nights in Fes Marriott Hotel Jnan Palace and had the most wonderful hotel experience in this 10 days trip. Like the interior design and the view of the pool from the balcony. Staff are all friendly and helpful, special thanks to Mr. Abdeltif Kamane, the guest experience manager, who makes me feel really like home during the stay. We’ve also tried the Moroccan restaurant in the hotel, very nice food especially the grilled lamb. We really enjoyed the delicious food with the music. most wonderful hotel experience in this 10 days trip. Like the interior design and the view of the pool from the balcony. Staff are all friendly and helpful, special thanks to Mr. Abdeltif Kamane, the guest experience manager, who makes me feel really like home during the…",Fes_Marriott_Hotel_Jnan_Palace-Fes_Fes_Meknes
 June 2019,5,Vacation in fes,"The experience has been great. The staff is amazing and very friendly. The breakfast has many options. The Marriott hotel is the best in the city and has been renovated from a former palace. The staff can arrange tours as well as dinner reservations. Special shout out to staff members boutaina and jedour najim for making our stay pleasant and providing us with an amazing experience. Also, make sure to check out the chicha lounge and spa built within the hotel.",Fes_Marriott_Hotel_Jnan_Palace-Fes_Fes_Meknes
 March 2019,5,Highly recommend,"After a dessert trip we choose to stay at an American hotel. Oh yes we made the right decision. This is a great hotel. The staff is very friendly and eager to help in any way they can. We found Najim to be the best. He helped us arrange tours, recommended restaurants, and well he became our friend. We felt like we were staying with friends. We have traveled all over the world and have had the pleasure of staying at many Marriott properties but nothing compares to the hospitality we felt at this property. Btw! I loved the decor of the rooms. I will be returning to this property.",Fes_Marriott_Hotel_Jnan_Palace-Fes_Fes_Meknes
 May 2019,4,Sometimes you just need a Marriott,We chose not to stay in an American Hotel after a couple of weeks in Morocco. This is a nice hotel but the desk clerks were not all that helpful. And the air conditioning was poor. It was very hot and we really hoped for AC. It is a big hotel with a beautiful pool and a lot of outdoor area with a small pool cafe. The restaurant food was good for dinner. The hotel was taken over by Marriott and is not up to Marriott standards yet.,Fes_Marriott_Hotel_Jnan_Palace-Fes_Fes_Meknes
 February 2019,3,"Average hotel ,very good service",The hotel is a bid dated to be a Marriott brand. Rooms and bathrooms are very large but did not like the decoration. A lot of walking to reach the rooms from the hotel lobby. gardens are nice. Buffet breakfast was excellent. There are different restaurants onsight. Had dine at the Moroccan Restaurant which was very nicely decorated.Food and live music was excellent. Had stayed at this property for 2 nights with Gate 1 travel as a part of our 7 night Morocco Tour. Would look for a more modern hotel next time.,Fes_Marriott_Hotel_Jnan_Palace-Fes_Fes_Meknes
 June 2019,5,Important “Tips”,"A lovely hotel 1. Excellent platinum benefits 2. Beautiful room; lovely upgrade 3.Excellent breakfast; free for platinum members and with special Moroccan influences 4. Overall, excellent customer service A few tips: 1. Overall the Coincerge service is outstanding. However, it can depended who you get. Najim (sp?) is excellent. We talked to Yousef (sp?); he was not good. So use them; however, be careful. 2. Careful on asking for dinner recommendation: the not-as-ethical Concierges may receive commissions on sending people to certain restaurants; these are not the restaurants you want to go to. So: use trip advisor to chose your restaurant and then ask for a reservation. 3. Avoid the hotel tour of the Medina. It is not really a “tour”at all; it is a high pressure sales…",Fes_Marriott_Hotel_Jnan_Palace-Fes_Fes_Meknes
 May 2019,3,Stay ruined by obnoxious group.,"I would recommend this hotel. Yes the service is erratic (but the staff are very friendly) and areas need improvement but overall it’s a perfectly good place to spend a few days. The pool is superb. Unfortunately our stay was ruined by a large French group who seemed to take over the place and bully the staff into letting them do whatever they wanted. This included turning the pool area into a nightclub mid afternoon by the installation of a large speaker right by our sun loungers. The management explained, for reasons I won’t go into, that they had no control over this situation and were unable to intervene. It’s sad but colonialism lives on here to the detriment of those looking for a peaceful respite from the hustle and bustle of Fez. And more importantly to the detriment of…",Fes_Marriott_Hotel_Jnan_Palace-Fes_Fes_Meknes
 April 2019,4,beautiful property terrible service,"we were in room 101.It is a auite and the lights were allone switch we could not nhave the bedroom dark abnd the living room light. It took forever to fix and we missed a meeting. The hotel, Moahammed who claimed to be the general manager , offered to give us back out 48000 points and never did. Sturday night they had loud music on the lawn in front of our room and failed to warn us. We were there three days. The IT guy was great everyone else we just waited and waited",Fes_Marriott_Hotel_Jnan_Palace-Fes_Fes_Meknes
 May 2019,4,Great Customer Service,"Recommend! Had a wonderful stay here for a few days in Fes with my girlfriends. We booked the family suite, but they upgraded us to a very nice room when we got in. The room was appointed nicely, with a comfortable bed and bathrobes! There were even some snacks waiting for us on arrival. There weren’t enough towels in the room for the three of us, so we had to call down (a few times) and that did take a long time to get. We tried both restaurants in the hotel during our stay and enjoyed them both. We thought it odd that the main restaurant didn’t have any Moroccan food on the menu! The buffet had Moroccan food, but we couldn’t have wine in that restaurant so we only did the buffet for breakfast. Not sure if we couldn’t have wine in that restaurant because we were there for…",Fes_Marriott_Hotel_Jnan_Palace-Fes_Fes_Meknes
 April 2019,3,Marriott in name only,"This hotel does not live up to the name and reputation Marriott enjoys worldwide. Rooms are pokey and not well appointed and wi-fi is poor. However, it was the quality of service and the food that was not acceptable and of poor quality plus service in the whiskey bar was slow and not particularly friendly.",Fes_Marriott_Hotel_Jnan_Palace-Fes_Fes_Meknes
 April 2019,4,Beautiful Hotel,"I joined a tour in morocco and stayed in this hotel for two nights. Hotel is located at a quiet area of Fez so it is not for people who want to walk to points of interest like Medina. The hotel is good for people who want a relaxing time in the city. It is a big hotel beautifully decorated yet not overdo. Room I stayed was comfortable and elegant. I dined at the restaurant and the food was good. I also had a very good local wine. The only unhappy experience that I had was the second day, when I returned to the hotel at about 4:00pm and the room was not ready. However, the hotel could be under staffed because there were several tour groups staying in the hotel at the same time. I would give them a second chance when I visit the city again. I do like the city and the hotel.",Fes_Marriott_Hotel_Jnan_Palace-Fes_Fes_Meknes
 April 2019,4,"Great gym & spa, not near Medina","The hotel had a beautiful pool area with a large, well equipped gym. I had an amazing 90 minute massage in the spa. The rooms are clean and comfortable, bed was a bit hard. Breakfast was delicious and plentiful, pastries were wonderful. Lunch took an hour for sandwiches to be served. The manager was helpful though. The location was very far from the Medina, which is a downside. There is a lovely walking area in Fes, which would have been nice to stay on.",Fes_Marriott_Hotel_Jnan_Palace-Fes_Fes_Meknes
 April 2019,5,Beautiful Property,Courteous staff. Neat and clean hotel. Spent 2 restful nights there after long time day tours. Quiet rooms. Breakfast selection was excellent with a wide variety of foods to choose from. No wonder this paradise is always crowded,Fes_Marriott_Hotel_Jnan_Palace-Fes_Fes_Meknes
 April 2019,4,Wonderful staff and service,"We spent four nights there. The service was impeccable. Very single member was so welcoming and pleasant. Advice on what to do around Fes, reservations and friendliness were incredible. We enjoyed two meals at Mont Liban Lebanese restaurant at the hotel and the food was really good (Not exactly typical Lebanese though). We also enjoyed coffee at the piano bar and service was wonderful. Double espresso at the hotel is about $5.25 but outside at the sidewalk cafes about $1.00. Convenience has a price.",Fes_Marriott_Hotel_Jnan_Palace-Fes_Fes_Meknes
 April 2019,5,Outstanding service,Excellent service! Staff is very helpful especially the concierge. Sorry I forgot his name :( The Morocco restaurant had delicious food. Get the fish and you won’t be disappointed. We also got a complimentary upgrade to a posh family suite with downstairs and upstairs. Breakfast in bed was delivered on time and hot!,Fes_Marriott_Hotel_Jnan_Palace-Fes_Fes_Meknes
 August 2018,5,A paradise in my home country,"I took some friends with me to visit Morocco and had for the first time the joy of the tourist experience as I’m not from Fes. The staff was lovely, the rooms comfortable clean and beautiful as well as all facilities. Service was impeccable and replied to our needs of tour guides and private transportation. I loved the pillows so much that when back to UK I discovered a Marriott online shop and ordered them! Definitely the most comfortable pillows I slept on.",Fes_Marriott_Hotel_Jnan_Palace-Fes_Fes_Meknes
