 February 2014,4,Tasteful stay,"This was a unique and tasteful stay in a gorgeous art deco building in the heart of Casablanca. We did a 2 hour art deco walking tour that commenced at the church one block away from the hotel. Our room was the Scott Fitzgerald and had some photos and writings relating to the author, which really allowed us to absorb into the art deco era. The service was very personal. I like hotels where one is seated in a quiet quarter for the check in process, and the check in was done in the library area. Arrival into the bedroom was followed by lovely mint tea and cookies. The manager on duty also helped us book a lovely seafood dinner at Ostrea. Service was very friendly the entire duration. The French manager in the morning was very kind, and even offered us the hotel car to the train…",Hotel_Le_Doge-Casablanca_Casablanca_Settat
 February 2014,4,Boutique hotel near main square,We spent two nights on two different occasions in this gem of a hotel conveniently located near Casablanca's main square that can be seen from the roof terrace. The staff could not have been friendlier and our rooms were quiet and tastefully decorated although some repairs were done less than expertly. Housekeeping is the week spot here and prevents a 5 star rating. Dust and mold appear in inconspicuous places. WiFi was spotty in one room. The food was of good quality and the breakfast buffet adequate.,Hotel_Le_Doge-Casablanca_Casablanca_Settat
 October 2013,5,"Personal and friendly, individual Bijoux","Once a year I travel to Casablanca and seek to stay whenever available at Le Doge. It's a small Hotel beautifully decorated with a lot of taste. The French Director Monsieur Delord is always present to assure the best quality possible. In a country like Marroco this is a challenge as the culture is very diffrent. The understanding of service and cleanliness is not the same as for instance in Switzerland, but at le Doge I felt always very comfortable and well served. If it was a laptop to use in my room, or some cloth to be ironed nothing was too much for the crew. For sure I will come back! Best regards to all the team.",Hotel_Le_Doge-Casablanca_Casablanca_Settat
 January 2014,4,For business,"Nice enough 'art deco' rooms and friendly service, but small and mostly, it seemed, frequented by well-off business men. At another time I would look around for a more authentic Moroccan hotel in Casablanca (or vicinity). Although the hotel is near downtown, I would rather not venture too much out there. In fact: I would skip Casablanca all together! It is an industrial city of 4 - 5 million, not something I was looking for on my vacation.",Hotel_Le_Doge-Casablanca_Casablanca_Settat
 January 2014,5,Very beautiful room,"We had made an unrefundable reservation at this hotel and had to cancel our trip literally hours before our flight took off. The management was kind enough not to charge our credit card, based on the unusual circumstances. The hotel is not cheap, and is indeed small, yet the location and the beauty of the rooms and public spaces, as well as the service, easily make up for it. The room and the bathroom were among the most stylish I ever stayed at, as well as being very comfortable. Easily recommendable.",Hotel_Le_Doge-Casablanca_Casablanca_Settat
 December 2013,3,Very average,"I booked the hotel based on the reviews in trip adviser and got really disappointed. First of all, the hotel is a small hotel and does't have much public area to hang out. There is not much to do in Casablanca at night and staying in a hotel that just has a small over priced restaurant was really boring. The room was spacious but our window that was facing a wall. Breakfast was too expensive compared to the local restaurants and very few items were on the buffet.",Hotel_Le_Doge-Casablanca_Casablanca_Settat
 December 2013,2,Definitely not a five star,"After having great time at Marakesh and relatively good time at Fes this was not the ""happy ending"" we were hoping for. We were given a room with a window facing a wall and a bathtub not draining properly. Inefficient room service and overpriced poor quality breakfast is not what you expect when you pay a good price. If you are allergic to smoke stay away from the suffocating restaurant . location was ""relatively"" good and staff were ""relatively"" polite.",Hotel_Le_Doge-Casablanca_Casablanca_Settat
 July 2013,5,Personification,"I stayed in this hotel for 2 nights before heading for a conference in Dakar, Senegal. It was this rare feeling that I had once I set foot in Le Doge. Air of elegance, amazing service, and personified interior design for the suite rooms. Second night I moved in to Hemingway's suite and I must say Le Doge simply knew how to translate into near perfection.",Hotel_Le_Doge-Casablanca_Casablanca_Settat
 December 2013,5,Art Deco gem with all the comforts,"Beautiful Art Deco rooms and suites... each one different and uniquely styled basis prominent Art Deco designers/architects. The bathrooms are large and spacious and most have large marble baths... It's located very well in a beautiful Art Deco district in Casa and while it's tucked away in a small street, it's 15 mins walking from all the action in the city centre. The staff is very helpful and helped us with all transfers, great hotel recommendations etc. Breakfast is served in a cosy restaurant and the patisserie and spread is of excellent quality.",Hotel_Le_Doge-Casablanca_Casablanca_Settat
 November 2013,5,Beautiful hotel in Casablanca,"We recently stayed at this wonderful hotel in Casablanca. Our flight from New York arrived at 6:25 AM, so we got to the hotel just after 8 AM. We were exhausted and the hotel manager made sure our room was ready for us. The rooms are beautiful and the service is great.",Hotel_Le_Doge-Casablanca_Casablanca_Settat
 October 2013,5,proposal and wedding night,I have made my proposal to my wife on the garden roof of the hotel last June and we both came back for our wedding night (via a special wedding night deal offered by the hotel) on the 26th of October. The hotel will forever stay in our heart not only because of the two aforementioned events but also thanks to the staff who helped make them unforgettable.,Hotel_Le_Doge-Casablanca_Casablanca_Settat
 October 2013,5,Fabulous hotel in Casablanca,"I loved our stay at Hotel & Spa Le Doge in Casablanca - the hotel is a lovely Art Deco, the suites are gorgeous and the hotel is very stylish. Breakfast was excellent and we also enjoyed a lovely dinner on our first night. It is also we'll located away from the noise of traffic but any easy walk to the city. Great experience and I highly recommend it.",Hotel_Le_Doge-Casablanca_Casablanca_Settat
 September 2013,4,Chic Boutique hotel,Chic boutique hotel 1930s Art Deco. Lovely rooms with quality bedding and linen. Clean and spacious bathrooms. Each room features a celebrated liteary or artistic figure. Breakfast more than ample. Good French/Moroccan menu for dinner. Helpful and friendly staff.,Hotel_Le_Doge-Casablanca_Casablanca_Settat
 October 2013,5,Fantastic Boutique hotel with good quiet location.,"Just back from Morocco and stayed here on two occasions. The staff were all extremely friendly, the food great, the rooms most excellent and the location nice and quiet for what can be a busy city. I was on a trip further south to Dakhla and had to overnight in Casablanca on both legs of my journey so decided after reading previous reviews to take a cab (organised by the hotel) into the city to sight see on the morning before my afternoon flight. It was a great idea. The vibe of this hotel is fantastic, each room having its own flair and very generous proportions with great high ceilings. Breakfast very good too. The location is tucked away off the main street so it is also nice and quiet at night and feels very safe too. A short stroll takes you down to the old Medina and…",Hotel_Le_Doge-Casablanca_Casablanca_Settat
 October 2013,4,A boutique hotel nestled in the backstreets of Casablanca,"This hotel is tiny and bespoke, with only 16 - 18 rooms each of which is named after a legendary figure eg F Scott Fitzgerald, Somerset Maugham, Coco Chanel. It was built in the 30s so retains some lovely original period features, the higher two floors were added later. Room size was very generous as was the bathroom with an enormous fully marble-tiled bath (with rain head shower). Customer service is exemplary and the small, cosy dining room offered a choice of dinner options, if a little limited. However the breakfast which I had in my room, was huge....masses of fresh fruit, fresh juice, French pastries and rolls, dried fruits from the region, cheeses etc. It was enough for me to make lunch from as well. I walked around the area and could not see any other restaurants close…",Hotel_Le_Doge-Casablanca_Casablanca_Settat
 August 2013,5,"nice and quiet, we loved it","we stayed in Collette Junior Suite, great experience good location close to place of interest nice large bedroom and bathroom staff and management are full of attention breakfast was very good wifi works fine in rooms as well as in public areas we do recommend the place",Hotel_Le_Doge-Casablanca_Casablanca_Settat
 September 2013,5,One of the best hotels ever,"We stayed at Le Doge at the start and finish of our tour of Morocco. It was excellent. The rooms were big, clean, and the service was first class. The dining room, and its attached library, on the first floor was an art deco glory. We ate in several times on both the roof, and the dining room. Both were first class. Could not fault the hotel.",Hotel_Le_Doge-Casablanca_Casablanca_Settat
 September 2013,4,Good hotel but problems with staff at check in,This hotel is something special. It is a little bit old fashioned. It has a touch of beeing sophisticated. You can confirm it with old 5 star hotels in London. The hotel is a little bit hided. Without help it is difficult to find it. There is no parking space infront of the hotel. The hotel is only offering 16 rooms. Because of this you should expect an individual high class service. But on arrival you can see that normally there is only one person sitting at the desk and doing her phone calls. The guest has to wait and there is no welcome. I have had this experiences two times because I have stayed 2 times within one week in this hotel. The second visit was something special. The very unfriendly rude lady has asked me for my passport. I have answered that the hotel has noticed…,Hotel_Le_Doge-Casablanca_Casablanca_Settat
 September 2013,5,Outstanding Boutique Hotel and Restaurant,We stayed ay the Le Doge on our first night in Morocco. What an incredible introduction to hospitality and outstanding Moroccan food. The staff (everyone) is among the best I have ever experienced; the room was outstanding; and all staff were very attentive. We had dinner in the restaurant and found the service and food exceptional. This was my first time to have beef tajine -- awesome. This is a must stay place.,Hotel_Le_Doge-Casablanca_Casablanca_Settat
 August 2013,5,5 STAR,This is a beautiful unique boutique hotel right in the centre of casablanca !! The attention of all of the staff was 5 Star at all times nothing was too much trouble ! the room was outstanding ! I also had reflexology and used the spa which was absoloute bliss !,Hotel_Le_Doge-Casablanca_Casablanca_Settat
 August 2013,5,"Nice, peaceful retreat in Casablanca","It's a real R&S! Aligned with oud best expectations in all aspects and with what one can find within a R&S hotel. Locatsd in the very center of Casablanca, very nice colonial-liberty house. Personnel extremely kind and available, perfect english, very good overall management. E We arrived with our own car and ws were allowed to park just in front of main entrance for the two days we stayed here. We planned to stay only one night, then decided to stay two days. Management arranged for that, though the room we originally bookd was' t available for two nights. Rooms are really great. Spacious, well furnished, cleaned, very good design and attention to details. Rooms have their own discrete terrace. Pricing very good compared to the level of sercices and hotel. Great experience,…",Hotel_Le_Doge-Casablanca_Casablanca_Settat
 August 2013,5,Perfect small hotel luxury experience,"We have never experienced such exceptional service in a hotel! From the minute we arrived yesterday, receiving a gorgeous mint tea, to the manageress ( not sure if this is her title) showing us how everything in the room worked,to a gorgeous pre dinner drink on the garden roof top everything was perfect. Delicious breakfast in exquisite Art Deco surroundings. best tip: check out the different themed rooms to find one that is really you. Our friends had Scott Fitzgerald and we had Colette, amazingly decorated and interesting. Large spacious rooms with lots of lounging areas. This hotel (and you can see we have stayed in a few!) my husband & I agreed is one of the most charming & comfortable. Love the feeli of boutique, not a lot of people. Mr C wished we were staying for…",Hotel_Le_Doge-Casablanca_Casablanca_Settat
 January 2013,3,"Fine place to stay, don't eat there","If you must stay in Casablanca at all (and try not to), Le Doge is a lovely quirky, clean upmarket hotel. The staff was excellent, recommended a terrific restaurant for lunch, the room and bathroom a decent size. It's definitely a 4-5 star place (we are in our 50s and travel often) but avoid the restaurant for dinner at all costs. The food was terrible, no other way to put it. Casablanca itself has very little to recommend for tourists... we had to stay a night due to flight schedules but avoid it if you can. If not, Le Doge is a lovely haven from the ugliness of the city.",Hotel_Le_Doge-Casablanca_Casablanca_Settat
 June 2013,5,Beautiful Art Deco Hotel,"We planned out trip to Morocco flying in to Casablanca and flying out of Marrakech. Casblanca to be just an overnight stay. We chose Le Doge because of our excellent experiences with the Relais & Chateaux properties. They did not disappoint at all! We were met at the airport by their very courteous and friendly driver who had chilled water bottles and 2 saucerplates with dates and cookies for our ride to the hotel.We really loved the decor and architechture of the hotel. Check-in was conducted in one of their salons where we were served mint tea and cookies. Our room was the ""Coco Chanel"" Room, all the rooms are named and decorated in the style of 1920's celebrities. They sent us to the Hassan II Mosque in their car with the same driver because the taxi they had called for us…",Hotel_Le_Doge-Casablanca_Casablanca_Settat
 June 2013,5,Excellent decore and experience,"We changed to this hotel on return from our tour due to disappointment with one we stayed in earlier. When I reported that the wifi didn't work in our room, they immediately sent a technician who installed a temporary router. The themed room concept is great, but the drink prices in the bar were outlandish - the beer in the minibar were about half the price. Breakfast was a little disappointing with little choice.",Hotel_Le_Doge-Casablanca_Casablanca_Settat
 June 2013,5,Worth it,"I said I was going to start writing TripAdvisor reviews since I use the site a lot, but now I've realised that I can't be bothered, because in this case, it's just going to be all gushing positivity. Everything was spot on: the room, free usage of the spa, rooftop garden and staff were all great. In fact, the staff were brilliant, not only while we were there, but when we rang ahead to switch the day we stayed. Le Doge is a little expensive, but then everywhere in Casablanca is, and this place is definitely worth the extra few quid.",Hotel_Le_Doge-Casablanca_Casablanca_Settat
 June 2013,4,Art Deco Boutique Hotel in Casablanca,"Hotel Le Dodge is a small hotel however the bed rooms are rather large. Very personalized attention and we all felt safe, comfortable and content while we were there. The hotel can definitely use a renovation but it is nice (think, going to grandmother's house).",Hotel_Le_Doge-Casablanca_Casablanca_Settat
 May 2013,5,Outstanding Hotel - I would return just to be able to stay here again,"This hotel was a delight from the moment we arrived, hot and dusty from a plane, train and taxi trip. It is stunning - the pictures simply do not do it justice. It is an art deco treasure and the rooms, each distinct, ooze character without compromising on the comfort. Ours was delightful with a private terrace with table where we sat and had breakfast at 0400 hours in the morning. But what also marks this hotel out is the service. The manager and his team were utterly charming and always to hand. In fact at times it was a bit like an old movie whenever we stepped out of a lift or a door someone popped up from nowhere offering assistance. What completely took me aback was when they offered, at not additional cost, to serve us breakfast in our room at 0400hrs in the…",Hotel_Le_Doge-Casablanca_Casablanca_Settat
 May 2013,5,cozy in casablanca,"Le Doge is a wonderful hotel in Casablanca, Morocco. The staff just couldn't do enough for us. Each room is unique, beautiful, and comfortable. The breakfast can be served in the room, or the garden. This is a classy property, and I highly recommend it.",Hotel_Le_Doge-Casablanca_Casablanca_Settat
 November 2012,4,Oasis of Art Deco in a busy city,"You will be pampered by the privacy of this niche luxury hotel. You will be served the best quality pastry in town, be greeted by the director in person and enjoy teh spacious rooms and a tea on a roof garden under the magical Moroccan sun... Very little peple know Casablanca this way, nevertheless this place is a must for any real connoisseurs de l'art de vivre who needs a hotel or a meeting place in town.",Hotel_Le_Doge-Casablanca_Casablanca_Settat
 April 2013,5,Classy,"Top marks for style, service, cleanliness (and I'm fussy). A beautifully maintained hotel with really interesting Art Deco touches everywhere you look. The staff were fantastic - the restaurant staff particularly wonderful. Nothing was any trouble and they laughed at my husband's jokes which made him very happy. We would definitely stay at Le Doge again.",Hotel_Le_Doge-Casablanca_Casablanca_Settat
 May 2013,5,Classy and comfy..,Clean and comfortable boutique hotel..in a nice quiet location... walking distance to great shopping and the Arab League park....breakfast was good although it was lacking Moroccan specialties which we were looking for as tourists in Morocco...the welcome pastries were outstandingly delicious...the staff was friendly and courteous...nice patio on the roof top...ni complaints...I highly recommend it!!,Hotel_Le_Doge-Casablanca_Casablanca_Settat
 April 2013,5,Perfect End to a Wonderful Trip!,"We spent the final night of our 10-day Morocco vacation at Le Doge and we're thrilled that we did! The service was impeccable from the moment we arrived. Along with a seamless checkin/out, they were very helpful in getting us dinner reservations, hiring cars, and very attentive with cocktails on the beautiful roof deck upon our arrival. Our room was perfect- a large bathroom with a HUGE tub and seperate shower. We had a small balcony and a tastefully decorated room. Our only complaint is that we couldn't stay longer! A MUST if ever in Casablanca!",Hotel_Le_Doge-Casablanca_Casablanca_Settat
 April 2013,5,European elegance with Moroccan opulence. Perfect.,"We spent our last night in Morocco at Le Doge. Our stay was perfect. We received a warm welcome from Anna at the front desk. The manager, Laurand, showed us around and brought us to our beautiful room. After multiple opulent riads in Fes and Marakech the Le Doge was perfect. It was elegant in an entirely European way. Our junior suite was a tribute to Coco Chanel. The room was beautiful and the black and white bathroom with its claw foot tub was jaw dropping. The service was impeccable. Breakfast was great with both Moroccan and European items. Perfect for a romantic stay.",Hotel_Le_Doge-Casablanca_Casablanca_Settat
 April 2013,5,Step back and meet Bogie and Bacall!,We arrived at midnight and left at 09.30 as we were on a schedule and would have dearly loved to stay longer. Stunning hotel! Service was impeccable and room beautifully styled. Obviously an original deco building beautifully preserved from the wood panelled library styled lounge to stunning stained glass in the dining room. Don't miss the lovely postage stamp sized roof garden with real grass and views over Casablanca!,Hotel_Le_Doge-Casablanca_Casablanca_Settat
 April 2013,3,Fawlty Towers?,"I had 3 days in the Hotel. It was ok but a long way short of the Relais and Chateaux standard we saw elsewhere in Morocco. Lots of staff everywhere, but I am unsure what they did. The manager on Day 1 told me there was very little to do in Casablanca - which is not what I expected to hear from the front desk of a city hotel. He said the meagre city plan they handed me was all they had, and really showed all there was to see in town, which was very wrong - but I had to work that out myself, with the help of a plan I was given in another hotel. Once something was used in your room, that was it. In 3 days, water bottles were not replaced (in a country where they recommend you don't drink from the tap). 2 calls to the front desk and they delivered another 250 ml bottle.…",Hotel_Le_Doge-Casablanca_Casablanca_Settat
 March 2013,4,delightful hotel,small and cozy hotel. all the rooms are different. would ecommend the room with the balcony. we stayed there one night on our arrival and then again on our way home. the 2 nd time we got the room woth the balcony.it was much nicer than the 1st room. excellent french food. the management cannot do enough to make you happy. i would recommend it to people traveling in morocco.,Hotel_Le_Doge-Casablanca_Casablanca_Settat
 March 2013,5,Delightful Hotel in otherwise Mediocre City,"Cozy and quaint art deco hotel - we stayed there a total of three nights (one night in one room then after a few days in Marakesch two more nights on return back to Casablanca). Staff very nice, management very good and so was food- although more French/ than ""native"" Moroccan. Very nice breakfast buffet. Small but nice roof top garden too Only ""negative"" is the so-called exercise room. It is actually only four cardiovascular devices (i.e. treadmill, stationary bike etc in a semi-open area near hot pool so the temperature is a bit warm to work out in-",Hotel_Le_Doge-Casablanca_Casablanca_Settat
 August 2012,4,Lovely hotel,"We stayed here for a couple nights before and after a road trip through Morocco, and we thought it was a great place to stay in Casablanca. It was in a nice area and we were able to walk to everything that we wanted to see, such as the Medina and the Grande Mosque. The rooms were large and clean, and I thought the themes were sweet. They had a small snack waiting in the room when we arrived, which was a nice touch. The rooftop patio is lovely and has a great view. We had lunch up there the first day we arrived and it was delicious. I would definitely stay here again if I went back to Casablanca.",Hotel_Le_Doge-Casablanca_Casablanca_Settat
 March 2013,3,"nice hotel, so-so experience","Location was central. Hotel was nicely decorated. Food in the restaurant very French, which was nice after all the Moroccan food we had on our 12 day trip. Room was nice, bathroom huge, but not very clean. We only stayed for one night, so we were not bothered to complain so much. What i did complain about was the ""spa"" part. I had reserved online as a perfect finale to our Morocco trip. I chose the Oriental Program which is for 90 min for my husband and I. We were ushered into a steam room where we sat for 10 minutes while the room got warm. A girl came in and rubbed the special Moroccan soap on me, then I sat while rubbed it on my husband. Then she scrubbed it off with a little mitt that we got to keep. The whole thing took 30 minutes. We were then told we can use the steam…",Hotel_Le_Doge-Casablanca_Casablanca_Settat
 March 2013,5,Wonderful experience,"All the staff was so nice and friendly.The location was very quite and the room Mallet Stevens was wonderful. The roof garden was amazing! A special mention to Mouhsine the driver, he is so nice and friendly and he can speak fluently italian and it was such a pleasure to talk with him in our mother tongue during our transfers from/to the airport.",Hotel_Le_Doge-Casablanca_Casablanca_Settat
 April 2013,5,Delightful art deco hotel,"We stayed only one nite but found everyone to be most helpful. We needed an early breakfast before leaving for airport and they were most accommodating. While we did not eat in restaurant, we had room service -- do not order croquet monsieur -- it has mystery meat. But the potatoes and shrimp cocktail were both excellent. They also brought us dessert treats which were lovely almond macaroon cookies. The décor is just fabulous and the rooms very large. We cannot comment on the neighborhood since we did not go out from the hotel by foot. The staff made us feel most welcomed and we would recommend them highly.",Hotel_Le_Doge-Casablanca_Casablanca_Settat
