 October 2016,5,"Beautiful place, lovely staff, well situated","Gorgeous art deco hotel, with friendly helpful staff and located in the colonial city center yet very quiet. Rooms, including the bathrooms, are large and well appointed. We were fortunate to have a patio in the Sasha Guitry room (most rooms looked like they had balconies), and enjoyed sitting on the patio (though lots of pigeons). Even though there is air conditioning, it was nice to have the sliding door open for fresh air. When the grand theater is completed, it will be a quick walk to and from a show. A bit hard for taxis to find as it's off a small one way street/alley, but just around the corner from another hotel on the main street.",Hotel_Le_Doge-Casablanca_Casablanca_Settat
 October 2016,4,Charmer in Casablanca,"Charming small hotel on a small side street just off a main drag in downtown Casablanca. Very nicely furnished in the Art Deco style. Staff helpful, with reasonable English. Room spacious with very good bath. Fast wi-fi. Buffet breakfast included.",Hotel_Le_Doge-Casablanca_Casablanca_Settat
 October 2016,5,Charming Spot in Casablanca,"Hotel Le Doge is a renovated house in the old part of the city. It is located on a narrow street that our driver from the airport had never been on before but he found it nonetheless and we were so pleased that he did. It is a nicely appointed art deco hotel with 16 suites. We stayed in the Coco Chanel Suite on the second floor, next to the breakfast room and at the top of the lovely spiral staircase. Our suite was nicely appointed with a comfortable bed and large tub. The hotel staff provide great service at all levels. Breakfast is served in a beautiful moroccan style dining room and provides lots of choices. Try the customized omelet. So delicious. Room service offers the same menu as the restaurant. We had the Beef Tenderloin with Pepper sauce and it was cooked to…",Hotel_Le_Doge-Casablanca_Casablanca_Settat
 October 2016,2,5 star price for a 3 star experience,"We arrived at night, and were shocked by the hotel location, situated on a super narrow street in an area that looked a bit like a war zone. The staff were extremely friendly and helpful, but the place was run down and dirty. We stayed in the Mackintosh Room on the 4th floor, and after exiting the dilapidated wooden elevator barely large enough for 3 people, we noticed that the upholstered chair outside our room had large dark stains on the seat and was generally worn. The room was small and cramped, the bed cover was stained, one of the bedside lamps was broken and patched up with electrical tape, there was only one bath towel and no wash cloths, and the shower was filled with mildew, My luggage was delayed so I didn't have any toiletries, and the front desk had nothing to…",Hotel_Le_Doge-Casablanca_Casablanca_Settat
 August 2016,5,Voyage au bout des sens,"The Doge, located in the heart of the ""Art Deco"" district of Casablanca is full of unexpected surprises ! First of all I want to emphasize this sensory journey that they offer thru their oriental spa and their traditional Hammam ! For the first time in my life, I'd been scrub amazingelg, that inspired me to relax, through the sweetness of the lady when she rubbed. Oriental odors were present well from beginning to end, I've even been flavore with natural orange blossom after my hammam. And of course, after finishinf my hammam, I went to the rest room, where a nice jug of fresh orange juice and a masseuse were waiting for me. What esle can be better ? A big thank you to the Doge's team for allowing me to escape myself a few hours of reality because I was in a daydream !",Hotel_Le_Doge-Casablanca_Casablanca_Settat
 October 2016,5,One night is not enough to stay in this little drop of history,Thoroughly charming art deco hotel which takes you back to the Casablanca hey days of the 1930's. Exquisite decoration and attention to detail in every room which are all individually decorated. A little drop of Moroccans near history to compare with the ancient. Amazing bathrooms. Loukili has the most incredible ceiling. Perfect stopover.,Hotel_Le_Doge-Casablanca_Casablanca_Settat
 July 2016,5,Beautiful Art Deco Hotel,"We only stayed one short night in this beautiful boutique hotel in Casablanca. Our room, the Tamara de Lempicka Suite, was spacious and decorated in the style of the thirties. Bathroom was a work of art too. Breakfast was served in the French restaurant. Staff was very friendly and helpful. Next time we hope to stay longer.",Hotel_Le_Doge-Casablanca_Casablanca_Settat
 December 2015,5,Charming Casablanca experience,"Casablanca carries with it an aura of splendor, romanticism and glamour. It is difficult not to think about the namesake movie when you are planning your Moroccan trip. Therefore, I believe you have to try this charming boutique hotel for a true Casablanca experience. It does not have the modern look and that's exactly why you want to stay there. Each room has a different ambiance and the food is reliable, with a great space for reading in their library. The staff is excellent, provides important and useful tips, is always available.",Hotel_Le_Doge-Casablanca_Casablanca_Settat
 October 2016,4,Art Deco experience in the heart of Casablanca,"This boutique hotel will appeal to the artsy and is a step back in time to the thirties. Each room is themed on a famous person - ours was Jacques- Henri Lartigue - a famous French photographer. His photography work and decorations of the period adorned the room. An eclectic old boutique hotel with excellent service. great French styled restaurant. Being used to international 5 star hotels a few issues we not to our expectations, however overall we enjoyed our stay and the experience.",Hotel_Le_Doge-Casablanca_Casablanca_Settat
 September 2016,5,Great Rooms and Service,"One of the finest hotels I have ever stayed in, excellent service, we were there only two separate nights so we did not see much of the immediate area. The rooms are very large and the staff was attentive to our every need day and night.",Hotel_Le_Doge-Casablanca_Casablanca_Settat
 September 2016,5,Casablanca charm in Art Nouveau style,"Spent two nights in this beautiful boutique hotel. There are only 16 rooms/suites and it is worth staying here to admire the decor. My room has magnificent mirrors, cornices and photography all in the style of 30's Art Nouveau. I had a large bathroom with modern fittings Comfortable bed and beautiful pillows ensured a good night's sleep. The hotel is conveniently located near some Of the must see attractions of Casablanca. It has a spa and offers Hammam.",Hotel_Le_Doge-Casablanca_Casablanca_Settat
 September 2016,5,What a magical treat,"We LOVED this hotel. The rooms, and especially bathrooms, are out of this world. The service is phenomenal. They even served breakfast to our room in a private little courtyard. I cannot recommend this place enough.",Hotel_Le_Doge-Casablanca_Casablanca_Settat
 September 2016,4,Would definitely return,"We had only a short time in Casablanca and are glad we booked this charming place. Loved the individual decor of the rooms. You'll want to take a peek into each when housekeeping is at work, as they're all unique with nice touches. Beds are comfy and linens are nice. (You may need extra towels. As other reviews have mentioned, the claw foot tubs look great, but if you prefer a shower, prepare for wet floors!) There's not too much within quick walking distance (except the cathedral, which is lovely), but cabs are cheap in town and Uber is not much more. The hotel is on a quiet side street that some drivers have trouble finding. They have a tiny map card in their brochure - bring it with you when you're out to make sure the taxi knows where you're going. Breakfast is a bit…",Hotel_Le_Doge-Casablanca_Casablanca_Settat
 September 2016,5,Hidden Gem,"The hotel is a real gem in the middle of Casablanca: A villa with customized rooms where each room has its own design, the staff is extremely friendly and passionate about their work and amazing comfort and location! The hotel is really close to the old city and it is in a charming little quaint street. The restaurant is extremely creative and amazing!",Hotel_Le_Doge-Casablanca_Casablanca_Settat
 September 2016,5,Charming hotel!,"This art deco style hotel is a real gem. Don't let the reasonable price fool you, Let Doge is a beautiful, quiet, 16 room boutique hotel conveniently located in Casablanca. The high quality accommodations are surpassed only by the helpful, professional staff. And the restaurant is not to be missed. It offers the best Moroccan food in the city. Trust me, we dined elsewhere only to return for another outstanding meal. Our highest recommendation!",Hotel_Le_Doge-Casablanca_Casablanca_Settat
 August 2016,4,Art Deco family hotel with an authentic feel,Narrow street and tight lobby. Good sized rooms. An air of authenticity with a feel of colonial Morocco. Interesting alternative to the big city hotels. Each room is named after famous actors. Good sized marble bathrooms. Restaurant adequate with friendly service. Lovely library with comfortable leather seats.,Hotel_Le_Doge-Casablanca_Casablanca_Settat
 August 2016,5,A slice of luxury in Casablanca,"We stayed here 1 night during a recent trip through Morocco. Staff made us very welcome from the first moment (upstairs into the bar, mint tea served, relaxing with a choice of English news papers ;-) Room was very comfortable. Consider paying in Euros if you can ... avoids any surprises in the Dirham exchange rate.",Hotel_Le_Doge-Casablanca_Casablanca_Settat
 August 2016,5,"Beautiful, charming and personal!","We didn't even stay at this hotel while in Casablanca, but we ate at the restaurant, and the staff were extremely nice and helpful for us in figuring out our plans for the rest of Casablanca. The hotel is gorgeous, and everything is top quality. Definitely will stay there next time we're in Casablanca!",Hotel_Le_Doge-Casablanca_Casablanca_Settat
 May 2016,4,Charming Boutique Hotel,"Lovely hotel, experienced my first Mint tea show while checking in. Stayed in the Charlie Chaplin room which has a beautiful private courtyard. I'm a fan of Art Deco and this hotel delivered. Room was beautiful, large bath, comfy bed and lovely atmosphere.",Hotel_Le_Doge-Casablanca_Casablanca_Settat
 June 2016,4,great stop off,"we only stayed for half a day, as we had a 7 hour layover at Casablanca. it was perfect for this. I chose the hotel for its character and we weren't dissappointed. We had a lovely breakfast in a really pretty dining room, The staff were freindly and helpful. We had just enough time to see the mosque, freshen up , rest and return to the airport.",Hotel_Le_Doge-Casablanca_Casablanca_Settat
 June 2016,4,Nice stay,"This is an excellent boutique hotel tucked inside a peaceful street outside of the loud, dingy city centre. I would recommend it for the unique rooms, intimate feel and friendly staff. In addition, the hotel has a nice hammam with an experienced staff. My girlfriend and I could not have enjoyed the hammam/spa treatment more after a 12 hour flight. My only caution surrounds the 5 star rating. The ambience, decor and untimely construction sounds in early morning cause this hotel to fall short of a true 5 star hotel.",Hotel_Le_Doge-Casablanca_Casablanca_Settat
 May 2016,5,"Despite the construction noise, this was luxe!","This oddball little place was more comfortable by Western standards than most similarly-priced accommodations I saw throughout the country. There is some English spoken by staff, but it would be helpful for guests to know French because they appear most comfortable with that. In a very French way. Firstly, we arrived early and I felt very grateful that they were able to accommodate us before check-in time. The facility and food standards are excellent. The junior suite we were assigned is not the one I thought I had reserved. It was loud with construction noise during the day and it was also over-upholstered. I have a dustmite allergy and prefer a somewhat more stark sleeping environment, but the room I'd have preferred was occupied by another guest. I should be clear that…",Hotel_Le_Doge-Casablanca_Casablanca_Settat
 June 2016,3,A hotel impersonating Art Deco; unfortunately some flaws with room and breakfast.,"We stayed the last two nights of our trip to Morocco at the Le Doge in Casablanca. It's located in a narrow quiet backstreet, in which guards are taking care of your car. After parking we didn't have to car about our luggage and were served mint tea in the bar. Otherwise the location is quite close to the centre, about 5-10 minutes walking from Place Mohammed V and the tramway (from there 1 station to Place Nacion Unies and 2 to La Marché). We were given a room on the second floor with a nice terrace (without a view), that could have seated four people. The room itself was Art deco from top to bottom, the bathroom very well equipped with a separate bath tub and shower. The content of the minibar was for free. Lights were controlled remotely, which was unfortunately working…",Hotel_Le_Doge-Casablanca_Casablanca_Settat
 June 2016,5,Great 2 night stay at end of Morocco trip,"Small boutique hotel, fairly central, excellent service. I must especially thank the manager, Hafidi, who was in charge the day we arrived. He was extremely helpful in arranging tours (excellent) and looking after our other needs. But the sevice throughout was excellent with very friendly and helpful staff. Only blemishes on an otherwise excellent experience were: blocked rain shower in Charlie Chaplin room and one room becoming very hot at night since AC had not been switched on (though quickly rectified when called at 4 a.m.!). Wifi in some areas is weak. Rooms are spacious, clean and comfortable. So would have given rating four-and-a-half if that was possible. The clincher for five was that kitchen gave us their kettle to make tea at 4:45 a.m. prior to leaving for…",Hotel_Le_Doge-Casablanca_Casablanca_Settat
 May 2016,4,A very nice (and quirky) hotel -- in an unexpected location,"Hotel Le Doge is an Art Deco hotel from beginning to end. Every room is designed around a famous person from the 20's or 30's. It's very convincing - even if a little cliche. The rooms are nicely appointed and quite comfortable, and the staff is very helpful. The hotel is in an unexpected setting - but still convenient. All in all, we liked the place very much. The Jazz Age / Art Deco theme may not appeal to everyone, but it appealed to us!",Hotel_Le_Doge-Casablanca_Casablanca_Settat
 May 2016,5,Oasis within frantic city,"This was our first hotel in Morocco. What a fabulous place to start! While the city of Casablanca may not be interesting this hotel certainly is. Beautifully furnished, comfortable beds, luxurious rooms, great food, friendly staff! All that you could want in a hotel.",Hotel_Le_Doge-Casablanca_Casablanca_Settat
 May 2016,4,"Pleasent, short stay at Le Doge","There are only 16 rooms in this hotel and each is decorated/named after a famous person from the art deco age. We had the Charlie Chaplin and the Coco Chanel rooms, both of which were very nicely suited out. Bathrooms are very large, with two sinks each, tub and shower. Hairdryers and magnifying mirrors were welcome additions which we had missed in some other hotel/riad stays in Morocco. The restaurant is fairly small but again quite fancifully decorated. The dinner menu is not large but offers 2-3 options for starters, mains, desserts. (Do try the sorbets!) The servers were unable to answer a couple of our questions (where does the salmon come from, e.g.) but provided efficient service at table. The bread is house made, served warm and delicious. Breakfast is a small…",Hotel_Le_Doge-Casablanca_Casablanca_Settat
 May 2016,5,Wonderful Quaint Hotel,"From the moment we arrived the hotel staff, especially Mohammed, was first class. He arranged for us to have a driver wherever we went and made excellent recommendations for us to see. The rooms were individualized and wonderful. I would recommend this hotel to anyone.",Hotel_Le_Doge-Casablanca_Casablanca_Settat
 May 2016,5,Lovey hotel; super-helpful staff; terrible city,"The staff was terrific at Le Doge - it's too bad it isn't in a nicer city! They helped print boarding passes, call taxis, and make restaurant reservations, and answered lots of questions cheerfully. The hotel is very art deco and the room decor carries out the theme. We unfortunately cut our Marrakech stay a day short in order to see Casablanca and we sure regret it. Marrakesh was wonderful! (Unless your hotel orders the taxi, the driver is likely to rip you off. Make sure that the meter is running when you catch a cab in Casablanca.)",Hotel_Le_Doge-Casablanca_Casablanca_Settat
 April 2016,5,Wonderful Oasis in a very dirty town,"This hotel is a gem. Each room is named rather than numbered. Our room, Marjorelle, was so beautiful, with red damask walls and beautiful furniture. The beds were firm and comfortable and the linens were fine. Breakfast was good and the staff couldn't have been more helpful. The restaurant was very good and the library a wonderful place to have a drink and check emails.",Hotel_Le_Doge-Casablanca_Casablanca_Settat
 March 2016,5,"""Wonderful Boutique Hotel""","We stayed at the Le Doge at the beginning and end of our two & a half week visit to several cities in Morocco. We thoroughly enjoyed staying at this small; one of a kind hotel. The service was great, (attentive but not overbearing). All of the staff from the doormen/security to the reception staff were smart looking, courteous and worked to make our stay pleasant and enjoyable. Three couples were traveling together in our party, so we had somewhat unusual airport transfer & luggage handling requirements. They were all addressed efficiently, including arranging for some of our sightseeing tours and our transfers to the train station. The rooms were large, well laid-out, technically current and elegantly & individually decorated based on themes of early 20th century literary and…",Hotel_Le_Doge-Casablanca_Casablanca_Settat
 April 2016,5,Great boutique hotel,"First of all, there is a big difference between centrally located and convenient. Le Doge is centrally located, which means you aren't actually next to anything but it is located the middle of many attractions, although you are likely to hire a driver or taxi to get to those attractions. The old medina, the corniche, Hassan mosque, and Quartier Habous are all a few minutes away (in different directions) by taxi. Walking to all of those is probably a bit much, especially in the heat. The rooms are just lovely. Beautiful old wood, decor is perfect, and the bed comfortable and firm. Bathroom is exceptionally large. Very quiet at night, I couldn't hear any noise on a weekend night. We had dinner in the hotel. While slightly pricey, the food is fantastic. The service overall,…",Hotel_Le_Doge-Casablanca_Casablanca_Settat
 March 2016,5,A great stay,"We stayed at Le Doge for only one night with a very early flight in the morning. We would have enjoyed staying longer. Our room was large, quiet and comfortable. The staff was friendly and accommodating and our meal at the restaurant was great. We would recommend this spot to anyone going to Casablanca",Hotel_Le_Doge-Casablanca_Casablanca_Settat
 March 2016,5,Great hideaway in Casablanca,"This boutique hotel is a hidden gem, staff very friendly, fantastic in house baked French style breakfast, good location, large deco style rooms. After a long flight and out and about walking all day in the city it was a great retreat to come back to and relax. Also read recently that it rated as a top pick in a Virgin Magazine I read in AUS.",Hotel_Le_Doge-Casablanca_Casablanca_Settat
 January 2016,1,bad experience,historic boutique hotel. the staff are nice. bad location. very expensive prices for the room and the restaurant. the toilet had leakage from everywhere. the TV channels are very limited. one of my worst experiences in hotel stays,Hotel_Le_Doge-Casablanca_Casablanca_Settat
 March 2016,4,Intriguing Rooms,"The Hotel Le Doge offers beautifully decorated rooms representing famous artists, actors and directors from the 20's. We stayed there at the beginning and end of our trip. The hotel is beautiful and gives an elegant place to stay. The restaurant offers good food and a relaxing place to have a drink and visit with friends. We enjoyed our stay but felt the staff seem a bit slow in their response to providing service and checks. They would disappear and not come back for long periods of time. Just seemed odd.",Hotel_Le_Doge-Casablanca_Casablanca_Settat
 March 2016,5,A lovely boutique hotel,"We were only able to stay in Casablanca for one night, so we were lucky we booked Hotel & Spa Le Doge. The room was splendid, pretty and so comfortable.The staff was friendly and accommodating, suggesting a fine dining experience right in the neighborhood. An absolutely lovely little jewel of a hotel!",Hotel_Le_Doge-Casablanca_Casablanca_Settat
 March 2016,5,Relaxing and luxurious weekend getaway,"The Doge is everything anyone is looking for in a boutique hotel - from the friendly and professional staff, the elegant and 'homey' feel of the rooms to the refined food and the luxurious spa treatments. Everything about this place has been thought out and built to perfection. The Spa was a particularly incredible and intimate experience. The couple's hammam left us feeling completely relaxed and disconnected. The products used were of top quality, the relaxation room was beautifully put together to every last little detail - from the fresh oranges, the tea selection, the rosemary water, to the large and comfortable relaxation beds and the background music. We seriously had the hardest time getting out of there and I would highly highly recommend it! Cant wait to be visiting…",Hotel_Le_Doge-Casablanca_Casablanca_Settat
 December 2015,5,Classy hotel,"This hotel has a lot to offer: art deco style rooms with large bathroom, and good restaurant, rooftop terrace, sauna included in the price, with optional massage (not included), friendly English speaking staff. It is located in a quiet neigbourhood within walking distance of the city centre, and the tram is not far away either. We heard the masseuse tell to another guest that she should be payed cash, and when we took a hammam with scrub a few days later brought cash. This (not English speaking woman) thought it was all a tip, and we had to pay the hotel for the hammam. Well it was our Christmas holiday so we left it like that. When we talked to the manager some days later we did not mention this. He asked us what we did a whole week in Casablanca. The city has not much to…",Hotel_Le_Doge-Casablanca_Casablanca_Settat
 February 2016,4,Excellent,"Room decoration average , TV small for the room with no english channel variation only CNN and BBC Bathroom decoration excellent ( shower door to the inside ?????+ no water seal ) excellent service from all staff (some of the front desk staff must learn to be more humble with guests no need for french arrogance )",Hotel_Le_Doge-Casablanca_Casablanca_Settat
 February 2016,5,This Place Is Special,"There are a lot of great hotels around the world, but very few are truly special, this is one of them. I was here for 5 nights for a business meeting. Though a boutique hotel, it was the perfect size for our 10-person meeting. The rooms are very large and comfortable. You are welcomed to you room with fresh flowers, Moroccan cookies, and fruit, as well as a refrigerator that is stocked with water, juice and soda. The service from every member of the staff was exceptional. Literally anything we asked for was delivered with a smile Ina matter of minutes. The breakfast buffet was great--fresh eggs made to order, breads, salmon and wonderful yogurt and fresh squeezed orange juice. We had a lunch and dinner in the hotel and both were amazing. I also had room service the evening I…",Hotel_Le_Doge-Casablanca_Casablanca_Settat
 December 2015,5,A delight and well positioned,"The 16 room Le Doge is in an Art Deco villa that has been enlarged to having 4 floors. Unlike many niche properties it has a lift. The location near the Cathedral makes it easy to find and easy to find the way out of the city. . The staff are attentive without being overbearing. The one thing , I feel any visitor to Casablanca should do, is to visit the Grand Mosque. Le Doge is well situated being only a short taxi drive away.",Hotel_Le_Doge-Casablanca_Casablanca_Settat
 January 2016,5,Beautiful Boutique Hotel,"Small hotel tucked away from a main street. Was perfect for our 1 night in Casablanca after arriving from NYC. The staff paid attention to our every wish. We had beautiful large rooms painted in gorgeous colors and Moroccan decor. We dined at the restaurant for dinner and it was lovely. As this was our 1st night, it was a good segway into Moroccan cuisine. Breakfast was beautiful with a full buffet of fresh fruits/yogurts/cheeses/traditional breads of Morroco. Best part was that our rooms faced a very quiet street so we had no city noise. Big spacious bathrooms.",Hotel_Le_Doge-Casablanca_Casablanca_Settat
