 November 2022,5,Beautiful room,"We only stayed one night at the hotel, but it was a lovely experience. The staff was incredibly accommodating. Our room was beautiful and had a luxurious feel to it. We dined at the rooftop restaurant. The food was great as well as the staff.",Hotel_Le_Doge-Casablanca_Casablanca_Settat
 November 2022,5,Luxury in Casablanca,"This hotel is a beautifully restored Art Deco building, with stylish interiors. The staff are charming and very helpful. Our room was elegant, comfortable and spacious. The rooftop restaurant was clearly ‘the place to be’ in the evening. Our meal was wonderful - lobster rice highly recommended! The breakfast on the roof was absolutely delicious. This hotel truly lives up to its Relais et Chateaux status. The location is very good - no more than 30 mins walking distance from many of the places to see including the Hassan Il Mosque.",Hotel_Le_Doge-Casablanca_Casablanca_Settat
 November 2022,5,Great Hotel in Casablanca,"Accommodations were comfortable and uniquely decorated and service and food were both top rate. I particularly enjoyed the rooftop bar were two bartenders, Amine and Youssef took great care of me despite my horrible French.",Hotel_Le_Doge-Casablanca_Casablanca_Settat
 November 2022,4,Art Deco Gem with a Fabulous Rooftop,"This hotel is tucked away on a tiny, hard-to-find street. Originally built as a private residence, it is a beautiful and historic Art Deco building, with large rooms and large bathrooms. Our check-in was a bit less than stellar, and that might be because they are understaffed, but there were no major hassles. That said, there was no warm welcome, either. Our room was beautiful, and the bathroom so big you could have a party in it. Housekeeping was top-notch, as was the bell staff. The highlight of our short stay was dinner at the rooftop restaurant. The waitstaff were attentive and professional. Cocktails were perfect and the food was totally first rate! We had actually stayed at the Four Seasons Casablanca on the first leg of our journey, and I wish we had stayed here instead…",Hotel_Le_Doge-Casablanca_Casablanca_Settat
 November 2022,5,Fantastic,"Absolutely gorgeous hotel with top rate service and and insanely comfortable bed. Breakfast on the rooftop was well worth the price and delicious, and we also enjoyed tapas for dinner. We would especially recommend the Andalusian octopus. Finally, although we usually like to explore alone, the front desk arranged a guide and driver for us and it was an incredible experience.",Hotel_Le_Doge-Casablanca_Casablanca_Settat
 November 2022,5,It’s ranked #1 for a reason,"What a great hotel. Tucked away on a quiet side street. Helpful staff. Large pretty, well appointed clean rooms with large bathrooms. Comfy beds (which we found was a rarity on this trip). The softest most comfy slippers I’ve ever felt. And the rooftop restaurant food is fantastic - especially at dinner. One of the best meals I had. My only nitpicks are the beds are too close together especially for such a big room and the draping around the bed is just a dust catcher and unnecessary. Also they should stop putting decorative velvet pillows (which r not cleaned) on the bed touching the bed pillows where guests will be putting their faces. Nothing should be on a hotel bed that hasn’t been washed. I did have one issue at lunch where a server brought me the wrong dish (I assume…",Hotel_Le_Doge-Casablanca_Casablanca_Settat
 October 2022,5,A meal to remember,"We had a superb meal in this out-of-the-way hotel in Casablanca. Service was first rate, the food excellently prepared and the cocktails heavenly! Being compact the atmosphere was intimate but by no means cramped and the decor was delightful. Having the roof open added to the special feel of the top floor setting. Highly recommended!",Hotel_Le_Doge-Casablanca_Casablanca_Settat
 October 2022,5,Excellent dinner at Hotel LeDoge,We stayed one night at Hotel LeDoge and had dinner in the restaurant. We tried many Tapas so we could taste more foods. It was all delicious and we had the best service. We had breakfast the next morning and it was equally good. We will eat at Hotel LeDoge again in the near future.,Hotel_Le_Doge-Casablanca_Casablanca_Settat
 September 2022,5,Art Deco Gem,"My first contact was with Mr. Abedelhadi Hafidi and I knew immediately that I had chosen the best hotel for my friend and me! Upon arrival we received a very warm welcome from the staff, especially Mohamad. Our 2 suites were immaculate, spacious and well appointed. We enjoyed a delicious breakfast on the rooftop restaurant each morning. It’s location is perfect for exploring Casablanca. Thanks to the entire staff for a perfect 3 nights.",Hotel_Le_Doge-Casablanca_Casablanca_Settat
 September 2022,5,Last day of trip,Beautiful suite. Easy access for mobility as they have an elevator and suites on first floor. Good restaurant on top level. Service and response was excellent. Had early flight and they sent us off with boxed breakfast. Would like to havre stayed longer,Hotel_Le_Doge-Casablanca_Casablanca_Settat
 September 2022,5,Lovely hotel in a bustling city,"We had two rooms on the second floor. One room had a nice outside patio. The rooms were lovely. The staff were very nice and helpful. We brought a car and the staff parked it for us on the street each day. The rooftop bar/restaurant is quite lovely. Breakfast, although a bit pricey, is quite nice...except for the coffee. I would really appreciate good coffee.",Hotel_Le_Doge-Casablanca_Casablanca_Settat
 September 2022,5,Surprisingly awesome!,"Fantastic stay at Le Doge. Staff was great and accommodating, as were the restaurants for both dinner and breakfast. The room had a great since of style and sophistication. Awesome design and execution! Would definitely stay here again.",Hotel_Le_Doge-Casablanca_Casablanca_Settat
 September 2022,5,"Excellent staff, beautiful hotel","We stayed here for six nights. The hotel inside is beautiful and the staff are incredibly attentive! The best staff by far of anywhere we have been before. The hotel is a delight of old style opulence and with the amazing staff, it really was a pleasure staying there. We had the 'standard' room and were more than happy - the maid visited every day and left complimentary bottled water, fruit and nuts. On arrival we had a complimentary bottle of wine too. We read some other traveller reviews that said this wasnt as good as others in the chain - well those other hotels must be beyond amazing! We were not disappointed with Hotel le Doge and would definitely return. To add to the hotel and improve guest satisfaction, it would be great to have a local map (for walking) and maybe a…",Hotel_Le_Doge-Casablanca_Casablanca_Settat
 July 2022,5,Beutiful Hotel and Rooftop Restaurant,We stayed in Casablanca doing one of the legs of our trip to Morocco and had the opportunity to stay at the Le Doge Hotel & Spa. The hotel is well located near some areas of interest. We actually walked from the hotel to the Grand Mosque and back one day. The walk provided the opportunity to get to know the city and see different districts of the city. It was an experience. The hotel has this nice stair case that you see in many of of the pictures too. We also had some drinks on the rooftop deck and had breakfast included with our stay and it was yummy. The hotel is also part of the Relais et Chateaux.,Hotel_Le_Doge-Casablanca_Casablanca_Settat
 June 2022,2,"Disappointing, not a typical R&C level!","Booked this hotel to have an interesting art deco boutique hotel experience, after having stayed at Riad Fes and the Four Seasons in Marrakech. Small property in a neighborhood that is hard to find. Front desk service not particularly helpful, made me show proof of free breakfast in our rate three times. Rooms are a bit tired and in need of updates. Midnight brought the sound of neighborhood dogs barking and motorcycles outside, heard through closed 3rd floor windows. The scent of cigarette smoke permeated the hallway air, wafting downwards from the 5th floor terrace where there’s a small bar/resto. By the way, no hot water in shower despite waiting 10”. Skip this one and stay elsewhere if you’re expecting a typical luxury boutique hotel experience. Not a true 5 star…",Hotel_Le_Doge-Casablanca_Casablanca_Settat
 May 2022,4,Great staff,"Very nice, boutique hotel in a quiet residential area. My favorite was Great staff: Reception, bellman, staff on rooftop restaurant. Everyone was really wonderful. What I didn't like was: Hemingway Suite: Room itself was nice. Outside terrace with pigeon poops all over. Discouraged to go outside. Lighting was dark. It may be good to consider.",Hotel_Le_Doge-Casablanca_Casablanca_Settat
 May 2022,5,Wonderful first stop.,We were only here for one night. We ate dinner which had amazing flavors on the roof and it was beautiful. The whole hotel is charming and we hope to go back someday. Breakfast was wonderful and the bed super comfortable. Service was over the top.,Hotel_Le_Doge-Casablanca_Casablanca_Settat
 June 2022,5,Stylish Retro Hotel With Modern Cuisine,"This is an excellent, stylish boutique hotel, especially if you like Art Deco and fusion cuisine. I liked the big splashy rooms and lavish baths, the rooftops terrace, the professional staff and the delicious cuisine. The breakfast on the rooftop was outstanding. My only quibbles were that the hot water was lukewarm and electrical outlets were few. The hotel is well located in a quiet one way street near the Cathedral and the foundation Slaoui Museum. Be forewarned that the street on which the hotel is located is extremely narrow and very hard to find. I would stay again at this hotel.",Hotel_Le_Doge-Casablanca_Casablanca_Settat
 April 2022,5,Unique boutique hotel,"Stayed here for 3 nights. Hotel was clean, comfortable, each room is uniquely designed. Staff was super friendly and helpful. We were there during Ramadan and were able to enjoy their dinner for breaking the fast twice during our stay - the food was superb! Breakfasts were plentiful and delicious as well. Would highly recommend!",Hotel_Le_Doge-Casablanca_Casablanca_Settat
 April 2022,5,Nice boutique hotel.,"We only stayed one night but it was very nice. Good sized rooms with comfortable bed, clean bathrooms, enough electrical plugs for all our gadgets. What stood out for me was the rooftop restaurant. Breakfast was very nice but dinner was excellent. I had the salmon and my husband had chicken tagine. After11 days in Morocco, having eaten many chicken tagines, theirs was my favorite! That’s all.",Hotel_Le_Doge-Casablanca_Casablanca_Settat
 March 2022,5,Jewel Box Hotel hiding in plain sight,"This is a lovely hotel that takes you back to the 20's and 30's, located on a somewhat obscure little street in central Casablanca. Rooms are beautifully decorated. The rooftop cafe was great. The breakfast was abundant and of high quality; it was cooked to order. The staff was very helpful.",Hotel_Le_Doge-Casablanca_Casablanca_Settat
 March 2022,5,Boutique Art Deco Hotel a great choice in Downtown Casablanca,"My wife and I stayed at the Le Doge Hotel for 3 nights at the beginning of our Morocco vacation, and 1 night on the way out. We were very happy with the hotel overall - the beautiful room, the service from Mohammed and other members of the staff, the dining area and bar on the rooftop, and a central but quiet location. The team there always tried to help with any questions. We will happily stay there again. We believe we are experienced travelers and we highly recommend Le Doge to anyone who likes to be in well located boutique hotels with fine service.",Hotel_Le_Doge-Casablanca_Casablanca_Settat
 March 2022,5,Very nice hotel on a quiet side street.,"Small, very nice hotel on a quiet side street. Each room is uniquely furnished with comfortable furniture and spacious bathrooms. There is a rooftop restaurant serving both Moroccan and Spanish influenced food. Wine and a full bar are available.",Hotel_Le_Doge-Casablanca_Casablanca_Settat
 March 2022,5,Unique experience at the heart of Casablanca,"I have stayed at the Doge 4 times and can only speak extremely highly of their brilliant service. 5 star accommodations, amazing food, a rooftop and the most attentive staff ever. I was especially impressed with the Moroccan dinner at ""Le Jasmin"" - a must and great for groups. 11/10 recommend.",Hotel_Le_Doge-Casablanca_Casablanca_Settat
 November 2021,5,"Friendly, helpful, cute place","We only stayed for one night but we had a great stay. The team is incredibly friendly and helpful. A great start to our Moroccan adventure. The place is cute with a great terrace bar and restaurant. We asked the hotel to arrange a few things including train tickets and they were so helpful! The place is clean, rooms are large, and they have a cool theme. Hotel is located in central place to see the mosque, habbous, nearby beautiful church and park. Perfect place to stay!",Hotel_Le_Doge-Casablanca_Casablanca_Settat
 October 2021,5,A lovely boutique hotel,"The Le Doge is a truly lovely hotel, an elegant oasis in busy Casablanca. My room was gorgeous, the staff were extremely friendly, helpful and professional. Each room has a name, not a number; I was in Coco Chanel. The concierge also arranged a covid test at the hotel for my flight the next day, very convenient. There is a nice rooftop cafe for tea or breakfast.",Hotel_Le_Doge-Casablanca_Casablanca_Settat
 October 2021,5,An oasis in the busy Casablanca.,"We had a lovely two night stay at this beautiful small hotel. So many highlights, the building itself, once a family home and now turned into this one of a kind hotel. The gorgeous mirrored staircase all the way up to the rooftop restaurant on floor 5. The rooms all named after stars and decorated in that style. I stayed in Coco Chanel a beautiful room. So much care has gone in to the decorations, all very instagram worthy. I want to highlight the small treats given in the room. For the first time, all things so good and not only sugar, but nuts, oranges, special cookies. The staff was very nice, positive and attentive. They were extremely helpful arranging our days here. Have to also mention the lady giving the massages etc. in the spa so skilled and lovely! Don’t miss. But…",Hotel_Le_Doge-Casablanca_Casablanca_Settat
 September 2021,5,Simply wonderful!,"Five gold stars!! We can't begin to say how much we loved this hotel. The art deco theme is beautifully executed with uniquely decorated and focused rooms. We stayed here for 2 nights at the beginning of our Moroccan tour and 1 night at the end before our departure. In fact, we had book a different hotel in Casablanca for our final night but, after our earlier experiences, it was an easy decision to cancel it and spend that night at Le Doge. We stayed in both of their ground floor suites - both completely different, both stunningly presented. These rooms have a terrace which was a nice private spot to read or enjoy a glass of wine. We also ate dinner at the rooftop restaurant on both stays. The chef is Spanish and the food has an interesting north African-European fusion…",Hotel_Le_Doge-Casablanca_Casablanca_Settat
 August 2021,5,Beautiful Hotel & Fantastic Food!,"I stayed at Hotel Le Doge for one night. My room was beautiful, but the highlights were definitely the restaurant and the bed! The bedding they had was probably THE most comfortable bedding I have ever slept in (and I have stayed in many hotels all around the world!). I love down bedding and I like to just melt into my bed, and this is exactly what this bed was like! I enjoyed lunch on their rooftop when I arrived. They have a beautiful small open air rooftop restaurant/lounge. I unfortunately sprained my ankle that afternoon, so I ended up staying in and having dinner up there too. I am certainly glad that I did, because it was fantastic! Everybody in the hotel was friendly and helpful!",Hotel_Le_Doge-Casablanca_Casablanca_Settat
 July 2021,5,Moroccan Adventure,"The service was fantastic, the food at breakfast was awesome and we didn’t miss it for anything 😋. The junior suite room was comfortable, luxurious and spacious as advertised. Dinner was awesome as well and we already look forward to visiting again with Mohamed, Farouk and friends.THANK YOU FOR THE HOSPITALITY ❤️ Great Location! 🥂❤️🥳",Hotel_Le_Doge-Casablanca_Casablanca_Settat
 July 2020,5,"Wonderful, and will definitely stay here again!","I thoroughly enjoyed my one night at the Le Doge, and will make a point of going back. I was only in Casa in transit for the night, and so it was a little further than I would normally go for such a short stay. The hotel arranged my airport transfers perfectly, and making the arrangements with the Executive Manager was quick and easy. The beautiful art deco room, with the most comfortable bed and pillow, were just what I needed. Not the mention the absolutely delicious dinner (I had Lebanese) and breakfast at the beautiful rooftop restaurant and bar! I liked that the small sized bar / restaurant was a bit busy with locals and not only guests early in the evening. It is well worth a stay.",Hotel_Le_Doge-Casablanca_Casablanca_Settat
 March 2020,5,"Quiet, comfortable, delicious","We made this our base for a couple of nights on arrival from the USA and the choice couldn't have been better. From the elegant greeting on arriving, to the quick tour of the beautiful property, to the very comfortable room (with patio), to the delicious food, this property knows how to work its' charm. The factor that even outweighs all the wonderful attributes above, is the staff who knows how hospitality works and prove it in every encounter. Casablanca is an easy entry point from the USA and I am sure I will take the opportunity to stay here in the future. In fact, I can't wait.",Hotel_Le_Doge-Casablanca_Casablanca_Settat
 February 2020,5,beautiful stop over,"This is the only place I would want to stay at when visiting Casablanca. there is an excellent atmosphere, it is beaurifully decorated and the staff are extremely kind and competent, I love the dining room and the services in general",Hotel_Le_Doge-Casablanca_Casablanca_Settat
 February 2020,5,Outstanding,"From the moment we arrived, everything has been wonderful. The room, we stayed in the Coco Chanel, was beautifully decorated, cozy and the bed comfortable. The service was impeccable, particularly help we received from Dina in helping to secure train tickets. The entire staff defines excellent customer service. Breakfast was also very good, but dinner was just amazing. Highly recommended!",Hotel_Le_Doge-Casablanca_Casablanca_Settat
 February 2020,2,Death shower,The service is very good and the rooms are cozy but dark. The shower in our room was in the bath tub. The bath tube is very slippery and getting in and out is vary dangerous. They should replace all tubs with walk in showers. Some one is going to die in this hotel. Also the rooms have very few charging plugs.,Hotel_Le_Doge-Casablanca_Casablanca_Settat
 February 2020,5,Titchener,"Excellent in all respects! Adele and Dina were very helpful from the front desk in setting up dinner reservations at ricks cafe ( a must see experience for lovers of the movie, Casablanca). Jalal upstairs in the restaurant at breakfast gave us outstanding service with one of the best breakfasts we’ve ever had. You will learn something of traditional foods of Morocco.",Hotel_Le_Doge-Casablanca_Casablanca_Settat
 December 2019,5,Good hotel,"Not sure about 5 stars, but in any case is a nice hotel, in a little street in Town, I was not impressed by the neighborhood but is 10 min by car to the big Mosque. Nice rooms, clean, restaurant in the terrace is nice and well priced. reception is very nice, easy and very respectufull gentleman. Only went the for one night so we can tour the Mosque",Hotel_Le_Doge-Casablanca_Casablanca_Settat
 January 2020,5,Wonderful Place to Stay in Casablanca!,"We stayed here for 2 nights in January 2020 on our way in-and-out of the airport. Le Doge is the perfect oasis in Casablanca -- tucked away on a side-street, calm, friendly, helpful, super competent staff who speak English and French, fabulous art deco decor with unique room themes. We stayed one night in the Coco Chanel room! The breakfasts and dinners were delicious and so graciously presented and served. I wasn't excited to stay in Casablanca because big cities aren't my cup of tea, but Le Doge is now one of my favorite spots to be! Thanks to all the staff!",Hotel_Le_Doge-Casablanca_Casablanca_Settat
 January 2020,5,stepping back in time,"This is the best place to stay if in Casablanca for a complete experience of the art deco epoque! The attention to detail is really special and the staff are great too, don't miss out on a drink by the fireplace in the salon and a great breakfast on the roof",Hotel_Le_Doge-Casablanca_Casablanca_Settat
 January 2020,5,Excellent hotel in Art Deco area,"A warm welcome from the front desk continued with all the staff being extremely helpful with advice on the tourist spots (these are limited) and restaurants in Casablanca Rooms are extremely comfortable, breakfast good and a small Hammam in the basement",Hotel_Le_Doge-Casablanca_Casablanca_Settat
 January 2020,5,Argentina,Welcoming and hospitality is the basis fir success and continuity and the hotel was very caring and welcoming concerning mr jalal you are best servicei have never seen a service lik this all staff perfect,Hotel_Le_Doge-Casablanca_Casablanca_Settat
 January 2020,5,Epic experience!,"They say that “the people make the place” and that is the case with The Hotel Le Doge. A perfect boutique hotel with beautifully appointed rooms, each having it’s own theme. I stayed in the Fitzgerald (loved it!) but the staff was amazing. Jalal was such a special host, incredibly attentive, and always a smile, he was simply perfect! Souad was incredibly sweet and Mouhsin was such a joy. I am blessed with wonderful memories. You can follow Happy Tiger Tales on IG if you are curious about the tiger. 🐯🐾💗",Hotel_Le_Doge-Casablanca_Casablanca_Settat
 January 2020,5,usa,"A magnificent hotel that deserves to be visited every vacation, beautiful hotel service and a smile in particular, nice man Mr. Jalal is ferfect service a good and respectful man thanhs all staff hassan usa",Hotel_Le_Doge-Casablanca_Casablanca_Settat
 July 2019,5,"Pleasant surprise, location not really great but inside looks and feel extremely cosy and comfortable.","At first when we arrived, it felt like an odd location for such an apparently great hotel. Narrow street, buildings around needing urgent repair.... but once you step inside “Le Doge” you are instantly in a cosy atmosphere that feels like home. An old, historical place, well maintained and with excellent service. The Welcome tea served in the room was delicious!",Hotel_Le_Doge-Casablanca_Casablanca_Settat
 December 2019,5,Pleasant experience,"I had a wonderful stay in this elegant boutique hotel. The singular & original thing about this hotel is that each room has a specific theme. I got the chance to stay at the Sacha Guitry one. The room is spacious, perfectly clean & quiet and the bed so comfortable. I especially felt in love with the enchanting bathroom and the peaceful little terrace. The service was very professional and the staff super nice and helpful. I had a pleasant dinner in the rooftop restaurant. The food was good and the atmosphere very chill.",Hotel_Le_Doge-Casablanca_Casablanca_Settat
 December 2019,5,Wonderful moment,"My only regret is that we couldnt spend more nights in this charming art deco hotel. The rooms are tastefully decorated and uniquely designed with a different theme for each one of them, ours was Coco Chanel. Our room was spacious with good size bath and plenty of closet. I had a peaceful night as the room was very quiet and the bed so comfy!! The service was impeccable and the staff super helpful. The hotel's Restaurant ""Jasmine"" is very elegant and the Moroccan food delicious !! (I honestly rarely eat at hotel restaurants but it was the perfect exception). The hotel also enjoys a chill rooftop bar & restaurant and the breakfast was good.",Hotel_Le_Doge-Casablanca_Casablanca_Settat
 December 2019,3,Nice hotel and location but over rated,"This is a very nice hotel on a very quiet street close to the main square. However, in my opinion the hotel is over rated. The service is ok although in my case it was severely lacking. I requested a wake up call early morning to catch a flight. I confirmed the wake up call before I went to bed. In the morning - no wake up call. This is absolutely unacceptable at any hotel, let alone a five star hotel. When I asked the front desk what happened, they looked at me with glassy eyes. A quick, I'm sorry, and that was it. In addition, the balcony door did not lock, the design of the shower made taking a shower a bit of a challenge and they charge you for coffee in your room while the few soft drinks in the mini bar are free. Quite unusual. I would choose another hotel if I…",Hotel_Le_Doge-Casablanca_Casablanca_Settat
 December 2019,5,Wonderful stay,The hotel was lovely: the decor was beautiful and the staff was charming and helpful. Centrally located but quiet. Our room had a small patio. We ate a nice breakfast (not included) on the rooftop. Service was excellent. Highly recommend.,Hotel_Le_Doge-Casablanca_Casablanca_Settat
