 July 2018,4,A good hotel but could be better.,"The assistance given and friendly service is fantastic. The bed is very comfortable and to have an open area to work in is great. However this had to be tempered against lift replacement works that continue until gone 2230 hours. No warning was given to guests that this was going to happen and when you have to get up at 0400 for a flight then this really is not a restful place to stay. For a five star hotel it is lacking in certain areas. Plus points are the staff, the location and the food. Minus points are no turn down service, no bathrobes and the noise. The hotel offers money exchange as long as it’s not GBP but a short walk will get you to a bureau de change who will change you money. Alcohol in the bar is expensive compared with local establishments.",Hotel_Le_Doge-Casablanca_Casablanca_Settat
 June 2018,5,Art Deco and great service,"This charming hotel was great for our three days in Casablanca. It looks like there are only 16 rooms here, but with two restaurants, attentive front desk and doormen, I’d have thought they were staffed to serve a bigger group. The decor is a great throwback to 1920, and the location is awesome.",Hotel_Le_Doge-Casablanca_Casablanca_Settat
 May 2018,5,"Nice hotel, good location","We stayed here only one night. The check in and check out went smoothly. The breakfast is served on the roof and is good and varied. The room was clean, nice and quiet with a large bed and a free mini bar.",Hotel_Le_Doge-Casablanca_Casablanca_Settat
 May 2018,4,Casablanca charm,A wonderful first night in Morocco. Lovely room and roof top bar and restaurant lounge. The staircase is beautiful as are the art deco details throughout. It is a tiny bit worn around the edges but still stylish and enjoyable. Nice mint tea and cookies as a welcome when we arrived.,Hotel_Le_Doge-Casablanca_Casablanca_Settat
 May 2018,5,Well placed boutique hotel with great food,"Spent 3 nights total at Le Doge in 2 different rooms. Both were very spacious and comfortable. The hotel is well positioned on a quiet street within easy walking distance of some of the busier areas of Casablanca. There are 2 restaurants - a classic Moroccan on the ground floor and a more eclectic International one on the roof where breakfast is also served. We ate twice in the Moroccan restaurant and, as there were a couple of weeks between our first and second stays I ate the same main dish both times - a very good tagine of monkfish and shrimp beautifully spiced. My wife had a chicken tagine the first time and requested and was given the same dish as me without the monkfish. In the international restaurant I had a superb meal of swordfish carpaccio followed by beautifully…",Hotel_Le_Doge-Casablanca_Casablanca_Settat
 May 2018,5,Excellent value and great accommodations,"We really liked this hotel. They gladly accommodated a very early check in (gave us cookies and mint tea while our room was prepared) and treated us very well throughout our stay. The room was exceptional- beautiful velvet textured wallpaper, nice furniture, a clean bathroom, and a very comfortable bed. The terrace restaurant is nice. They offer a nice breakfast buffet and it’s more of a bar/lounge at night. A bit smoky for us, but that’s the way it is. The staff is friendly and very customer focused. You’re a short walk to the Medina and about 25mins to the Mosque. We’ve paid way more for hotels not nearly this nice. Highly recommended.",Hotel_Le_Doge-Casablanca_Casablanca_Settat
 April 2018,5,Art Deco Boutique,"A perfect ""welcome"" to Morocco. The vibe was an interesting blend of romance and intrigue. I was given the Josephine Baker (all rooms are named) and felt very much transported to the 1920. Dinner was lovely with pleasant service and breakfast on the roof terrace was a great kick-off to my Moroccan holiday.",Hotel_Le_Doge-Casablanca_Casablanca_Settat
 April 2018,5,A lovely introduction to Casablanca,"On our first night in Morocco we stayed at the Hotel le Doge, a charming hotel full of art nouveau detailing, tucked into a quiet street. I'd been a bit concerned when booking a ""standard room"" that we'd find ourselves squeezed into a small space, but I need not have worried. Our room (Loukili) was spacious and resplendent in blue velvet walls. In addition to a comfortable, queen-size bed, the room included a sitting area with a comfortable upholstered chair and a table upon which stood a vase of fresh flowers. The bathroom was spacious as well, and the only downside for us was that the shower was a hand-held/wall mounted unit above a massive tub—a little bit of a challenge to get in and out of without slipping). A full array of toiletries was provided in the bathroom (not…",Hotel_Le_Doge-Casablanca_Casablanca_Settat
 May 2018,5,Forget The Rest - This Is The Best !,"This is a small boutique hotel and if you are getting a taxi from the airport, the driver may not know how to find it - so keep the phone number handy ! 😊 . Reception was warm and welcoming. We were a little early, so at the suggestion of the Manager, we went to the rooftop bar/cafe for lunch. It was delicious and the service staff extremely friendly. . When our room was ready , we were escorted to it and shown where everything was. The room was a good size with a big bathroom, including complimentary toiletries. The room included a large TV, coffee maker, air conditioning and a big balcony and an extremely comfortable bed with great pillows ! . Most of the superlatives have already been said about this property. One of the best assets are the staff - who, without…",Hotel_Le_Doge-Casablanca_Casablanca_Settat
 May 2018,5,Gorgeous hotel,"Le Doge is a gorgeous, Art Deco hotel hidden on an narrow street in Casablanca. The rooms are beautifully appointed, as are the amazing dining room and roof top. Staff is very nice. Only complaints are that that rooms were a bit hot at night. A lovely place to stay for a treat.",Hotel_Le_Doge-Casablanca_Casablanca_Settat
 May 2018,5,Perfect 1st and last night in Morroco,"Landed and were taken to this hotel tucked away so not sure would be able to find on our own! Clean luxurious rooms and very nice staff! Food at dinner, sole Menuire was to die for! Breakfast on the terrace was pleasant and easy! Put it on your list!",Hotel_Le_Doge-Casablanca_Casablanca_Settat
 May 2018,5,Beautiful Small Hotel,Nestled in a quiet street a ten minute walk to the bustling centre of downtown Casablanca. Staff very friendly and welcoming. Breakfast on the terrace was delicious and the service at breakfast was excellent. The rooms are spacious and very well appointed . A rare addition in Morocco is that this hotel has a small lift for those that do not like stairs.,Hotel_Le_Doge-Casablanca_Casablanca_Settat
 April 2018,1,"Beautiful hotel, sold out","Wonderful hotel. Amazing accommodations. I was incredibly disappointed as they sell out the rooftop in Sunday’s for “Soul Sunday’s”. The breakfast is typically available rooftop however for our stay it was unavailable unless we wanted to purchase a ticket for the private event. And later I. The day the rooftop remained unavailable. As a hotel guest I anticipated the roof would not be closed. Other than this a beautiful hotel, would love to give it a 10, however this service is unacceptable and I can’t express my disappointment.",Hotel_Le_Doge-Casablanca_Casablanca_Settat
 April 2018,5,Oasis in Casablanca,"We stayed here for a single night in the Charlie Chaplin room. It was a beautiful, peaceful hotel. The staff are very friendly and it was a beautiful introduction to Morocco for the uninitiated. Dinner was served in the gorgeous restaurant which only seats about 20 people, incredibly intimate yet friendly and comfortable. The bed was beautiful and very comfortable, we had a small courtyard and a bathroom with a bath - perfect for weary travellers. It was all very clean not over the top with extras yet fairly well appointed perfect for a single refreshing nights sleep. The highlight for us was the breakfast served on the terrace upstairs- delicious. An excellent option for those wanting a more personal stay somewhere in Casablanca. Book a relaxing massage whilst you’re…",Hotel_Le_Doge-Casablanca_Casablanca_Settat
 April 2018,4,Lovely quaint hotel,We enjoyed this property on our last night in Morocco. It was a charming property and we appreciated that it had a bar! The staff was friendly and efficient and made us feel welcome. We wished we would have more time to have enjoyed all the facilities. Our only complaint was smoking was allowed in the upstairs bar area.,Hotel_Le_Doge-Casablanca_Casablanca_Settat
 April 2018,5,Great stay,"Had two adjoining rooms for family of 4. Well appointed and very clean. Only negative would have preferred one room with 2 twins but not available. The breakfast was excellent with best fresh-squeezed orange juice. Lunch and dinner were also excellent. Location not bad, but Casablanca only worth half a day visit. Too busy and cosmopolitan. Mosque worth seeing, otherwise would recommend other cities.",Hotel_Le_Doge-Casablanca_Casablanca_Settat
 March 2018,5,Beautiful and comfortable,"This is one of the nicer hotels I have ever stayed in. The hotel is beautiful, with an overall art deco theme. We stayed in the Moulay Loukili room, which was decorated in dark blue and was incredibly cozy. Glimpsing through open doors, some of the other rooms appeared more open and light. The staff was very friendly and attentive and gave us a good recommendation for dinner down the street. The restaurant in the hotel looks beautiful (and quite upscale), but we did not get the chance to eat there (it looked crowded, so you may need to book ahead). Breakfast on the rooftop terrace was delicious. The hotel is conveniently located near the Place des Nations Unies.",Hotel_Le_Doge-Casablanca_Casablanca_Settat
 March 2018,4,"Luxury, comfort and cinema.","A nice comfortable hotel in Casablanca. Each room is dedicated to famous actor or actresses. Rooms are spacious, well appointed and our room had a small lovely internal garden. The common areas are elegant, a drawing/reading room and a nice restaurant area. The staff is courteous and professional. I would have liked to stay one more night and try the spa but our tight traveling schedule didn’t allow. A good reason to come back to this lovely hotel...",Hotel_Le_Doge-Casablanca_Casablanca_Settat
 March 2018,4,Classic Comfort,"This Art Deco hotel is in a quiet area and has some classic touches. The rooms are spacious and comfortable, but a little dated. We only stayed 1 night at the end of a 12 day vacation, so it served it's purpose. The real advantage of this hotel is it's restaurant, Le Jasmine which is superb.",Hotel_Le_Doge-Casablanca_Casablanca_Settat
 March 2018,4,Almost perfect,"This was both our first and last stays during a tour of Morocco. An early French Colonial Art Deco town house extended and remodelled to give it life as luxe Moroccan riad, this is a fine place to stay with quality accommodations and very attentive and competent service. The property is well located in a quiet neighbourhood and most of the staff have passable to good English but French works with everybody. It falls ever so slightly short of excellent but it is a very good Very Good. The good: on each occasion our double junior king bed suites were clean, comfortable, quiet, well-appointed and adequately roomy. The decors were contemporary luxe with local or movie character themes enlivened with and a few Art deco flourishes. The beds were comfortable, the linens lush and the…",Hotel_Le_Doge-Casablanca_Casablanca_Settat
 January 2018,5,Delightful Colette Suite,"The Colette Suite was delightful, with its pink and orange art deco design. The staff were incredibly helpful and attentive to our every need. Unfortunately, we were only able to stay for one night, so we were unable to experience the restaurant, but it had a beautiful ambiance, consistent with the character of the hotel overall. We highly recommend this hotel.",Hotel_Le_Doge-Casablanca_Casablanca_Settat
 January 2018,3,Very nice but....,I am eating dinner at the moment and the hostess/waitress is coughing so terrible it is disgusting. She has active influenza by the sounds of it and is in the kitchen!!!! I can't eat my meal because it is completely and utterly disgusting. I can hear her coughing in the very tiny kitchen. She should be at home!!,Hotel_Le_Doge-Casablanca_Casablanca_Settat
 January 2018,3,A little tired around the edges but a lovely vibe,We only spent one night at this hotel and it’s a very exotic looking art deco hotel with a grand winding staircase and tremendous decorative arts everywhere. That said if you are looking for a five star pristine elegance I felt that this hotel Didn’t really hit that mark. Our room had an incredible canopy bed with fantastic artwork and great paint colors but we were on the ground floor and with a deck that was right out on the street so it was not ideal. It’s also a difficult hotel for entering and exiting due to its location on the side street. That said I thought the staff was really nice and because we had to leave very early in the morning they put together an extra early breakfast just for our group which was kind and generous of them and truly appreciated!!,Hotel_Le_Doge-Casablanca_Casablanca_Settat
 January 2018,5,Lovely hotel with helpful staff,"Perfect stay at Le Doge Le Doge is a beautiful and well-appointed hotel. My friend and I were treated with remarkable hospitality and kindness by the entire staff. In particular the front desk and lobby staff, Faical and Mohcin, went out of their way to be helpful. They made calls on our behalf and made certain that we had safe and timely transportation whenever we left the hotel. They scheduled a convenient time for our hammam and massages, and then re-scheduled when our plans changed. The hammam and massage were exquisite. Our room was lovely, clean and comfortable. We ate breakfast and dinner in the dining room at Le Doge and found that the service and food were both excellent. Breakfast was lovely and I would especially recommend the homemade yogurt. Our Moroccan dinner was…",Hotel_Le_Doge-Casablanca_Casablanca_Settat
 January 2018,3,Good service,"We stayed one night on New Year’s Eve. They served a special prix fix dinner in their restaurant Le Jasmine, which was very good. They had musicians from an academy from Rabat there playing traditional music. The dining service was excellent and overall ambience of the restaurant very lovely. The hotel itself is tired looking and needs to be redone. The staff was friendly.",Hotel_Le_Doge-Casablanca_Casablanca_Settat
 December 2017,4,First visit to Morocco,Excellent service - the staff outstanding. Room was very good and was cleaned to a high standard each day. Food was very good & the roof top bar was a nice place to have a drink. Would stay again & highly recommend. Really great location to walk to main areas.,Hotel_Le_Doge-Casablanca_Casablanca_Settat
 December 2017,3,Too much incense,"Loved the themed entertainer rooms (I had the Fritz Lang room) Nice rooms, great bathroom, both a walk in shower and separate bathtub. Way too much sandalwood incense in the common areas. Permeated in to the room. First thing I did was open the patio doors to let the room breathe.",Hotel_Le_Doge-Casablanca_Casablanca_Settat
 October 2017,5,Wonderful hotel,"This was areal surprise. We booked this place in the heart of town, so that we weren't too far from the King Hassan Mosque. This turned out to be a real first-rate hotel. The interior is elegant, and our room, the Coco Chanel room, was terrific. We don't usually eat dinner in the hotel we stay in, but in this case it was quite convenient. Dinner was spectacular, we had lamb and it couldn't ave been better.",Hotel_Le_Doge-Casablanca_Casablanca_Settat
 November 2017,5,Gorgeous Art Deco Hotel,"We enjoyed our one-night stay at Hotel Le Doge before departing Casablanca the next morning. The hotel accommodated our early check-in and hospitably served us traditional mint tea and cookies on the roof terrace before guiding us to our room. The entire hotel has a striking art deco decor. The online photos don’t do it justice. We stayed in the Mallet room, which was roomy and elegantly decorated. We loved the marble bathroom with a soaking tub, bath salts, and his and her sinks. The mini fridge offered complimentary water, soda, and juice, which was a thoughtful touch. My husband loved the plush bed, which was a rare change from the firmer beds more typical in Moroccan hotels and ryads. Our room was quiet with a lovely balcony to sit outside as well. We didn’t have an…",Hotel_Le_Doge-Casablanca_Casablanca_Settat
 November 2017,5,Awesome one night stay !,"Had a fabulous stay at hotel le doge. I booked thinking I would have some down time to kill in the morning as I arrived in Casablanca airport at 6am. When I arrived at the hotel they let me up to the rooftop for some tea and cookies - I got to soak up the sun until they let me into my room an hour and a bit later (still very early in the morning!) I was pleasantly surprised but the spacious room, super comfy bed, fabulous bathroom and cute patio. I enjoyed both dinner and lunch up on the rooftop and had a great meal each time. I would recommend this hotel to anyone going through Casablanca!",Hotel_Le_Doge-Casablanca_Casablanca_Settat
 November 2017,5,What a perfect little suprise pacjage,"I can only speak in glowing terms of our two night stay at Le Doge. Everything from booking to airport transfer was executed with ease and politeness. Our room in this ( I call it a Riad in Casa) was so lovely and typical of Moroccan design.. and smelt if orange blossoms. The hotel was sparkling clean! I loved the little touches... expresso machine in my room, Moroccan almond pastries each day and complimentary bottles of water. Its these extra touches that for me make a memorable impression. Oh and the bed... heaven. Also for us an added bonus was the rooftop restaurant. What a perfect place for breakfast and dinner. The food on all occasions exceeded our expectations and the service was exemplary. We caught petit taxis to the major attractions and found it easy and not…",Hotel_Le_Doge-Casablanca_Casablanca_Settat
 November 2017,3,As long as you like the scent....,This is a pretty hotel on a quiet street in. Casablanca. The staff was nice but we found it odd that they have scent diffusers on every floor. At first we thought the man at reception was wearing too much cologne but we later realized what it was. We didn't particularly like the scent which turned us off to the hotel. There were some other near misses. I booked a massage and then sat in the small spa room looking at peeling paint for 30 min before anyone acknowledged that my appt would. be late and this was only after I complained to the front desk. There were also some areas we found dusty. None of this was terrible but it stopped the hotel from getting more stars. We also found the rooftop bar to be extremely expensive.,Hotel_Le_Doge-Casablanca_Casablanca_Settat
 October 2017,3,OLD!!,"Tired & characterless. Very difficult to access by car. Large room but dark & dowdy. No operating manuals for fittings/facilities. Sleep disturbed by barking dogs.Room phone to front desk not working necessitating several trips to reception to report problems. 3 technicians unable to tune in English TV channels. Mediocre roof cafe - no early breakfast facility. 3 star rating at best,",Hotel_Le_Doge-Casablanca_Casablanca_Settat
 November 2017,5,Great short stay,"We were here 2 nights ,one with a ground floor room and once on the 2nd floor . Both were well equipped but the ground floor one had a much better porch . Bathrooms were great , the hotel has minibars and the internet service was excellent . The restaurant was very good offering European and Moroccan choices . Quiet location .",Hotel_Le_Doge-Casablanca_Casablanca_Settat
 October 2017,4,Enjoyed our short stay,"We spent 2 nights at this hotel. Once after arriving in Casablanca and one before leaving (after spending 2 weeks in Morocco). Both time our rooms were comfortable and well-appointed. The hotel staff were very pleasant and made sure we had everything we needed. We had the breakfast buffet once but didn't get a chance to have dinner. The location on a side street makes it a quiet hotel which was welcomed by us after a long flight. All in all, a pleasant hotel.",Hotel_Le_Doge-Casablanca_Casablanca_Settat
 September 2017,4,Wonderful 1 night stay,"The staff was friendly and very helpful. The decor was fun and unique. Our room was large, comfortable and well-appointed. Both restaurants (traditional Morrocan food and European fare) were delicious and had wonderful ambiance.",Hotel_Le_Doge-Casablanca_Casablanca_Settat
 October 2017,5,Couldn't fault it.,"Stayed one night having arrived fairly late from the airport. The room was very special - what appeared to be wallpaper was actually a fabric covering. Good facilities, but there's a charge for the Nespresso pods, although soft drinks are complimentary. Breakfast on the roof was excellent. It's difficult to find down a sidestreet, but that means it's quiet. Low level lighting in the room added to the ambience but made finding stuff in the suitcases difficult. A minor niggle.",Hotel_Le_Doge-Casablanca_Casablanca_Settat
 October 2017,5,Loved the ambience,"Really happy I chose this Art Deco hotel to overnight at in Casablanca before commencing a 19 day tour of Morocco with my friend. Initially I was annoyed our room wasn’t ready when checking in at 3.30pm however management appeased the situation by offering mint tea on the rooftop and upgraded us from our booked executive room to a junior suite. Room was very clean, well appointed and equipped with 2 small balconies. Bathroom amenities were gorgeous and I loved the bath and shower. Funny moment when we realised no bath towels so had to dry myself with a hand towel and get some towels later. Rooftop cocktails were fantastic as we watched the sun set as was breakfast from this viewpoint next morning. Dinner at Le Jasmine was one of my favourite meals in Morocco and the…",Hotel_Le_Doge-Casablanca_Casablanca_Settat
 October 2017,4,Wonderful hotel,My husband and I spent 1 night at Le Doge Hotel before joining a tour. What a fantastic stay we had. Our flight arrived early morning and our transfer from the airport to the hotel was waiting for us. Our room wasn't ready when we arrived but the staff made us feel very welcome and directed us to the rooftop terrace where we could have breakfast. An hour later we were given access to the Josephine Baker room. Absolutely beautifully decorated and space for miles! The staff were friendly and very helpful with restaurant tips and directions to places of interest.,Hotel_Le_Doge-Casablanca_Casablanca_Settat
 October 2017,4,Almost perfect,"We stayed at Le Doge on our way home from Morocco. It was a lovely (if hard to locate) hotel in the busy Casablanca. Upon arrival, we immediately made reservations for the lux Hamman. We enjoyed the moroccan Hamman in the hotel immensely. It was a truly lovely oasis, and thew lady who massaged an bathed us was truly superb. We also ate at the rooftop restaurant. I thought this was a bit on the pricey side, but the food was good, and it seemed like a place to see and be seen for Casablanca residents. The room itself was lovely. We had the Coco Channel room. Really top notch bedding, and lovely claw foot tub. The only mar in the stay was when we went to check out. The gentleman at the the front desk in the morning -6 a.m was rude and cold. He had trouble charging…",Hotel_Le_Doge-Casablanca_Casablanca_Settat
 September 2017,5,"Stayed twice, would stay again!","Beautiful, old-world, (but in perfect condition) small hotel on quiet art deco street. Superb service. Very comfortable rooms and great food served on roof terrace. Friendly staff responded immediately to e-mails before arrival and promptly arranged taxis when needed.Street very quiet, welcome respite from noisy Casablanca.",Hotel_Le_Doge-Casablanca_Casablanca_Settat
 October 2017,3,Too expensive for the provided services,"Good:We arrived late and they provide an upgrade for free. The taxi driver set for the hotel was an excellent driver. Not that good: Doesn't look like a 4*, outdated for the price point. I had to send them three emails before receiving an answer to book a taxi to pick up us from the airport. The room was dark. The bathtub too high and was difficult to get out. When we did the check out we request them to call us a taxi and they ignore our request, we walk outside to pick up one ourselves. It may be good for a few days but for a one night sleep you'll be able to find much better options.",Hotel_Le_Doge-Casablanca_Casablanca_Settat
 October 2017,4,Oasis in a sea of dust,We stayed overnight before a flight home. The hotel was comfortable and all of the people we met there were very helpful and friendly. Our room was very nice ( we had a junior suite at a reasonable cost). The rooms are all themed around literary or artistic figures and done well. We loved the Moroccan restaurant and will review it separately. Much of that area of Casablanca though seems to be under a large repair project. There is dust and construction work in a lot of places and some of the nearby places are closed for it. It looks like that is sorely needed in some of those areas and should make for some great finished projects. At present though the hotel stands a bit in a neighbourhood of building or potential projects. It doesn't affect the hotel's service but the city…,Hotel_Le_Doge-Casablanca_Casablanca_Settat
